"word","ipa","pos","inflections","derivatives","definition","example","collocations","context_type"
"Vague","/ˈveɪɡ/","adj.","vague, more vague, most vague","vaguely (adv.), vagueness (n.)","not clearly understood or expressed","The instructions were vague and left everyone confused about what to do next.","vague idea; vague answer; vague recollection","C2"
"Validate","/ˈvælədeɪt/","v.","validate, validates, validated, validated, validating","validation (n.), valid (adj.)","declare or make legally valid","The court validated the contract, ensuring both parties were legally bound.","validate passport; validate claim; validate theory","C2"
"Vertigo","/ˈvɝtɪˌɡoʊ/","n.","vertigo, vertigos","vertiginous (adj.)","a reeling sensation; a feeling that you are about to fall","The vertigo she experienced on the balcony made her reluctant to look down.","suffer from vertigo; cause vertigo; vertigo symptoms","C2"
"Verify","/ˈvɛɹəˌfaɪ/","v.","verify, verifies, verified, verified, verifying","verification (n.)","confirm the truth of","The detective needed to verify the alibi before moving forward with the investigation.","verify identity; verify information; verify source","C2"
"Waive","/ˈweɪv/","v.","waive, waives, waived, waived, waiving","waiver (n.)","do without or cease to hold or adhere to","The university decided to waive the application fee for low-income students.","waive rights; waive fees; waive requirement","C2"
"Warrant","/ˈwɔɹənt/","n.","warrant, warrants","warrantee (n.), warranter (n.), warrantor (n.)","authorization or justification; an official document issued by a court authorizing action such as a search or arrest","The judge issued a warrant for the arrest of the suspect based on the evidence presented.","search warrant; arrest warrant; issue warrant","C2"
"Vulpine","/ˈvʌlpin/","adj.","vulpine, more vulpine, most vulpine","None","resembling or characteristic of a fox","The vulpine expression on his face hinted at the cunning strategy he was about to unveil.","vulpine cunning; vulpine features; vulpine smile","C2"
"Yield","/ˈjild/","v.","yield, yields, yielded, yielded, yielding","yielder (n.), yielding (n.)","to produce or provide something, such as a result, profit, or crop","The farm expected to yield a bountiful harvest after the long and rainy spring.","yield results; yield profit; yield to pressure","C2"
"Writ","/ˈɹɪt/","n.","writ, writs","None","(law) a legal document issued by a court or judicial officer","The judge signed the writ ordering the immediate release of the wrongfully detained individual.","legal writ; court writ; issue a writ","C2"
"Yeoman","/ˈjoʊmən/","n.","yeoman, yeomen","None","officer in the (ceremonial) bodyguard of the British monarch","As a yeoman, he stood at attention during the monarch's procession, dressed in traditional regalia.","yeoman of the guard; ceremonial yeoman; royal yeoman","C2"
"Yaw","/ˈjɔ/","v.","yaw, yaws, yawed, yawed, yawing","None","to rotate about a vertical axis, causing deviation from a straight course; to swerve or swing to port or starboard","The ship began to yaw dangerously in the storm, causing panic among the passengers.","yaw wide; yaw violently; begin to yaw","C2"
"Yoke","/ˈjoʊk/","n.","yoke, yokes","None","fabric comprising a fitted part at the top of a garment","She adjusted the yoke of her blouse before heading out the door.","shirt yoke; dress yoke; fitted yoke","C2"
"Xenophobia","/ˌzɛnəˈfoʊbiə/","n.","xenophobia, xenophobias","xenophobic (adj.)","a fear of foreigners or strangers","In a time of rising xenophobia, the small town struggled to welcome refugees from overseas.","racial xenophobia; xenophobia towards; rising xenophobia","C2"
"Welter","/ˈwɛltɚ/","v.","welter, welters, weltered, weltered, weltering","None","toss, roll, or rise and fall in an uncontrolled way","The small boat weltered in the stormy sea, tossed by massive waves.","welters in chaos; waves welter; storm welter","C2"
"Aboriginal","/ˌæbɚˈɪdʒənəl/","adj.","no changes","aborigine (n.)","First according to historical or scientific records; original; indigenous; primitive.","Archaeologists discovered aboriginal tools that dated back over 10,000 years.","aboriginal inhabitants; aboriginal culture; aboriginal species","C2"
"Abridge","/əˈbɹɪdʒ/","v.","abridge, abridges, abridged, abridged, abridging","abridgment (n.)","reduce in scope while retaining essential elements","The editor decided to abridge the lengthy novel to make it more accessible to casual readers.","abridge freedom; abridge rights; abridge content","C2"
"Aboveboard","/əˈbʌˌvbɔɹd/","adj.","aboveboard, more aboveboard, most aboveboard","None","without concealment or deception; honest","The transaction was aboveboard, with all parties agreeing to full transparency.","aboveboard dealings; aboveboard transaction; completely aboveboard","C2"
"Zephyr","/ˈzɛfɚ/","n.","zephyr, zephyrs","None","a slight, gentle breeze","A gentle zephyr rustled the leaves, providing a welcome break from the summer heat.","gentle zephyr; refreshing zephyr; summer zephyr","C2"
"Winsome","/ˈwɪnsəm/","adj.","winsome, more winsome, most winsome","winsomeness (n.)","charming in a childlike or naive way","The winsome child charmed everyone at the party with her innocent laughter and playful antics.","winsome charm; winsome smile; winsome personality","C2"
"Zest","/ˈzɛst/","n.","zest, zests","zesty (adj.)","vigorous and enthusiastic enjoyment","He approached the challenge with zest, eager to prove himself in the competitive environment.","add zest; zest for life; full of zest","C2"
"Abstain","/əbˈsteɪn/","v.","abstain, abstains, abstained, abstained, abstaining","abstention (n.), abstinence (n.)","to voluntarily refrain from doing or consuming something; to hold oneself back","Several council members chose to abstain from the vote, citing conflicts of interest.","abstain from voting; abstain from alcohol; abstain from action","C2"
"Abundant","/əˈbʌndənt/","adj.","abundant, more abundant, most abundant","abundance (n.)","present in great quantity","The abundant harvest filled the granaries to capacity, ensuring food security for the coming year.","abundant resources; abundant supply; abundant wildlife","C2"
"Abreast","/əˈbɹɛst/","adj.","abreast, more abreast, most abreast","None","being up to particular standard or level especially in being up to date in knowledge","To stay abreast of the latest developments, she subscribed to several industry journals and attended conferences.","keep abreast; stay abreast; abreast of changes","C2"
"Abut","/əˈbʌt/","v.","abut, abuts, abutted, abutted, abutting","abutment (n.)","lie adjacent to another or share a boundary","The new building will abut the park, providing easy access for visitors.","abut on; property that abuts; land abutting","C2"
"Absolute","/ˈæbsəˌlut/","adj.","no changes","absoluteness (n.)","perfect or complete or pure","His absolute dedication to his craft earned him respect from colleagues and competitors alike.","absolute power; absolute truth; absolute certainty","C2"
"Absorb","/əˈbzɔɹb/","v.","absorb, absorbs, absorbed, absorbed, absorbing","absorber (n.), absorbate (n.), absorbent (adj.), absorbable (adj.), absorption (n.), absorptive (adj.)","become imbued","The sponge quickly absorbed the spilled water, preventing any damage to the wooden floor.","absorb information; absorb impact; absorb nutrients","C2"
"Accentuate","/æˈksɛntʃueɪt/","v.","accentuate, accentuates, accentuated, accentuated, accentuating","accentuation (n.)","to stress, single out as important","The professor sought to accentuate the importance of research ethics during the seminar.","accentuate differences; accentuate features; accentuate importance","C2"
"Accede","/æˈksid/","v.","accede, accedes, acceded, acceded, acceding","accession (n.)","yield to another's wish or opinion","Reluctantly, she acceded to her parents' wishes and agreed to attend law school.","accede to demands; accede to request; accede to pressure","C2"
"Accomplice","/əˈkɑmpləs/","n.","accomplice, accomplices","accomplicity (n.)","a person who helps another carry out an unethical or illegal plan","The detective uncovered evidence linking the accomplice to the crime, leading to multiple arrests.","criminal accomplice; accomplice in crime; unwitting accomplice","C2"
"Abstract","/æbsˈtɹækt/","v.","abstract, abstracts, abstracted, abstracted, abstracting","abstraction (n.), abstractly (adv.)","consider a concept without thinking of a specific example; consider abstractly or theoretically","Philosophers often abstract complex ideas to discuss them in a theoretical framework.","abstract ideas; abstract thinking; abstract concept","C2"
"Accretion","/əˈkɹiʃən/","n.","accretion, accretions","accrete (v.), accretionary (adj.)","an increase by natural growth or addition","The accretion of wealth over time allowed him to retire comfortably.","natural accretion; gradual accretion; accretion of knowledge","C2"
"Accommodate","/əˈkɑməˌdeɪt/","v.","accommodate, accommodates, accommodated, accommodated, accommodating","accommodation (n.), accommodating (v.)","be agreeable or acceptable to","The hotel was able to accommodate the guest's request for a late check-out.","accommodate guests; accommodate requests; accommodate needs","C2"
"Accrue","/əˈkɹu/","v.","accrue, accrues, accrued, accrued, accruing","accrual (n.), accruement (n.)","grow by addition","Interest on the investment will accrue over time, increasing the total return.","accrue interest; accrue benefits; accrue over time","C2"
"Abysmal","/əˈbɪzməl/","adj.","abysmal, more abysmal, most abysmal","abysmally (adv.)","very great; limitless","The abysmal performance of the team led to the coach's resignation.","abysmal failure; abysmal ignorance; abysmal conditions","C2"
"Abstruse","/əbsˈtɹus/","adj.","abstruse, more abstruse, most abstruse","abstruseness (n.)","difficult to penetrate; incomprehensible to one of ordinary understanding or knowledge","The professor's abstruse theories left most of the students baffled.","abstruse theory; abstruse concept; abstruse language","C2"
"Accumulate","/əˈkjumjəˌleɪt/","v.","accumulate, accumulates, accumulated, accumulated, accumulating","accumulation (n.), accumulative (adj.)","To heap up in a mass; to pile up; to collect or bring together (either literally or figuratively), often gradually and without active intent.","Dust accumulated in the abandoned house, covering every surface.","accumulate wealth; accumulate over time; gradually accumulate","C2"
"Adept","/əˈdɛpt/","n.","adept, adepts","adeptness (n.), adeptly (adv.)","highly skilled and proficient in a particular activity; thoroughly expert","As an adept musician, she could play several instruments with ease.","skilled adept; true adept; become an adept","C2"
"Adjunct","/ˈæˌdʒʌŋkt/","n.","adjunct, adjuncts","adjunctive (adj.)","something added to another thing but not an essential part of it","The new annex was an adjunct to the main building, providing additional office space.","useful adjunct; adjunct professor; serve as adjunct","C2"
"Admonish","/æˈdmɑnɪʃ/","v.","admonish, admonishes, admonished, admonished, admonishing","admonition (n.), admonitory (adj.)","admonish or counsel in terms of someone's behavior","The teacher had to admonish the student for disruptive behavior during class.","admonish someone; admonish for behavior; sternly admonish","C2"
"Adversity","/æˈdvɝsɪti/","n.","adversity, adversities","adverse (adj.)","a state of misfortune or affliction","Despite the adversity he faced, he managed to graduate at the top of his class.","face adversity; overcome adversity; times of adversity","C2"
"Adversary","/ˈædvɚˌsɛɹi/","n.","adversary, adversaries","adversarial (adj.)","someone who offers opposition","The young chess player was no match for his more experienced adversary.","worthy adversary; formidable adversary; face an adversary","C2"
"Adulation","/ˌædʒəˈleɪʃən/","n. [U]","no changes","None","servile flattery; exaggerated and hypocritical praise","The celebrity basked in the adulation of his fans, signing autographs and posing for photos.","receive adulation; shower with adulation; excessive adulation","C2"
"Affinity","/əˈfɪnəti/","n.","affinity, affinities","affine (adj.)","(immunology) the attraction between an antigen and an antibody","The affinity between the two antibodies made them effective in fighting the infection.","natural affinity; strong affinity; affinity for something","C2"
"Afflict","/əˈflɪkt/","v.","afflict, afflicts, afflicted, afflicted, afflicting","affliction (n.), afflictive (adj.)","cause great unhappiness for; distress","The loss of her pet afflicted her with deep sadness.","severely afflict; afflict with disease; emotionally afflict","C2"
"Affiliate","/əˈfɪliˌeɪt/","v.","affiliate, affiliates, affiliated, affiliated, affiliating","affiliation (n.)","to bring into close association or connection with a larger organization; to officially attach or link","The organization decided to affiliate with a larger charity to expand its reach.","affiliate with organization; newly affiliated; closely affiliate","C2"
"Aesthetic","/ɛˈsθɛtɪk/","adj.","aesthetic, more aesthetic, most aesthetic","aesthetically (adv.), aestheticism (n.)","concerned with or having an appreciation of beauty, artistic effect, or appearance","The museum's aesthetic appeal was as impressive as its collection, drawing visitors from around the world.","aesthetic appeal; aesthetic value; aesthetic experience","C2"
"Alienate","/ˈeɪljəˌneɪt/","v.","alienate, alienates, alienated, alienated, alienating","alienation (n.)","to cause someone to feel isolated or estranged; to make unfriendly or hostile to oneself","The farmer decided to alienate his land to the neighboring town to fund his retirement.","alienate supporters; alienate friends; alienate voters","C2"
"Aggravate","/ˈæɡɹəˌveɪt/","v.","aggravate, aggravates, aggravated, aggravated, aggravating","aggravation (n.)","make worse","The ongoing conflict only served to aggravate the already tense relations between the two countries.","aggravate the problem; aggravate the situation; aggravate tensions","C2"
"Agitate","/ˈædʒəˌteɪt/","v.","agitate, agitates, agitated, agitated, agitating","agitation (n.), agitator (n.)","try to stir up public opinion","Environmental groups continue to agitate for stricter regulations on industrial emissions.","agitate the public; agitate for change; agitate the crowd","C2"
"Albeit","/ɔˈlbiɪt/","conj.","no changes","None","although; even though; notwithstanding the fact that","Albeit the project faced numerous challenges, the team managed to deliver it on time.","albeit briefly; albeit slowly; albeit with reservations","C2"
"Allegiance","/əˈlidʒəns/","n.","allegiance, allegiances","allegiant (adj.)","the act of binding yourself (intellectually or emotionally) to a course of action","The soldiers swore allegiance to their country and pledged to defend it at all costs.","swear allegiance; pledge allegiance; allegiance to the flag","C2"
"Aggregate","/ˈæɡɹəɡət/","n.","aggregate, aggregates","aggregation (n.)","the whole amount","The aggregate of all donations collected during the charity event exceeded everyone's expectations.","aggregate sum; aggregate score; aggregate data","C2"
"Allege","/əˈlɛdʒ/","v.","allege, alleges, alleged, alleged, alleging","allegation (n.)","to claim or assert that someone has done something illegal or wrong, typically without proof","The witness was called to allege the defendant's involvement in the crime during the trial.","allege wrongdoing; allege a crime; allege misconduct","C2"
"Altruism","/ˈæltɹuˌɪzəm/","n.","altruism, altruisms","altruistic (adj.), altruist (n.)","the quality of unselfish concern for the welfare of others","His altruism was evident in the way he dedicated his life to helping the less fortunate.","act of altruism; altruism in action; display of altruism","C2"
"Ambiguous","/æˈmbɪɡjuəs/","adj.","ambiguous, more ambiguous, most ambiguous","ambiguity (n.), ambiguously (adv.)","open to more than one interpretation; having a double or unclear meaning","The ambiguous statement left everyone wondering whether the company was planning to expand or downsize.","ambiguous statement; ambiguous meaning; ambiguous situation","C2"
"Amass","/əˈmæs/","v.","amass, amasses, amassed, amassed, amassing","None","collect or gather","The museum's curator aimed to amass a comprehensive collection of 19th-century paintings.","amass wealth; amass evidence; amass a fortune","C2"
"Aloof","/əˈluf/","adj.","aloof, more aloof, most aloof","aloofness (n.)","remote in manner","The new professor remained aloof, often eating lunch alone and avoiding casual conversations.","aloof demeanor; aloof attitude; aloof from others","C2"
"Altercation","/ˌɑltɚˈkeɪʃən/","n.","altercation, altercations","altercate (v.)","noisy quarrel","The altercation between the two drivers attracted a crowd and disrupted traffic for hours.","heated altercation; verbal altercation; physical altercation","C2"
"Ambivalent","/æˈmbɪvələnt/","adj.","ambivalent, more ambivalent, most ambivalent","ambivalence (n.)","uncertain or unable to decide about what course to follow","She felt ambivalent about accepting the job offer, as it meant moving away from her family.","ambivalent feelings; ambivalent attitude; ambivalent about the decision","C2"
"Amenable","/əˈmɛnəbəl/","adj.","amenable, more amenable, most amenable","amenability (n.)","disposed or willing to comply","The students were amenable to the idea of a field trip, as long as it didn't interfere with their exams.","amenable to change; amenable to reason; amenable to suggestions","C2"
"Anarchy","/ˈænɚki/","n.","anarchy, anarchies","anarchic (adj.), anarchist (n.)","a state of lawlessness and disorder, often from the collapse of government","The country descended into anarchy after the government collapsed and armed groups took control.","state of anarchy; descend into anarchy; anarchy in the streets","C2"
"Ameliorate","/əˈmiljɚˌeɪt/","v.","ameliorate, ameliorates, ameliorated, ameliorated, ameliorating","amelioration (n.)","to make better","The new policies were designed to ameliorate the living conditions of low-income families.","ameliorate the situation; ameliorate conditions; ameliorate the problem","C2"
"Anecdote","/ˈænəˌkdoʊt/","n.","anecdote, anecdotes","anecdotal (adj.)","a short, often amusing account of a real incident","The author shared an anecdote about his childhood during the interview, which amused the audience.","tell an anecdote; humorous anecdote; share an anecdote","C2"
"Amicable","/ˈæmɪkəbəl/","adj.","amicable, more amicable, most amicable","amicability (n.), amicably (adv.)","characterized by friendship and good will","The two neighbors resolved their dispute in an amicable manner, agreeing to share the cost of the repairs.","amicable settlement; amicable relationship; amicable divorce","C2"
"Amorphous","/əˈmɔɹfəs/","adj.","amorphous, more amorphous, most amorphous","amorphously (adv.)","having no definite form or distinct shape","The amorphous clouds drifted across the sky, constantly changing shape.","amorphous mass; amorphous structure; amorphous material","C2"
"Analogous","/əˈnæləɡəs/","adj.","analogous, more analogous, most analogous","analogy (n.), analogue (n.)","similar or equivalent in some respects though otherwise dissimilar","The way a computer stores data is analogous to how the human brain processes information.","analogous situation; analogous example; analogous relationship","C2"
"Anathema","/əˈnæθəmə/","n. [U]","no changes","anathematize (v.)","a detested or cursed thing; a formal curse or excommunication","In some cultures, being disloyal is considered an anathema punishable by exile.","anathema to someone; regarded as anathema; considered anathema","C2"
"Amiable","/ˈeɪmiəbəl/","adj.","amiable, more amiable, most amiable","amiability (n.), amiably (adv.)","disposed to please","The waiter was so amiable that all the customers left the restaurant in a good mood.","amiable personality; amiable demeanor; amiable disposition","C2"
"Anguish","/ˈæŋɡwɪʃ/","v.","anguish, anguishes, anguished, anguished, anguishing","None","suffer great pains or distress","She would anguish over every decision, fearing the consequences of making the wrong choice.","anguish over something; cause anguish; feel anguish","C2"
"Animosity","/ˌænəˈmɑsəti/","n.","animosity, animosities","None","a feeling of ill will arousing active hostility","The animosity between the two colleagues was obvious to everyone in the office.","animosity towards someone; deep animosity; harbor animosity","C2"
"Antagonism","/æˈntæɡəˌnɪzəm/","n.","antagonism, antagonisms","antagonistic (adj.), antagonist (n.), antagonize (v.)","a state of deep-seated ill-will","The long-standing antagonism between the two nations finally erupted into war.","antagonism between parties; foster antagonism; mutual antagonism","C2"
"Annihilate","/əˈnaɪəˌleɪt/","v.","annihilate, annihilates, annihilated, annihilated, annihilating","annihilation (n.)","to destroy completely; to reduce to nothing; to obliterate entirely","The invading army sought to annihilate all resistance, leaving no survivors.","annihilate the enemy; annihilate the competition; completely annihilate","C2"
"Appease","/əˈpiz/","v.","appease, appeases, appeased, appeased, appeasing","appeasement (n.)","cause to be more favorably inclined; gain the good will of","The teacher tried to appease the angry parents by explaining the new grading policy.","appease someone's anger; appease someone's fears; appease someone's hunger","C2"
"Apocryphal","/əˈpɑkɹəfəl/","adj.","apocryphal, more apocryphal, most apocryphal","apocrypha (n.)","being of questionable authenticity","The story about George Washington and the cherry tree is likely apocryphal.","apocryphal story; apocryphal legend; apocryphal tale","C2"
"Apathy","/ˈæpəθi/","n. [U]","no changes","apathetic (adj.)","an absence of emotion or enthusiasm","After the accident, she felt a deep apathy towards driving and avoided it completely.","complete apathy; political apathy; widespread apathy","C2"
"Archaic","/ɑˈɹkeɪɪk/","adj.","archaic, more archaic, most archaic","None","so extremely old as seeming to belong to an earlier period","The archaic language of the text made it difficult for modern readers to understand.","archaic language; archaic customs; archaic laws","C2"
"Anomaly","/əˈnɑməli/","n.","anomaly, anomalies","anomalous (adj.)","deviation from the normal or common order or form or rule","The anomaly in the data set was discovered during a routine analysis.","anomaly in the data; statistical anomaly; genetic anomaly","C2"
"Antipathy","/æˈntɪpəθi/","n.","antipathy, antipathies","antipathetic (adj.)","a feeling of intense dislike","Her antipathy towards public speaking was evident in her trembling voice and sweaty palms.","feel antipathy; strong antipathy; mutual antipathy","C2"
"Archetype","/ˈɑɹkɪˌtaɪp/","n.","archetype, archetypes","archetypal (adj.)","something that serves as a model or a basis for making copies","The hero in the story is an archetype of the brave knight, embodying all the classic virtues.","archetype of something; classic archetype; serve as archetype","C2"
"Ardent","/ˈɑɹdənt/","adj.","ardent, more ardent, most ardent","ardor (n.), ardently (adv.)","characterized by intense emotion","His ardent love for music drove him to practice the piano for hours every day.","ardent supporter; ardent desire; ardent passion","C2"
"Ascetic","/əˈsɛtɪk/","adj.","ascetic, more ascetic, most ascetic","asceticism (n.)","pertaining to or characteristic of an ascetic or the practice of rigorous self-discipline","The monk's ascetic lifestyle included fasting, meditation, and strict self-discipline.","ascetic lifestyle; ascetic practices; ascetic discipline","C2"
"Approbation","/ˌæpɹəˈbeɪʃən/","n.","approbation, approbations","approbate (v.)","official approval","The new policy changes received approbation from the board of directors.","win approbation; receive approbation; gain approbation","C2"
"Ascribe","/əsˈkɹaɪb/","v.","ascribe, ascribes, ascribed, ascribed, ascribing","ascription (n.)","attribute or credit to","He ascribed his success to the support of his family and mentors.","ascribe to someone; ascribe to something; ascribe meaning","C2"
"Arbitrary","/ˈɑɹbəˌtɹɛɹi/","adj.","arbitrary, more arbitrary, most arbitrary","arbitrariness (n.), arbitrarily (adv.)","based on or subject to individual discretion or preference or sometimes impulse or caprice","The judge's ruling seemed arbitrary, lacking clear reasoning or consistency.","arbitrary decision; arbitrary rule; arbitrary power","C2"
"Arcane","/ˌɑˈɹkeɪn/","adj.","arcane, more arcane, most arcane","None","requiring secret or mysterious knowledge","The arcane rituals of the secret society were known only to its members.","arcane knowledge; arcane secrets; arcane rituals","C2"
"Artifice","/ˈɑɹtəfɪs/","n.","artifice, artifices","artificial (adj.), artificer (n.)","clever or cunning devices or expedients used to trick or deceive; crafty skill employed to gain an advantage","The thief used artifice to escape, creating a diversion to distract the guards.","employ artifice; clever artifice; use artifice","C2"
"Atone","/əˈtoʊn/","v.","atone, atones, atoned, atoned, atoning","atonement (n.)","make amends for","After causing a car accident, he worked hard to atone by volunteering at a local charity.","atone for sins; atone for mistakes; atone for wrongdoing","C2"
