"word","ipa","pos","inflections","derivatives","definition","example","collocations","context_type"
"Respite","/ˈɹɛspɪt/","n. [U]","no changes","None","a (temporary) relief from harm or discomfort","The doctor advised her to take a brief respite from work to recover her strength.","brief respite; temporary respite; respite from pain","C2"
"Revel","/ˈɹɛvəl/","v.","revel, revels, reveled, reveled, reveling","revelry (n.), reveller (n.)","take delight in","She loved to revel in the joys of a quiet evening with a good book.","revel in success; revel in glory; revel in luxury","C2"
"Resilient","/ɹɪˈzɪljənt/","adj.","resilient, more resilient, most resilient","resilience (n.), resiliency (n.)","recovering readily from adversity, depression, or the like","Despite facing numerous setbacks, he remained resilient and determined to succeed.","resilient nature; resilient personality; resilient to change","C2"
"Retract","/ɹiˈtɹækt/","v.","retract, retracts, retracted, retracted, retracting","retractor (n.), retraction (n.)","formally reject or disavow a formerly held belief, usually under pressure","Under pressure from the media, the politician was forced to retract his previous statement.","retract a statement; retract a claim; retract a confession","C2"
"Resplendent","/ɹisˈplɛndənt/","adj.","resplendent, more resplendent, most resplendent","resplendence (n.), resplendently (adv.)","having great beauty and splendor","The ballroom was resplendent with crystal chandeliers and golden decorations.","resplendent in gold; resplendent attire; resplendent palace","C2"
"Retribution","/ˌɹɛtɹəˈbjuʃən/","n.","retribution, retributions","retributive (adj.)","punishment inflicted as a just penalty for wrongdoing; retaliatory justice","The victims demanded retribution for the crimes committed against them.","seek retribution; swift retribution; retribution for crimes","C2"
"Restive","/ˈɹɛstɪv/","adj.","restive, more restive, most restive","restiveness (n.), restively (adv.)","being in a tense state","The restive crowd grew impatient waiting for the concert to begin.","restive crowd; restive behavior; restive mood","C2"
"Rhetoric","/ˈɹɛtɚɪk/","n. [U]","no changes","rhetorical (adj.), rhetorically (adv.)","using language effectively to please or persuade","The politician's rhetoric was so persuasive that it swayed many voters.","political rhetoric; empty rhetoric; rhetoric of war","C2"
"Rococo","/ɹəˈkoʊˌkoʊ/","n.","rococo, rococos","None","fanciful but graceful asymmetric ornamentation in art and architecture that originated in France in the 18th century","The rococo style, with its fanciful and graceful ornamentation, can be seen in the interiors of many 18th-century French palaces.","rococo style; rococo architecture; rococo design","C2"
"Reverberate","/ɹɪˈvɝbɚət/","v.","reverberate, reverberates, reverberated, reverberated, reverberating","reverberation (n.)","ring or echo with sound","The sound of the church bells reverberated through the entire valley, reaching every distant home.","reverberate through; reverberate across; reverberate with sound","C2"
"Reticent","/ˈɹɛtɪsənt/","adj.","reticent, more reticent, most reticent","reticence (n.), reticently (adv.)","temperamentally disinclined to talk","Despite the lively conversation around him, John remained reticent, only occasionally offering brief comments.","reticent personality; reticent about; reticent nature","C2"
"Rudimentary","/ˌɹudəˈmɛntɚi/","adj.","rudimentary, more rudimentary, most rudimentary","rudiment (n.)","being or involving basic facts or principles","The course covers rudimentary concepts in physics, ensuring all students have a solid foundation before moving on to more complex topics.","rudimentary knowledge; rudimentary understanding; rudimentary skills","C2"
"Rustic","/ˈɹʌstɪk/","adj.","rustic, more rustic, most rustic","rusticity (n.), rustically (adv.)","characteristic of rural life","The rustic charm of the countryside cottage was enhanced by its wooden beams and stone fireplace.","rustic charm; rustic setting; rustic appearance","C2"
"Rife","/ˈɹaɪf/","adj.","rife, more rife, most rife","None","most frequent or common","Rumors were rife in the small town, with everyone having a different theory about the mysterious events.","rife with; rife in; rife throughout","C2"
"Ruminate","/ˈɹumɪˌneɪt/","v.","ruminate, ruminates, ruminated, ruminated, ruminating","rumination (n.), ruminative (adj.)","to think deeply and carefully over a matter; to ponder or meditate at length","The cows in the pasture continued to ruminate, slowly chewing their cud as they watched the world go by.","ruminate on; ruminate about; ruminate over","C2"
"Robust","/ɹoʊˈbʌst/","adj.","robust, more robust, most robust","robustly (adv.), robustness (n.)","Able to withstand adverse conditions.","The robust economy showed resilience, withstanding the adverse effects of the global financial crisis.","robust economy; robust health; robust system","C2"
"Sacrosanct","/ˈsækɹoʊsæŋkt/","adj.","no changes","sacrosanctity (n.)","must be kept sacred","In many cultures, the institution of marriage is considered sacrosanct, with traditions and rituals that reflect its sacred nature.","sacrosanct tradition; sacrosanct law; sacrosanct principle","C2"
"Sagacious","/səˈɡeɪʃiəs/","adj.","sagacious, more sagacious, most sagacious","sagacity (n.), sagaciously (adv.)","acutely insightful and wise","The sagacious old man offered advice that was both insightful and wise, drawing on years of experience and observation.","sagacious leader; sagacious decision; sagacious advice","C2"
"Sanction","/ˈsæŋkʃən/","n.","sanction, sanctions","sanctionative (adj.)","formal and explicit approval","The city council's sanction was required before the construction project could begin.","impose sanctions; lift sanctions; economic sanctions","C2"
"Sanguine","/ˈsæŋɡwɪn/","adj.","sanguine, more sanguine, most sanguine","sanguinely (adv.), sanguinity (n.)","confidently optimistic and cheerful","Despite the challenges, the team remained sanguine about their chances of winning the championship.","sanguine outlook; sanguine mood; remain sanguine","C2"
"Salutary","/ˈsæljəˌtɛɹi/","adj.","salutary, more salutary, most salutary","None","tending to promote physical well-being; beneficial to health","Regular exercise has a salutary effect on both physical and mental health.","salutary effect; salutary influence; salutary advice","C2"
"Salient","/ˈseɪliənt/","adj.","salient, more salient, most salient","salience (n.), saliently (adv.)","having a quality that thrusts itself into attention","The salient feature of the new design was its sleek and modern appearance.","salient feature; salient point; salient detail","C2"
"Sardonic","/sɑˈɹdɑnɪk/","adj.","sardonic, more sardonic, most sardonic","sardonically (adv.)","disdainfully or ironically humorous; scornful and mocking","His sardonic remarks about the political situation left the audience both amused and slightly uncomfortable.","sardonic smile; sardonic humor; sardonic remark","C2"
"Saturnine","/ˈsætənaɪn/","adj.","saturnine, more saturnine, most saturnine","None","bitter or scornful","The saturnine detective rarely smiled, preferring to maintain a serious demeanor.","saturnine expression; saturnine disposition; saturnine personality","C2"
"Salubrious","/səˈlu.bɹi.əs/","adj.","salubrious, more salubrious, most salubrious","salubriously (adv.), salubriousness (n.)","promoting health; healthful","The salubrious climate of the mountains attracted many people seeking a healthier lifestyle.","salubrious environment; salubrious climate; salubrious effect","C2"
"Scathing","/ˈskeɪðɪŋ/","adj.","scathing, more scathing, most scathing","scathingly (adv.)","marked by harshly abusive criticism","The scathing review of the restaurant left no doubt about the critic's opinion of the food.","scathing criticism; scathing review; scathing attack","C2"
"Savant","/səˈvɑnt/","n.","savant, savants","None","a person of exceptional intellectual or creative ability, especially in one specific domain","As a savant in the field of astrophysics, she was often invited to speak at international conferences.","renowned savant; distinguished savant; academic savant","C2"
"Secular","/ˈsɛkjəlɚ/","adj.","secular, more secular, most secular","secularism (n.), secularize (v.)","of or relating to the doctrine that rejects religion and religious considerations","The university's secular approach to education focused on science and reason rather than religious doctrine.","secular society; secular worldview; secular values","C2"
"Scintilla","/sɪˈntɪlə/","n.","scintilla, scintillas","scintillate (v.), scintillating (v.)","a tiny or scarcely detectable amount","There was not a scintilla of evidence to support the allegations made against him.","scintilla of doubt; scintilla of evidence; not a scintilla","C2"
"Scrupulous","/ˈskɹupjələs/","adj.","scrupulous, more scrupulous, most scrupulous","scrupulously (adv.), scruple (n.)","having scruples; arising from a sense of right and wrong; principled","Her scrupulous attention to detail ensured that the project was completed with the utmost accuracy.","scrupulous attention; scrupulous honesty; scrupulous adherence","C2"
"Sedate","/sɪˈdeɪt/","adj.","sedate, more sedate, most sedate","sedation (n.), sedative (adj.), sedateness (n.)","characterized by dignity and propriety","The sedate atmosphere of the library encouraged quiet study and reflection.","sedate manner; sedate pace; sedate atmosphere","C2"
"Seminal","/ˈsɛmənəl/","adj.","seminal, more seminal, most seminal","None","highly influential and providing the basis for future development; groundbreaking","The scientist's seminal research on genetics paved the way for future discoveries in the field.","seminal work; seminal idea; seminal paper","C2"
"Sentient","/ˈsɛn.ʃi.ənt/","adj.","no changes","sentience (n.), sentiency (n.)","endowed with feeling and unstructured consciousness","As a sentient being, she was deeply aware of the emotions and experiences of those around her.","sentient being; sentient creature; sentient life","C2"
"Scurrilous","/ˈskɝələs/","adj.","scurrilous, more scurrilous, most scurrilous","scurrility (n.)","expressing offensive reproach","The politician's scurrilous comments about his opponent were condemned by both parties.","scurrilous attack; scurrilous language; scurrilous remark","C2"
"Sentinel","/ˈsɛntənəl/","n.","sentinel, sentinels","None","a person employed to keep watch for some anticipated event","The sentinel stood watch throughout the night, alert to any sign of danger.","sentinel duty; vigilant sentinel; sentinel post","C2"
"Sedulous","/ˈsɛdʒʊləs/","adj.","sedulous, more sedulous, most sedulous","sedulously (adv.), sedulity (n.)","marked by care and persistent effort","His sedulous work ethic earned him a reputation as one of the most dedicated employees in the company.","sedulous effort; sedulous pursuit; sedulous attention","C2"
"Semblance","/ˈsɛmbləns/","n.","semblance, semblances","None","an outward or token appearance or form that is deliberately misleading","The semblance of normality was shattered when the true extent of the corruption was revealed.","semblance of order; mere semblance; deceptive semblance","C2"
"Serpentine","/ˈsɝpəˌntaɪn/","adj.","serpentine, more serpentine, most serpentine","None","resembling a serpent in form","The garden path had a serpentine design, winding gracefully through the flower beds.","serpentine movement; serpentine shape; serpentine path","C2"
"Servile","/ˈsɝvəl/","adj.","servile, more servile, most servile","servility (n.), servilely (adv.)","submissive or fawning in attitude or behavior","The servile attitude of the assistant was off-putting to those who valued independence and respect.","servile attitude; servile behavior; servile submission","C2"
"Sextant","/ˈsɛk.stənt/","n.","sextant, sextants","None","a navigational instrument for measuring angular distances between objects, used to determine latitude and longitude at sea","Using a sextant, the navigator calculated the ship's position with precision.","navigate with a sextant; sextant reading; use a sextant","C2"
"Sibilant","/ˈsɪb.ɪ.lənt/","n.","sibilant, sibilants","sibilate (v.)","a consonant characterized by a hissing sound (like s or sh)","The sibilant sound of the wind through the trees added to the eerie atmosphere of the night.","sibilant sound; sibilant hiss; sibilant consonant","C2"
"Serendipity","/ˌsɛɹəˈndɪpɪti/","n.","serendipity, serendipities","serendipitous (adj.), serendipitously (adv.)","good luck in making unexpected and fortunate discoveries","Their meeting was a stroke of serendipity, leading to a successful business partnership.","stroke of serendipity; serendipity moment; serendipity discovery","C2"
"Skeptical","/ˈskɛptəkəl/","adj.","skeptical, more skeptical, most skeptical","skepticism (n.), skeptically (adv.)","denying or questioning the tenets of especially a religion","The professor took a skeptical view of the new theory, demanding more evidence before accepting it.","skeptical view; skeptical stance; skeptical of claims","C2"
"Sinecure","/ˈsaɪ.nəˌkjʊɹ/","n.","sinecure, sinecures","None","a position that requires little or no work but provides an ample salary or reward; a cushy job","The wealthy patron was given a sinecure as a churchwarden, requiring no actual work but providing a generous income.","lucrative sinecure; cushy sinecure; sought-after sinecure","C2"
"Sinuous","/ˈsɪnwəs/","adj.","sinuous, more sinuous, most sinuous","sinuosity (n.), sinuousness (n.)","curved or curving in and out","The snake moved in a sinuous pattern through the grass, its body curving gracefully with each movement.","sinuous river; sinuous dance; sinuous path","C2"
"Solicitous","/səˈlɪsətəs/","adj.","solicitous, more solicitous, most solicitous","solicitude (n.), solicitously (adv.)","full of anxiety and concern","The parents were solicitous about their child's health, constantly checking for any signs of illness after the outbreak.","solicitous parent; solicitous concern; solicitous care","C2"
"Saturate","/ˈsætʃɚˌeɪt/","v.","saturate, saturates, saturated, saturated, saturating","saturation (n.)","cause (a chemical compound, vapour, solution, magnetic material) to unite with the greatest possible amount of another substance","The sponge quickly saturated with water, absorbing as much as it could hold.","saturate with water; saturate the market; saturate the solution","C2"
"Sequester","/sɪˈkwɛstɚ/","v.","sequester, sequesters, sequestered, sequestered, sequestering","sequestration (n.)","to isolate or set apart; to remove or withdraw from general access or influence","During the war, the government decided to sequester the enemy's assets to prevent them from funding further conflict.","sequester a jury; sequester assets; sequester property","C2"
"Solicit","/səˈlɪsɪt/","v.","solicit, solicits, solicited, solicited, soliciting","solicitor (n.), solicitation (n.)","make a solicitation or entreaty for something; request urgently or persistently","The charity worker continued to solicit donations, urging people to contribute whatever they could to the cause.","solicit donations; solicit feedback; solicit support","C2"
"Sinewy","/ˈsɪnjui/","adj.","sinewy, more sinewy, most sinewy","sinew (n.)","lean and muscular; tough and strong; possessing wiry physical strength","The sinewy texture of the beef brisket made it challenging to chew, even after hours of slow cooking.","sinewy texture; sinewy meat; sinewy arms","C2"
"Skittish","/ˈskɪtɪʃ/","adj.","skittish, more skittish, most skittish","skittishness (n.)","easily startled or frightened; nervously excitable and difficult to control","The skittish colt danced around the corral, its movements unpredictable and full of nervous energy.","skittish horse; skittish behavior; skittish market","C2"
"Somber","/ˈsɑmbɚ/","adj.","somber, more somber, most somber","somberly (adv.), somberness (n.)","lacking brightness or color; dull","The somber atmosphere at the funeral was broken only by occasional quiet sobs from the mourners.","somber mood; somber expression; somber atmosphere","C2"
"Sate","/ˈseɪt/","v.","sate, sates, sated, sated, sating","None","fill to satisfaction","After a long day of hiking, the meal of steak and potatoes served to sate their hunger completely.","sate hunger; sate curiosity; sate appetite","C2"
"Sonorous","/ˈsɑnɚəs/","adj.","sonorous, more sonorous, most sonorous","sonority (n.), sonorousness (n.)","full and loud and deep","The priest's sonorous voice echoed through the cathedral, reaching every corner with its deep resonance.","sonorous voice; sonorous sound; sonorous speech","C2"
"Scrutinize","/ˈskɹutəˌnaɪz/","v.","scrutinize, scrutinizes, scrutinized, scrutinized, scrutinizing","scrutiny (n.), scrutinizer (n.)","to look at critically or searchingly, or in minute detail","The detective scrutinized the evidence, looking for any small detail that might solve the case.","scrutinize evidence; scrutinize closely; scrutinize data","C2"
"Sporadic","/spɚˈædɪk/","adj.","sporadic, more sporadic, most sporadic","sporadically (adv.)","recurring in scattered and irregular or unpredictable instances","Sporadic outbreaks of flu kept the clinic busy throughout the winter.","sporadic outbreaks; sporadic rain; sporadic incidents","C2"
"Sophisticated","/səˈfɪstəˌkeɪtɪd/","adj.","sophisticated, more sophisticated, most sophisticated","sophistication (n.)","having or showing refined knowledge, taste, or complexity; technologically advanced","The new system uses sophisticated algorithms to detect fraud in real time.","sophisticated technology; sophisticated palate; sophisticated audience","C2"
"Spurious","/ˈspjʊɹiəs/","adj.","spurious, more spurious, most spurious","spuriously (adv.), spuriousness (n.)","plausible but false","The spurious claim that the product was organic was quickly debunked by consumer advocacy groups.","spurious claim; spurious argument; spurious evidence","C2"
"Squander","/ˈskwɑndɚ/","v.","squander, squanders, squandered, squandered, squandering","squanderer (n.)","spend thoughtlessly; throw away","He squandered his inheritance on frivolous purchases, leaving himself with nothing after just a few years.","squander an opportunity; squander money; squander resources","C2"
"Somnolent","/ˈsɑmnələnt/","adj.","somnolent, more somnolent, most somnolent","somnolence (n.)","inclined to or marked by drowsiness","The somnolent cat lay curled up on the windowsill, barely stirring even when the doorbell rang.","somnolent state; somnolent afternoon; somnolent feeling","C2"
"Sordid","/ˈsɔɹdəd/","adj.","sordid, more sordid, most sordid","sordidly (adv.), sordidness (n.)","morally degraded","The sordid details of the scandal shocked the community, revealing a side of the politician they had never seen.","sordid affair; sordid history; sordid details","C2"
"Specious","/ˈspiʃəs/","adj.","specious, more specious, most specious","speciously (adv.), speciousness (n.)","plausible but false","The specious argument, though convincing at first, fell apart under closer scrutiny, revealing its flaws.","specious argument; specious reasoning; specious claim","C2"
"Squalid","/ˈskwɑləd/","adj.","squalid, more squalid, most squalid","squalidness (n.)","morally degraded","The squalid conditions of the abandoned building made it unsafe for habitation.","squalid conditions; squalid living; squalid environment","C2"
"Soporific","/ˌsɑp.əˈɹɪf.ɪk/","adj.","soporific, more soporific, most soporific","soporifically (adv.)","sleep inducing","The soporific lecture on economic theory had many students nodding off.","soporific effect; soporific drug; soporific lecture","C2"
"Subpoena","/səˈpinə/","v.","subpoena, subpoenas, subpoenaed, subpoenaed, subpoenaing","None","serve or summon with a subpoena","The lawyer was subpoenaed to testify in the high-profile court case.","subpoena issued; subpoena served; subpoena received","C2"
"Subsequent","/ˈsʌbsəkwənt/","adj.","no changes","subsequence (n.), subsequentness (n.)","following in time or order","Subsequent events proved that their initial decision had been the correct one.","subsequent events; subsequent actions; subsequent development","C2"
"Satiate","/ˈsæʃət/","v.","satiate, satiates, satiated, satiated, satiating","satiety (n.), satiation (n.)","fill to satisfaction","After a long day of hiking, the meal completely satiated their hunger.","satiate hunger; satiate desire; satiate appetite","C2"
"Sundry","/ˈsʌndɹi/","adj.","sundry, no changes","None","consisting of a haphazard assortment of different kinds","The shop carried sundry items, from groceries to household goods, catering to diverse needs.","sundry items; sundry topics; sundry occasions","C2"
"Synthetic","/sɪˈnθɛtɪk/","adj.","no changes","synthesis (n.)","produced by chemical synthesis rather than derived from a natural source; artificially made","The synthetic fabric was designed to mimic the properties of natural fibers while being more durable.","synthetic materials; synthetic drugs; synthetic fibers","C2"
"Sustain","/səˈsteɪn/","v.","sustain, sustains, sustained, sustained, sustaining","sustainer (n.), sustenance (n.), sustainable (adj.), sustainment (n.)","lengthen or extend in duration or space","The team's efforts to sustain their winning streak paid off as they clinched another victory.","sustain an injury; sustain a relationship; sustain growth","C2"
"Tardy","/ˈtɑɹdi/","adj.","tardy, tardier, tardiest","tardiness (n.)","after the expected or usual time; delayed","The tardy student rushed into class, apologizing for being late due to the traffic.","tardy arrival; tardy response; tardy student","C2"
"Terrestrial","/tɚˈɛstɹiəl/","adj.","no changes","None","of or relating to or inhabiting the land as opposed to the sea or air","The study focused on terrestrial ecosystems and their impact on climate change.","terrestrial environment; terrestrial species; terrestrial habitat","C2"
"Therapeutic","/ˌθɛɹəˈpjutɪk/","adj.","therapeutic, more therapeutic, most therapeutic","therapeutically (adv.), therapy (n.)","tending to cure or restore to health","The therapeutic massage helped relieve the tension in his shoulders after a long week.","therapeutic treatment; therapeutic effect; therapeutic properties","C2"
"Terminal","/ˈtɝmənəl/","adj.","no changes","None","occurring at or forming the end; fatal and leading to death; situated at the furthest point","The terminal delivery driver was responsible for the last leg of the parcel's journey.","terminal illness; terminal station; terminal velocity","C2"
"Transcribe","/tɹænsˈkɹaɪb/","v.","transcribe, transcribes, transcribed, transcribed, transcribing","transcriber (n.), transcription (n.)","write out from speech, notes, etc.","The secretary was tasked with transcribing the meeting's minutes for distribution to all attendees.","transcribe an interview; transcribe notes; transcribe a recording","C2"
"Tribute","/ˈtɹɪbjut/","n.","tribute, tributes","None","something given or done as an expression of esteem","The town paid tribute to the fallen hero by naming the new library after him.","pay tribute; receive tribute; tribute concert","C2"
"Trophy","/ˈtɹoʊfi/","n.","trophy, trophies","None","an object awarded as a symbol of victory or achievement in a competition; a prize or token of success","The football team proudly displayed their championship trophy in the school hall.","win a trophy; trophy case; hunting trophy","C2"
"Transparent","/tɹænˈspɛɹənt/","adj.","transparent, more transparent, most transparent","transparence (n.), transparency (n.), transparentness (n.)","transmitting light; able to be seen through with clarity","The transparent glass walls of the conference room offered a clear view of the city skyline.","transparent glass; transparent process; transparent policy","C2"
"Ulterior","/əˈltɪɹiɚ/","adj.","ulterior, more ulterior, most ulterior","None","intentionally concealed so as to deceive; existing beyond what is openly stated or admitted","She suspected there was an ulterior motive behind his sudden kindness.","ulterior motive; ulterior purpose; ulterior agenda","C2"
"Uniformity","/ˌjunəˈfɔɹməti/","n. [U]","no changes","uniform (adj.)","a condition in which everything is regular and unvarying","The school's strict uniformity in dress code aimed to minimize social distinctions among students.","uniformity in design; strict uniformity; achieve uniformity","C2"
"Unilateral","/ˌjunəˈlætɚəl/","adj.","no changes","None","involving only one part or side","The CEO made a unilateral decision to change the company's direction without consulting the board.","unilateral decision; unilateral action; unilateral agreement","C2"
"Unique","/juˈnik/","adj.","no changes","uniqueness (n.)","radically distinctive and without equal","Each snowflake is unique, with its own intricate pattern and shape.","truly unique; unique opportunity; unique perspective","C2"
"Unflappable","/ənˈflæpəbəl/","adj.","unflappable, more unflappable, most unflappable","None","not easily perturbed or excited or upset; marked by extreme calm and composure","Even in the midst of the crisis, the captain remained unflappable and focused.","unflappable demeanor; unflappable composure; unflappable calm","C2"
"Utopia","/juˈtoʊpiə/","n.","utopia, utopias","utopian (adj.)","an imagined ideal society in which everything is perfect and everyone lives in harmony","In his book 'Utopia', Thomas More envisioned a fictional island society that has intrigued readers for centuries.","search for utopia; utopia vs dystopia; dream of utopia","C2"
