"word","ipa","pos","inflections","derivatives","definition","example","collocations","context_type"
"Connect","/kəˈnɛkt/","v.","connect, connects, connected, connected, connecting","connecter (n.), connector (n.), connexion (n.), connection (n.), connective (adj.)","connect, fasten, or put together two or more pieces","Please connect the printer to the computer before you start.","really connect; connect together; stay connect","B1"
"Conscious","/ˈkɑnʃəs/","adj.","no changes","consciousness (n.)","intentionally conceived","Transhumanists argue that super-intelligent but unfeeling AI is more dangerous than conscious ones because only empathy can provide a shared moral compass.","conscious helpful responses; deliberate conscious; fully conscious","B1"
"Crane","/ˈkɹeɪn/","n.","crane, cranes","None","United States writer (1871-1900)","We'd have to bring cranes in and things that.","bring crane; crane onto; crane operator detective","B1"
"Cough","/ˈkɑf/","v.","cough, coughs, coughed, coughed, coughing","coughing (n.)","exhale abruptly, as when one has a chest cold or congestion","He began to cough loudly because of the thick dust in the room.","whooping cough; cough sneezing; cough crying","B1"
"Controller","/kənˈtɹoʊlɚ/","n.","controller, controllers","control (v.), controllership (n.)","someone who maintains and audits business accounts","He pressed the green button on the game controller to start.","xbox controller; learned controller; stance controller","B1"
"Constant","/ˈkɑnstənt/","adj.","constant, more constant, most constant","constantly (adv.), constancy (n.)","unvarying in nature","The whole game there's a constant buzz.","constant flow; constant reminder; constant use","B1"
"Cradle","/ˈkɹeɪdəl/","n.","cradle, cradles","None","a baby bed with sides and rockers","That's really interesting that there's multiple cradles of civilization, not one, one good idea, that those ideas naturally come up.","sixth cradle; multiple cradle; possible cradle","B1"
"County","/ˈkaʊnti/","n.","county, counties","None","(United Kingdom) a region created by territorial division for the purpose of local government","In other words: Wakulla County and places it may already have more access to healthcare today than they will for decades to come.","alameda county; switch county; county kenya","B1"
"Crab","/ˈkɹæb/","n.","crab, crabs","crabby (adj.)","decapod having eyes on short stalks and a broad flattened carapace with a small abdomen folded under the thorax and pincers","It's jammed into the level and it lifts up and it's a giant mutated hermit crab using a giant aircraft carrier as his shell.","gang crab; crab using; mutated hermit crab","B1"
"Crawl","/ˈkɹɔl/","v.","crawl, crawls, crawled, crawled, crawling","crawler (n.), crawling (n.)","move slowly; in the case of people or animals with the body near the ground","The baby learned to crawl across the floor before she could walk.","ant crawl; crawl over; crawl up","B1"
"Creative","/kɹiˈeɪtɪv/","adj.","creative, more creative, most creative","create (v.), creativity (n.), creativeness (n.)","having the ability or power to create","The art teacher always finds creative ways to keep her students interested.","creative teams; creative ideas; creative before","B1"
"Cricket","/ˈkɹɪkət/","n.","cricket, crickets","cricketer (n.)","leaping insect; male makes chirping noises by rubbing the forewings together","A cricket chirped loudly in the garden all through the warm summer night.","a chirping cricket; catch a cricket; hear the cricket","B1"
"Crash","/ˈkɹæʃ/","n.","crash, crashes","crasher (n.)","a loud resonant repeating noise","We heard a loud crash when the heavy box fell off the shelf.","wall street crash; crash landing; crash over","B1"
"Crash","/ˈkɹæʃ/","v.","crash, crashes, crashed, crashed, crashing","crasher (n.)","fall or come down violently","Crashing out refers to a sudden emotional meltdown or giving up dramatically after a period of extreme stress or hype.","wall street crash; crash course; crash over","B1"
"Creator","/kɹiˈeɪtɚ/","n.","creator, creators","create (v.)","terms referring to the Judeo","The young creator of the popular game shared his ideas online.","favorite creator; pattern creator; entrepreneurs creator","B1"
"Crispy","/ˈkɹɪspi/","adj.","crispy, crispier, crispiest","crisp (n.), crispiness (n.)","tender and brittle","The chicken was hot, golden and wonderfully crispy on the outside.","crispy onions; crispy outside; too crispy","B1"
"Crew","/ˈkɹu/","n.","crew, crews","None","the men and women who man a vehicle (ship, aircraft, etc.)","My dad put things in context when I asked him what he loved the most about watching the production crew in here.","crew members; whole crew; artemis ii crew","B1"
"Credit","/ˈkɹɛdət/","n.","credit, credits","creditor (n.)","approval","She deserves a lot of credit for finishing the work on time.","nexus ai credit; child tax credit; credit score","B1"
"Crown","/ˈkɹaʊn/","n.","crown, crowns","None","the Crown (or the reigning monarch) as the symbol of the power and authority of a monarchy","The queen wore a golden crown covered with shining jewels.","crown jewels; paper crown; losing its crown","B1"
"Dairy","/ˈdɛɹi/","n.","dairy, dairies","None","a farm where dairy products are produced","The farmer sells fresh milk and cheese from his small dairy.","dairy queen; local dairy; say dairy","B1"
"Creature","/ˈkɹitʃɚ/","n.","creature, creatures","create (v.)","a living organism characterized by voluntary movement","I think we are creatures of our own world and humans by nature adjust to the environment we put our body into.","creature because; biological creature; visual creature","B1"
"Cupboard","/ˈkʌbɚd/","n.","cupboard, cupboards","None","a small room (or recess) or cabinet used for storage space","Although we do lose a little bit for the server room cupboard which is going to be staying where it is.","cupboard sinks toilets; removing walls cupboard; server room cupboard","B1"
"Cruel","/ˈkɹuəl/","adj.","cruel, more cruel, most cruel","cruelness (n.)","(of persons or their actions) able or disposed to inflict pain or suffering","In fact, its signature achievement in this domain — the cruel yet “effective” One-Child Policy — is something of a myth.","citing adultery cruel; cruel yet effective; bony sarcastic cruel","B1"
"Crop","/ˈkɹɑp/","n.","crop, crops","None","the yield from plants in a single growing season","Heavy rain ruined most of the farmer's crop this year.","genetically modified crop; current crop; crop including maize","B1"
"Criminal","/ˈkɹɪmənəl/","n.","criminal, criminals","crime (n.), criminality (n.), criminalize (v.), criminalness (n.)","someone who has committed a crime or has been legally convicted of a crime","The police finally caught the criminal who had robbed the bank.","criminal charges against; criminal probe; criminal psychologists","B1"
"Dam","/ˈdæm/","n.","dam, dams","None","a barrier constructed to contain the flow of water or to keep out the sea","Dams have been maybe the number one habitat problem for these different species, especially migratory species salmon and trout.","hoover dam; several dam; dam requires diligent","B1"
"Dealer","/ˈdilɚ/","n.","dealer, dealers","deal (v.), dealership (n.)","someone who purchases and maintains an inventory of goods to be sold","We bought our new car from a trusted dealer in the next town.","dealer franchise laws; dealer someday; dealer gang members","B1"
"Darling","/ˈdɑɹlɪŋ/","n.","darling, darlings","None","a special loved one","Svinhufvud is then elected president of the Republic, and he's the absolute darling of the political.","nvidia darling; absolute darling; former darling","B1"
"Deck","/ˈdɛk/","n.","deck, decks","None","the flat outdoor floor on a ship or boat that people can walk on","The passengers stood on the deck to watch the sunset over the sea.","upper deck; on the deck; ship's deck","B1"
"Decorate","/ˈdɛkɚˌeɪt/","v.","decorate, decorates, decorated, decorated, decorating","decor (n.), decorator (n.), decoration (n.), decorative (adj.)","make more attractive by adding ornament, colour, etc.","I know I started by telling you how much I hate your decor and your interior decorating but it's because I you.","decorate christmas; decorate guest; started decorate","B1"
"Dare","/ˈdɛɹ/","v.","dare, dares, dared, daring","None","take upon oneself; act presumptuously, without permission","Its only advantage was price — no one else would dare buy it.","dare cross; dare watch; ways dare","B1"
"Dawn","/ˈdɔn/","n.","dawn, dawns","dawning (n.)","the first light of day","The deputy superintendent, Dawn, is my former student.","dust till dawn; cosmic dawn; deputy superintendent dawn","B1"
"Deepen","/ˈdipən/","v.","deepen, deepens, deepened, deepened, deepening","deepening (n.)","make more intense, stronger, or more marked; ,","Working together on the project helped to deepen their friendship.","green innovation deepen; move faster deepen; slow down deepen","B1"
"Decade","/dɛˈkeɪd/","n.","decade, decades","None","a period of 10 years","Despite significant improvements in the last decades, the technology is not fully mature to be adopted for strenuous and non-programmed tasks.","last decade; couple decade; decade since","B1"
"Database","/ˈdeɪtəˌbeɪs/","n.","database, databases","None","an organized body of related information","Our schemes harness probabilistic set membership data structures to exploit the structured nature of spectrum databases and SUs' queries.","external database; prometheus database; maria db database","B1"
"Deed","/ˈdid/","n.","deed, deeds","None","a legal document signed and sealed and delivered to effect a transfer of property and to show the legal right to possess it","She's Gen X in birthdate, word and deed.","good deed; great deed; deed democratic principles","B1"
"Dash","/ˈdæʃ/","v.","dash, dashes, dashed, dashed, dashing","None","run or move very quickly or hastily","He had to dash across the street to catch the last bus home.","door dash; dash matrix; dash here","B1"
"Decrease","/dɪˈkɹis/","v.","decrease, decreases, decreased, decreased, decreasing","None","decrease in size, extent, or range","A randomized controlled trial of a fully generative AI chatbot showed a fifty-one percent average decrease in depression symptoms.","rapidly decrease; significant decrease; rapid decrease","B1"
"Dessert","/dɪˈzɝt/","n.","dessert, desserts","None","a dish served as the last course of a meal","Even desserts that are fresh that are prepared.","mid ass dessert; dessert on top; dessert nowadays","B1"
"Desirable","/dɪˈzaɪɹəbəl/","adj.","desirable, more desirable, most desirable","desirability (n.), desirableness (n.)","worth having or seeking or achieving","A quiet house near the park is a very desirable place to live.","desirable behaviors; highly desirable; desirable whenever","B1"
"Democracy","/dɪˈmɑkɹəsi/","n. [U]","no changes","democratic (adj.), democratize (v.)","the political orientation of those who favor government by the people or by their elected representatives","IN is our resident lawyer covering the democracy is collapsing beat.","direct democracy; democracy around; secular democracy","B1"
"Deposit","/dəˈpɑzɪt/","n.","deposit, deposits","depositor (n.), deposition (n.)","the phenomenon of sediment or gravel accumulating","Parents would deposit money in their account.","result deposit; deposit requirements; protein deposit","B1"
"Definition","/ˌdɛfəˈnɪʃən/","n.","definition, definitions","define (v.)","a concise explanation of the meaning of a word or phrase or symbol","I've also changed a few definitions of variables.","clinical definition; technical definition; definition cannot","B1"
"Desire","/dɪˈzaɪɚ/","n.","desire, desires","desirous (adj.)","the feeling that accompanies an unsatisfied state","She had a strong desire to travel and see the whole world.","genuine desire; desire based; real desire","B1"
"Designer","/dɪˈzaɪnɚ/","n.","designer, designers","design (v.)","a person who specializes in designing architectural interiors and their furnishings","Designers are embracing imperfection and glitch effects as a form of visual protest to signal human agency and digital soul.","original designer; designer handbags; designer stores","B1"
"Democratic","/ˌdɛməˈkɹætɪk/","adj.","democratic, more democratic, most democratic","democracy (n.)","characterized by or advocating or based upon the principles of democracy or social equality; - George du Maurier","In a democratic country, citizens have the right to vote for their leaders.","democratic peace theory; democratic forces; syrian democratic","B1"
"Destroy","/dɪsˈtɹɔɪ/","v.","destroy, destroys, destroyed, destroyed, destroying","destroyer (n.), destruction (n.), destructive (adj.), destructible (adj.)","do away with, cause the destruction or undoing of","As a consequence of these fires, a large number of structures are destroyed, releasing household chemicals into the environment as uncontrolled toxins.","destroy ourselves; destroy cities; destroy everybody","B1"
"Detect","/dɪˈtɛkt/","v.","detect, detects, detected, detected, detecting","detector (n.), detecting (n.), detection (n.)","discover or determine the existence, presence, or fact of","The new alarm can detect smoke and warn the family at once.","detect lies; detect gravitational waves; detect cars","B1"
"Dime","/ˈdaɪm/","n.","dime, dimes","None","a United States coin worth one tenth of a dollar","He found a shiny dime lying on the floor of the shop.","dime here; single dime; nearly every dime","B1"
"Devil","/ˈdɛvəl/","n.","devil, devils","devilry (n.), devilize (v.), deviltry (n.), devilment (n.)","(Judeo-Christian and Islamic religions) chief spirit of evil and adversary of God; tempter of mankind; master of Hell","There's one on top of Devil's Tower in Wyoming.","red devil; devil conversations; angel devil","B1"
"Dim","/ˈdɪm/","adj.","dim, dimmer, dimmest","dimness (n.)","lacking in light; not bright or harsh","Joel's not using any smart bulbs in the house, using smart dimmer.","dim lighting; dim down; dim with dim","B1"
"Dine","/ˈdaɪn/","v.","dine, dines, dined, dined, dining","diner (n.)","have supper; eat dinner","Cash back airline miles, points for travel and dining are all ways companies try to lure people into opening new accounts.","dine nine course; dine facilities available; always dine","B1"
"Determine","/dəˈtɝmən/","v.","determine, determines, determined, determined, determining","determiner (n.), determinant (n.), determination (n.)","establish after a calculation, investigation, experiment, survey, or study","Parameter assumptions alone do not determine whether inferences can extend beyond included studies, advocating for unconditional inference based on objectives.","help determine; probabilities substantially determine; statistical moments determine","B1"
"Dirt","/ˈdɝt/","n. [U]","no changes","dirty (adj.)","the part of the earth's surface consisting of humus and disintegrated rock","The children played outside and came home covered in dirt and grass.","dirt clouds; throw dirt; dirt under","B1"
"Dishonest","/dɪˈsɑnəst/","adj.","dishonest, more dishonest, most dishonest","None","deceptive or fraudulent; disposed to cheat or defraud or deceive","It was dishonest of him to take the money without asking.","dishonest jealous; ungrateful arrogant dishonest; willfully dishonest","B1"
"Dizzy","/ˈdɪzi/","adj.","dizzy, dizzier, dizziest","dizziness (n.)","having or causing a whirling sensation; liable to falling","Now I thought I had seen a lot of trucks before, but as I drove along The Line, I started to get slightly dizzy.","dizzy gillespie; get dizzy; dizzy here","B1"
"Dip","/ˈdɪp/","v.","dip, dips, dipped, dipped, dipping","dipper (n.)","immerse briefly into a liquid so as to wet, coat, or saturate","She liked to dip her bread into the warm soup before eating it.","dip switches; skinny dip; hand dip","B1"
"Dinosaur","/ˈdaɪnəˌsɔɹ/","n.","dinosaur, dinosaurs","None","a very large animal that lived millions of years ago and no longer exists","The children stared at the huge dinosaur skeleton inside the museum.","giant dinosaur; dinosaur bones; dinosaur fossil","B1"
"Discount","/dɪˈskaʊnt/","n.","discount, discounts","discounter (n.)","the act of reducing the selling price of merchandise","The shop offered a big discount on coats during the winter sale.","discount codes; discount factors; family discount","B1"
"Dolphin","/ˈdɑlfən/","n.","dolphin, dolphins","None","large slender food and game fish widely distributed in warm seas (especially around Hawaii)","We watched a dolphin jump out of the water near our small boat.","dolphin park; dolphin fuckers; yeah there's dolphin","B1"
"Dislike","/dɪˈslaɪk/","v.","dislike, dislikes, disliked, disliked, disliking","None","have or feel a dislike or distaste for","I will say one thing I dislike is this do IVF mentality, meaning nothing you can do can impact your egg quality.","dislike rand; dislike americans; dislike windows","B1"
"Disc","/ˈdɪsk/","n.","disc, discs","None","sound recording consisting of a disk with a continuous groove; used to reproduce music by rotating while a phonograph needle tracks in the groove","She put a round disc into the machine to play her favourite music.","vm disc; disc cannot accept; disc copy","B1"
"Donkey","/ˈdɑŋki/","n.","donkey, donkeys","None","an animal like a small horse with long ears, often used to carry loads","The old farmer loaded the heavy bags onto his patient grey donkey.","ride a donkey; stubborn donkey; grey donkey","B1"
"Doubtful","/ˈdaʊtfəl/","adj.","doubtful, more doubtful, most doubtful","doubtfulness (n.)","open to doubt or suspicion","If you if you say that you do you now you're a doubtful person.","doubtful about; exceedingly doubtful; tired doubtful","B1"
"Dive","/ˈdaɪv/","v.","dive, dives, dived, dived, diving","diver (n.)","drop steeply","With that, let's dive into our next video about the modern Middle East.","nose dive; keep dive; specifically dive","B1"
"Doughnut","/ˈdoʊˌnʌt/","n.","doughnut, doughnuts","None","a toroidal shape","The 'Doughnut' of social and planetary boundaries has emerged as a popular framework for assessing environmental and social sustainability.","doughnut when evaluating; doughnut known; cereal pink doughnut","B1"
"Downtown","/ˈdaʊˈntaʊn/","n.","downtown, downtowns","None","the central area or commercial center of a town or city","It was either called the stage house or the stage coach in Santa Barbara that was near the railroad tracks downtown.","downtown la; downtown palo alto; railroad tracks downtown","B1"
"Drugstore","/ˈdɹʌɡˌstɔɹ/","n.","drugstore, drugstores","None","a retail shop where medicine and other articles are sold","She went to the drugstore to buy some medicine for her cold.","local drugstore; drugstore there; drugstore chains rite","B1"
"Dose","/ˈdoʊs/","n.","dose, doses","None","a measured portion of medicine taken at any one time","Experimenting with small doses of uncertainty gets kids used to life being unpredictable, helping them better manage anxiety for years to come.","lower dose; small dose; full dose","B1"
"Drown","/ˈdɹaʊn/","v.","drown, drowns, drowned, drowned, drowning","None","cover completely or make imperceptible","The more your amygdala is hyperactive, it is drowning out every other part of your brain.","society drown; drown myself; stops we drown","B1"
"Drip","/ˈdɹɪp/","v.","drip, drips, dripped, dripped, dripping","drippy (adj.), drippings (n.)","fall in drops","That bad type of stress, you're getting you're not getting a big spike, you're getting a slow drip of it.","slow drip; drip by drip; fully drip","B1"
"Drag","/ˈdɹæɡ/","v.","drag, drags, dragged, dragged, dragging","dragger (n.)","pull, as against a resistance","He had to drag the heavy box across the floor to the other room.","easily drag; new drag; drag everyone else","B1"
"Drain","/ˈdɹeɪn/","v.","drain, drains, drained, drained, draining","drainage (n.)","flow off gradually","Next, they cover the giant drains, which help suck out any rain water that accumulates in the grass pitch.","feeling drain; storm drain; drain into","B1"
"Dramatic","/dɹəˈmætɪk/","adj.","dramatic, more dramatic, most dramatic","dramatically (adv.), drama (n.)","suitable to or characteristic of drama","Even if it doesn't mean a dramatic decrease in prices, more competition is a good thing.","sounds dramatic; big dramatic; dramatic step","B1"
"Drunk","/ˈdɹʌŋk/","adj.","drunk, drunker, drunkest","None","stupefied or excited by a chemical substance (especially alcohol)","I was really drunk and all those people seemed together and successful and polished, and I.","pretty drunk; drunk mob; drunk naked","B1"
"Dumpling","/ˈdʌmplɪŋ/","n.","dumpling, dumplings","None","small balls or strips of boiled or steamed dough","We ate a warm bowl of soup with a soft dumpling inside.","dumpling there; dumpling gang rides; dumpling black-eyed peas","B1"
"Eager","/ˈiɡɚ/","adj.","eager, more eager, most eager","eagerly (adv.), eagerness (n.)","having or showing keen interest or intense desire or impatient expectancy","The students were eager to start their first day at the new school.","now eager; eager people; interesting how eager","B1"
"Dumb","/ˈdʌm/","adj.","dumb, dumber, dumbest","dumbness (n.)","slow to learn or understand; lacking intellectual acuity; - Thackeray","It was a dumb idea to leave the door open all night.","dumb questions; dumb example; dumb machines","B1"
"Dust","/ˈdʌst/","n. [U]","no changes","dusty (adj.), duster (n.)","fine powdery material such as dry earth or pollen that can be blown about in the air","A thick layer of dust covered the books on the old shelf.","dust settles; dust till dawn; dust dawn","B1"
"Dump","/ˈdʌmp/","v.","dump, dumps, dumped, dumped, dumping","dumpy (adj.), dumper (n.), dumping (n.)","throw away as refuse","They dump all the garbage into the large bin behind the house.","dump out; brain dump; dump scheme","B1"
"Echo","/ˈɛkoʊ/","n.","echo, echoes","None","the repetition of a sound resulting from reflection of the sound waves","Although originally inspired only by Minsky and Clark, subsequent analysis showed that its structure echoes computational motifs from all four theories.","echo dots; echo computational motifs; structure echo","B1"
"Editor","/ˈɛdətɚ/","n.","editor, editors","edit (v.), editorial (adj.), editorship (n.)","a person responsible for the editorial aspects of publication; the person who determines the final content of a text (especially of a newspaper or magazine)","Hey, this is Jeff the editor here.","editor well; zone editor; mobile dear editor","B1"
"Edit","/ˈɛdət/","v.","edit, edits, edited, edited, editing","editor (n.), editing (n.)","prepare for publication or presentation by correcting, revising, or adapting","Let us first of all edit the caddy's static configuration file.","video edit; edit experience; start edit","B1"
"Educate","/ˈɛdʒəˌkeɪt/","v.","educate, educates, educated, educated, educating","educatee (n.), educator (n.), education (n.), educative (adj.)","give an education to","Good teachers educate their students to think for themselves.","educate women; after educate; never educate","B1"
"Elbow","/ˈɛˌlboʊ/","n.","elbow, elbows","elbowing (n.)","hinge joint between the forearm and upper arm and the corresponding joint in the forelimb of a quadruped","The knee should go through the full range of motion, the knee, the hip, the elbow, etc., etc.","elbow room; elbow patches academics; elbow grease","B1"
"Educational","/ˌɛdʒəˈkeɪʃənəl/","adj.","educational, more educational, most educational","education (n.)","relating to the process of education","The museum trip was both fun and highly educational for the children.","educational settings; educational materials; educational contexts","B1"
"Efficient","/ɪˈfɪʃənt/","adj.","efficient, more efficient, most efficient","efficiency (n.)","being effective without wasting time or effort or expense","The new washing machine is quiet, fast and very efficient.","efficient training; pretty efficient; incredibly efficient","B1"
"Elderly","/ˈɛldɚli/","adj.","elderly, more elderly, most elderly","None","advanced in years; (`aged' is pronounced as two syllables)","These were men prostate cancer cases who were elderly yet and still they still responded to that.","elderly gentlemen; elderly care; elderly saints became","B1"
"Elect","/ɪˈlɛkt/","v.","elect, elects, elected, elected, electing","elector (n.), election (n.), elective (adj.), electorate (n.)","select by a vote for an office or membership","The students will elect a new leader for their club next week.","elect representatives; elect bureaucrats; folks elect","B1"
"Election","/ɪˈlɛkʃən/","n.","election, elections","elect (v.), electoral (adj.)","a vote to select the winner of a position or political office","Many people waited in line to vote during the election.","hold election; recent election; last election","B1"
"Electricity","/ɪˌlɛkˈtɹɪsəti/","n. [U]","no changes","electric (adj.), electrify (v.)","a physical phenomenon associated with stationary or moving electrons and protons","The storm cut off the electricity for several hours last night.","electricity program; conducting electricity; electricity because","B1"
"Emergency","/ɪˈmɝdʒənsi/","n.","emergency, emergencies","emergent (adj.)","a sudden unforeseen crisis (usually involving danger) that requires immediate action","Cutting methane emissions acts a climate emergency brake by slowing global warming during the critical transition to a carbon-neutral energy landscape.","emergency situation; emergency purposes; emergency expense","B1"
