"word","ipa","pos","inflections","derivatives","definition","example","collocations","context_type"
"Ox","/ˈɑks/","n.","ox, oxen","None","an adult castrated bull of the genus Bos; especially Bos taurus","It's called toto to no to ox to tottox is what we call it for short.","desert ox; ox yoke; ox gall bile","B1"
"Overseas","/ˈoʊvɚˈsiz/","adv.","no changes","None","beyond or across the sea","Two thousand Nepalis leave for new jobs overseas every single day.","overseas opportunities; overseas expansion; overseas department governed","B1"
"Original","/ɚˈɪdʒənəl/","adj.","original, more original, most original","originality (n.)","preceding all others in time or being as first made or performed","Second, based on the results of the original MILP, we employ a preprocessing of the POMDP to encompass memory-based decisions.","original mission; original story; original movie","B1"
"Painter","/ˈpeɪntɚ/","n.","painter, painters","paint (v.), painterly (adj.)","an artist who paints","He's a highly accomplished painter, graffiti, and street artist, writer, podcaster, and television host.","painter named albert; genius painter; renaissance painter","B1"
"Owe","/ˈoʊ/","v.","owe, owes, owed, owed, owing","None","be obliged to pay or repay","I still owe my friend ten pounds for the cinema tickets.","owe something; theory application owe; owe allegiance","B1"
"Pad","/ˈpæd/","n.","pad, pads","padding (n.)","a number of sheets of paper fastened together along one edge","I took that off and put on some of these thermal pads.","shock pad; knee pad; pad method","B1"
"Outline","/ˈaʊˌtlaɪn/","n.","outline, outlines","None","the line that appears to bound an object","Shadows, for instance, seem unlikely to be virtual shadow maps with obvious lowresolution artifacts, sharp outlines, and poor coverage of very small details.","paper outline; outline challenges; outline empirical pathways","B1"
"Palace","/ˈpæləs/","n.","palace, palaces","palatial (adj.)","a large and stately mansion","He's building big palaces and statues of himself all over the country.","memory palace; imperial palace; palace complex","B1"
"Ownership","/ˈoʊnɚˌʃɪp/","n. [U]","no changes","owner (n.)","the relation of an owner to the thing possessed; possession with the right to transfer possession to others","After years of renting, they finally celebrated full ownership of their home.","ownership bus ownership; share ownership; hardware ownership","B1"
"Pal","/ˈpæl/","n.","pal, pals","None","a close friend who accompanies his buddies in their activities","Pal Mary is an expert on the Epstein files.","fitness pal; pal jimmy; buddy pal","B1"
"Pancake","/ˈpæˌnkeɪk/","n.","pancake, pancakes","None","a flat cake of thin batter fried on both sides on a griddle","It would be you don't you don't need to read a cookbook in order to enjoy pancakes.","made pancake; pancake motor; planetary pancake","B1"
"Palm","/ˈpɑm/","n.","palm, palms","palmar (adj.)","the inner surface of the hand from the wrist to the base of the fingers","She held the small coin in the palm of her hand.","palm sweat; palm leaf; palm door","B1"
"Parade","/pɚˈeɪd/","n.","parade, parades","parader (n.)","a ceremonial procession including people marching","Thousands of people came to watch the colourful parade through the town.","make parade; into parade; programme parade","B1"
"Parcel","/ˈpɑɹsəl/","n.","parcel, parcels","parceling (n.), parcelling (n.), parcellation (n.)","a wrapped container","We parcel it up because there's bits we see and there's bits we don't see.","parcel germany; united parcel; carrying parcel","B1"
"Parrot","/ˈpɛɹət/","n.","parrot, parrots","None","usually brightly colored zygodactyl tropical birds with short hooked beaks and the ability to mimic sounds","The colourful parrot learned to repeat several words and short phrases.","pet parrot; statistical parrot; parrot various","B1"
"Paradise","/ˈpɛɹəˌdaɪs/","n.","paradise, paradises","paradisal (adj.), paradisiacal (adj.)","any place of complete bliss and delight and peace","American viewers may be surprised to learn that we alone live in credit card paradise.","better paradise; soviet paradise; postcard paradise","B1"
"Passenger","/ˈpæsəndʒɚ/","n.","passenger, passengers","None","a traveler riding in a vehicle (a boat or bus or car or plane or train etc) who is not operating it","I wrote parts of it in the passenger seat of a car while we were on a road trip.","after passenger; passenger embarked; allow passenger","B1"
"Panic","/ˈpænɪk/","n.","panic, panics","panicky (adj.)","an overwhelming feeling of fear and anxiety","If you're panic attack prone, please don't start taking stimulants in order to learn things better.","panic set; absolute panic; mass panic","B1"
"Passage","/ˈpæsədʒ/","n.","passage, passages","pass (v.)","the act of passing from one state or place to the next","We walked along a narrow passage between the two old buildings.","relevant passage; retrieved passage; passage containing descriptions","B1"
"Passport","/ˈpæˌspɔɹt/","n.","passport, passports","None","any authorization to pass or go somewhere","Citizens, they’re free to study, work, and live anywhere in the United States without restrictions — they don’t even need a passport.","passport instance; passport privilege; fifth worst passport","B1"
"Patience","/ˈpeɪʃəns/","n. [U]","no changes","patient (adj.)","good-natured tolerance of delay or incompetence","It was the international community, which would mean they would have to face the UN process that they apparently had no patience for.","patience required; need patience; enough patience","B1"
"Pat","/ˈpæt/","v.","pat, pats, patted, patted, patting","patness (n.)","pat or squeeze fondly or playfully, especially under the chin","That you could call explainer journalism, although that always feels a little pat.","pat grady; see pat; pat yourself","B1"
"Pea","/ˈpi/","n.","pea, peas","None","seed of a pea plant used for food","We ate fresh green peas with our roast dinner.","pushing pea; frozen pea; pea nor","B1"
"Peel","/ˈpil/","v.","peel, peels, peeled, peeled, peeling","peeler (n.), peeling (n.)","strip the skin off","Please peel the potatoes and put them in the pot of water.","peel away; layered materials peel; school peel","B1"
"Passion","/ˈpæʃən/","n. [U]","no changes","None","a strong feeling or emotion","I was very into international things, but I was always leaning on video, both as an artistic passion.","passion story; passion galore; artistic passion","B1"
"Penguin","/ˈpɛŋɡwən/","n.","penguin, penguins","None","short-legged flightless birds of cold southern especially Antarctic regions having webbed feet and wings modified as flippers","We watched a penguin slide across the ice and dive into the sea.","penguin state; charming penguin; deranged penguin","B1"
"Peanut","/ˈpinət/","n.","peanut, peanuts","None","underground pod of the peanut vine","I love all the David bronze bar flavors, including cookie dough, caramel chocolate, double chocolate, peanut butter chocolate.","peanut essentially protects; against peanut; salted peanut","B1"
"Pearl","/ˈpɝl/","n.","pearl, pearls","pearly (adj.), pearler (n.)","a smooth lustrous round structure inside the shell of a clam or oyster; much valued as a jewel","Inside the oyster they discovered a shiny white pearl.","connected with pearl; words richard pearl; pearl david worms","B1"
"Pause","/ˈpɔz/","n.","pause, pauses","None","a time interval during which there is a temporary cessation of something","There was a short pause before she answered the difficult question.","hit pause; wait pause; pause reflect document","B1"
"Pepper","/ˈpɛpɚ/","n. [U]","no changes","peppery (adj.)","climber having dark red berries (peppercorns) when fully ripe; southern India and Sri Lanka; naturalized in northern Burma and Assam","She added a little salt and pepper to make the soup taste better.","police pepper; extra pepper; pepper extract","B1"
"Penny","/ˈpɛni/","n.","penny, pennies","None","a coin of low value used in Britain and the United States","He found a shiny penny lying on the floor near the door.","shiny penny; spare penny; save every penny","B1"
"Photographer","/fəˈtɑɡɹəfɚ/","n.","photographer, photographers","photograph (v.), photography (n.)","someone who takes photographs professionally","The Carl Zeiss lens go on the iPhone and now photographer it's it's gone.","professional photographer; photographer today; keen photographer","B1"
"Pigeon","/ˈpɪdʒən/","n.","pigeon, pigeons","None","wild and domesticated birds having a heavy body and short legs","A grey pigeon landed on the bench and looked for crumbs.","passenger pigeon; pigeon again; somehow pigeon","B1"
"Persuade","/pɚˈsweɪd/","v.","persuade, persuades, persuaded, persuaded, persuading","persuader (n.), persuasion (n.), persuasive (adj.), persuasible (adj.)","win approval or support for","I am very persuaded by the new literature on brain synchronization.","able persuade; persuade into; tried persuade","B1"
"Perform","/pɚˈfɔɹm/","v.","perform, performs, performed, performed, performing","performer (n.), performing (n.), performance (n.)","carry out or perform an action","The emergence of autonomous surgical robots capable of performing intricate laparoscopic suturing marks a significant milestone in the evolution of minimally invasive medical procedures.","highest perform; perform authenticity; high perform","B1"
"Pile","/ˈpaɪl/","n.","pile, piles","None","a collection of objects laid on top of each other","There was a huge pile of leaves in the corner of the garden.","giant pile; growing pile; pile dataset","B1"
"Pity","/ˈpɪti/","n. [U]","no changes","None","a feeling of sympathy and sorrow for the misfortunes of others","It is a pity that we cannot stay any longer at the party.","feel pity; great pity; show pity","B1"
"Permission","/pɚˈmɪʃən/","n. [U]","no changes","permit (v.)","the act of allowing someone to do something","The students asked their teacher for permission to leave the classroom early.","ask for permission; give permission; without permission","B1"
"Performance","/pɚˈfɔɹməns/","n. [U]","no changes","perform (v.)","a dramatic or musical entertainment","Pop off describes an exceptional performance or a main character moment that captures widespread attention on digital platforms.","high academic performance; favor high performance; performance athletic performance","B1"
"Pine","/ˈpaɪn/","n.","pine, pines","None","a coniferous tree","Transco and the connection, we talked about the Pine Prairie expansion.","pine glasses; pine nuts; program by pine","B1"
"Pineapple","/ˈpaɪˌnæpəl/","n.","pineapple, pineapples","None","a tropical American plant bearing a large fleshy edible fruit with a terminal tuft of stiff leaves; widely cultivated in the tropics","She cut the sweet pineapple into thin slices for the fruit salad.","pineapple that made; pineapple production animation; pineapple on pizza","B1"
"Pill","/ˈpɪl/","n.","pill, pills","None","something that resembles a tablet of medicine in shape or size","There's patches, there's pills, there's vaginal inserts, there's vaginal cream, often helps some of the symptoms they're having.","poison pill; poisoned pill; magic pill","B1"
"Pilot","/ˈpaɪlət/","n.","pilot, pilots","pilotage (n.), piloting (n.)","someone who is licensed to operate an aircraft in flight","Humanoid robots have entered mass production, transitioning from warehouse pilots to unsupervised roles in complex, real-world industrial environments.","pilot rating; pilot case study; warehouse pilot","B1"
"Pint","/ˈpaɪnt/","n.","pint, pints","None","a British imperial capacity measure (liquid or dry) equal to 4 gills or 568.26 cubic centimeters","He ordered a cold pint of beer after the long walk.","cheapest pint; mega pint; buffet five pint","B1"
"Pit","/ˈpɪt/","n.","pit, pits","pitting (n.)","a sizeable hole (usually in the ground)","The workers dug a deep pit to plant the new tree.","fire pit; pull pit; gaga pit","B1"
"Playful","/ˈpleɪfəl/","adj.","playful, more playful, most playful","playfulness (n.)","full of fun and high spirits","The playful puppy ran around the garden chasing its own tail.","playful curiosity; playful spirit; genuine playful","B1"
"Pole","/ˈpoʊl/","n.","pole, poles","None","a long (usually round) rod of wood or metal or plastic","No flag poles of the United States.","flag pole; metal pole; pole vault thing","B1"
"Plug","/ˈplʌɡ/","n.","plug, plugs","plugger (n.)","blockage consisting of an object designed to fill a hole tightly","He pushed the plug into the wall to turn on the lamp.","plus plug; wall plug; plug myself","B1"
"Pitch","/ˈpɪtʃ/","n.","pitch, pitches","pitchy (adj.), pitcher (n.), pitching (n.)","the property of sound that varies with variation in the frequency of vibration","The sales pitches to the American people for an invasion of Iraq were made with absolute certainty.","sales pitch; grass pitch; certain pitch","B1"
"Poll","/ˈpoʊl/","n.","poll, polls","pollard (n.), pollster (n.)","an inquiry into public opinion conducted by interviewing a random sample of people","I think that if you look at opinion polls, that's an opinion that people hold truly across the spectrum.","poll conducted; poll found; informal poll","B1"
"Plastic","/ˈplæstɪk/","n. [U]","no changes","plasticity (n.)","generic name for certain synthetic or semisynthetic materials that can be molded or extruded into objects or films or filaments or used for making e.g. coatings and adhesives","Many cheap toys today are made from hard plastic.","plastic wrapping; avoid plastic; brain remains plastic","B1"
"Porcelain","/ˈpɔɹsələn/","n. [U]","no changes","None","ceramic ware made of a more or less translucent ceramic","With or without subsidies, it would surely produce some fantastic tea, rice, and porcelain.","porcelain figures; almost look porcelain; red porcelain","B1"
"Pollute","/pəˈlut/","v.","pollute, pollutes, polluted, polluted, polluting","polluter (n.), pollutant (n.), pollution (n.)","make impure","Cars and factories pollute the air in many large cities today.","highly pollute; keep pollute; ruby pollute","B1"
"Plenty","/ˈplɛnti/","n.","plenty, plenties","plenteous (adj.)","a full supply","There is plenty of food in the fridge for everyone tonight.","peace plenty; labour plenty; plenty labourers","B1"
"Politics","/ˈpɑləˌtɪks/","n. [U]","no changes","political (adj.), politician (n.)","social relations involving intrigue to gain authority or power","My grandfather loves discussing politics with his old friends.","politics anti-establishment politics; bureaucratic politics; sometime politics","B1"
"Politician","/ˌpɑləˈtɪʃən/","n.","politician, politicians","politics (n.)","a leader engaged in civil administration","Netanyahu is a fantastic politician and statesman, and he's able to cover up a lot of these policies in the name of security.","prominent politician; smart politician; fantastic politician","B1"
"Pottery","/ˈpɑtɚi/","n. [U]","no changes","None","ceramic ware made from clay and baked in a kiln","Kintsugi is a Japanese craft of repairing broken pottery.","make pottery; broken pottery; ancient pottery","B1"
"Political","/pəˈlɪtəkəl/","adj.","political, more political, most political","politics (n.)","involving or characteristic of politics or parties or politicians","This paper examines the effect of the political network of Chinese municipal leaders on the pricing of municipal corporate bonds.","political institutions; current political; political turmoil","B1"
"Poverty","/ˈpɑvɚti/","n. [U]","no changes","None","the state of having little or no money and few or no material possessions","They're facing poverty, but , home insecurity.","poverty trap; poverty addiction; poverty reduction","B1"
"Pollution","/pəˈluʃən/","n. [U]","no changes","pollute (v.)","undesirable state of the natural environment being contaminated with harmful substances as a consequence of human activities","I don't have to think about crime, homelessness, noise, pollution.","light pollution; environmental pollution; pollution levels","B1"
"Postpone","/poʊsˈtpoʊn/","v.","postpone, postpones, postponed, postponed, postponing","postponer (n.), postponement (n.)","hold back to a later time","You lose your job you postpone your plans.","postpone intervention allows; fact that postpone; postpone old age","B1"
"Portrait","/ˈpɔɹtɹət/","n.","portrait, portraits","portray (v.)","a word picture of a person's appearance and character","It does feel a little bit a portrait of the Western mind in particular.","personal portrait; playing through portrait; gray portrait","B1"
"Poster","/ˈpoʊstɚ/","n.","poster, posters","post (v.)","a sign posted in a public place as an advertisement","She hung a colourful poster of her favourite band on the wall.","poster boy; original poster; x poster","B1"
"Powder","/ˈpaʊdɚ/","n.","powder, powders","powdery (adj.), powderer (n.), powderize (v.)","a solid substance in the form of tiny loose particles; a solid that has been pulverized","That's some crazy I can't say I've ever seen metal in the state where it's become powder after it wasn't powder.","white powder; baby powder; magic powder","B1"
"Precious","/ˈpɹɛʃəs/","adj.","precious, more precious, most precious","preciosity (n.), preciousness (n.)","characterized by feeling or showing fond affection for","These old photos are precious to me because they show my family.","precious cognitive bandwidth; precious every moment; precious embryos","B1"
"Portion","/ˈpɔɹʃən/","n.","portion, portions","None","something determined in relation to something that includes it","The artist portion is going to pay for the tour bus to going to pay for gas, flights, the crew.","good portion; big portion; major portion","B1"
"Practical","/ˈpɹæktəkəl/","adj.","practical, more practical, most practical","practice (n.), practicality (n.)","concerned with actual use or practice","The teacher gave us some practical advice on how to save money.","practical experience; practical features; offer practical","B1"
"Pour","/ˈpɔɹ/","v.","pour, pours, poured, poured, pouring","None","cause to run","He carefully poured the hot tea into two clean cups.","marty pour; sunlight pour; absolutely pour","B1"
"Preparation","/ˌpɹɛpɚˈeɪʃən/","n.","preparation, preparations","prepare (v.)","the activity of putting or setting in order in advance of some act or purpose","Sometimes I think the difficulty in public speaking comes from the fact that as we go out there, we've done some preparation.","preparation toward; preparation across broad; coffee preparation","B1"
"Presence","/ˈpɹɛzəns/","n.","presence, presences","present (adj.)","the state of being present; current existence","Inflationary displacement occurs when local residents are priced out of their own communities by the seasonal presence of wealthy digital nomads.","physical presence; significant presence; presence pro","B1"
"Pretend","/pɹiˈtɛnd/","v.","pretend, pretends, pretended, pretended, pretending","pretense (n.), pretender (n.), pretending (n.), pretension (n.)","make believe with the intent to deceive","The children like to pretend that they are brave explorers.","pretend anymore; week pretend; pretend children","B1"
"Probable","/ˈpɹɑbəbəl/","adj.","probable, more probable, most probable","probability (n.)","likely but not certain to be or become true or real","It is probable that the train will be late today.","probable tokens; word probable; probable continuation sequence","B1"
"Prevent","/pɹɪˈvɛnt/","v.","prevent, prevents, prevented, prevented, preventing","prevention (n.), preventive (adj.), preventative (adj.)","keep from happening or arising; make impossible","New research integrates neurogenesis and structural pruning into AI frameworks to enable life-long learning and prevent knowledge loss.","prevent cancer; prevent crime before; prevent knowledge loss","B1"
"Previous","/ˈpɹiviəs/","adj.","previous, more previous, most previous","None","just preceding something else in time or order","Oh no, I forgot one problem that I had in all of the previous templates is how should I handle dockers swarm.","previous works; previous episodes; previous statements","B1"
"Product","/ˈpɹɑdəkt/","n.","product, products","produce (v.)","commodities offered for sale","To accommodate a wide variety of products, many automated systems include multiple gripper types and/or tool changers.","cool product; product interesting; product come down","B1"
"Process","/ˈpɹɑˌsɛs/","n.","process, processes","processor (n.), processing (n.)","a particular course of action intended to achieve a result","However, that process somehow needs to be automated and that of course depends on how the DNS provider is able to do this.","whole process; process visible through; sales process","B1"
"Producer","/pɹəˈdusɚ/","n.","producer, producers","produce (v.)","someone who manufactures something","This is where the producer and director run the whole show.","producer customers; producer rick rubin; producer surplus","B1"
"Profit","/ˈpɹɑfət/","n.","profit, profits","profiteer (n.)","the excess of revenues over outlays in a given period of time (including depreciation and other non-cash expenses)","If we live in the Black-Scholes world, the brokers are presumably making arbitrage profits by shorting dynamically precise amounts of their clients' portfolios.","profit margins; gross profit; maximize profit","B1"
"Pronounce","/pɹəˈnaʊns/","v.","pronounce, pronounces, pronounced, pronounced, pronouncing","pronouncement (n.), pronunciation (n.)","speak, pronounce, or utter in a certain way","It's not easy to pronounce if you are not a native speaker.","pronounce words; exhibit pronounce; particularly pronounce","B1"
"Professor","/pɹəˈfɛsɚ/","n.","professor, professors","professorial (adj.), professorship (n.)","someone who is a member of the faculty at a college or university","The professor explained the topic clearly and answered all our questions.","harvard professor; professor robert pap; professor here","B1"
"Pub","/ˈpʌb/","n.","pub, pubs","None","tavern consisting of a building with a bar and public rooms; often provides light meals","We met our friends at the small pub near the train station.","pub because; local pub; pub angel","B1"
"Proof","/ˈpɹuf/","n. [U]","no changes","None","any factual evidence that helps to establish the truth of something","Auditable rules have replaced high-level policies as companies must now provide credible proof of governance actions for consequential AI deployments.","proliferation proof; proof positive; idiot proof","B1"
"Promote","/pɹəˈmoʊt/","v.","promote, promotes, promoted, promoted, promoting","promoter (n.), promotion (n.), promotive (adj.)","contribute to the progress or growth of","The company spent a lot of money to promote its new product.","promote into; got promote; promote quantum logic","B1"
"Property","/ˈpɹɑpɚti/","n. [U]","no changes","None","something owned; any tangible or intangible possession that is owned by someone","The Metabrain debate explores whether a biological self still owns intellectual property if a digital auxiliary brain performs ninety percent of the cognitive labor.","property theft; property whatsoever; fundamental property","B1"
"Protection","/pɹəˈtɛkʃən/","n. [U]","no changes","protect (v.)","the activity of protecting someone or something","A thick coat gives good protection against the cold winter wind.","protection method; protection viable; additional protection","B1"
"Pump","/ˈpʌmp/","n.","pump, pumps","None","a mechanical device that moves fluid or gas by pressure or suction","He used a pump to put more air into the bicycle tyres.","strong pump; small pump; install pump","B1"
"Purse","/ˈpɝs/","n.","purse, purses","None","a container used for carrying money and small personal items or accessories (especially by women)","She took some coins out of her purse to pay for the bread.","purse starts; purse creating; public purse","B1"
"Puppet","/ˈpʌpət/","n.","puppet, puppets","puppeteer (n.)","a small figure of a person operated from above with strings by a puppeteer","His hand-picked successor, Kassym-Jomart Tokayev, was seen as little more than a puppet.","puppet seek; puppet every time; puppet regime there","B1"
"Punch","/ˈpʌntʃ/","v.","punch, punches, punched, punched, punching","puncher (n.)","deliver a quick blow to","The boxer tried to punch his opponent but missed by a few inches.","catherine punch; punch above; punch donald trump","B1"
"Racial","/ˈɹeɪʃəl/","adj.","no changes","None","of or related to genetically distinguished groups of people","At the same time, it is hard to separate this rhetoric from racial ideology.","promote racial; racial stereotypes; racial attitudes amongst","B1"
"Quit","/ˈkwɪt/","v.","quit, quits, quit, quitted, quitting","quitter (n.)","put an end to a state or an activity","Especially after and this is before he loses in a really bad way at the end that makes him be I quit.","almost quit; quit blizzard; keep quit","B1"
"Rank","/ˈɹæŋk/","n.","rank, ranks","ranker (n.), ranking (n.), rankness (n.)","a row or line of people (especially soldiers or police) standing abreast of one another","After many years of service, he rose to a high rank in the army.","lines rank; rank enough; lower rank","B1"
"Quote","/ˈkwoʊt/","v.","quote, quotes, quoted, quoted, quoting","quoter (n.), quotation (n.)","repeat a passage from","Congress even held hearings and quoted song lyrics.","quote need; stated quote; sources stating quote","B1"
"Pure","/ˈpjʊɹ/","adj.","pure, purer, purest","pureness (n.)","free of extraneous elements of any kind","The mountain stream was full of clear, pure water.","pure love; pure fun pure; data center pure","B1"
