"word","ipa","pos","inflections","derivatives","definition","example","collocations","context_type"
"Razor","/ˈɹeɪzɚ/","n.","razor, razors","None","edge tool used in shaving","He used a sharp razor to shave his face every morning.","henson razor; free razor; razor wire walls","B1"
"Rag","/ˈɹæɡ/","n.","rag, rags","None","a small piece of cloth or paper","Sure, for a few of these lucky “winners,” college really was a route to upward social mobility — from rags to riches.","augmented generation rag; rag my rag; rag frameworks","B1"
"Raw","/ˈɹɑ/","adj.","raw, rawer, rawest","rawness (n.)","(used especially of commodities) being unprocessed or manufactured using only simple or minimal processes","You can feel the raw energy from the crowd.","eat raw; raw bytes; raw thinking stream","B1"
"Rate","/ˈɹeɪt/","n.","rate, rates","rating (v.)","a magnitude or frequency relative to a time unit","Specific parameters that control the rate of information loss to the environment suggest that entanglement-breaking dynamics can be engineered to protect sensors.","rate compensation; response rate; highest rate","B1"
"Rectangle","/ˈɹɛktæŋɡəl/","n.","rectangle, rectangles","rectangular (adj.)","a parallelogram with four right angles","The larger the rectangle, the more scams occurred at that time.","draw a rectangle; perfect rectangle; small rectangle","B1"
"Ray","/ˈɹeɪ/","n.","ray, rays","None","a column of light (as from a beacon)","A warm ray of sunlight came through the window in the morning.","ray blanchard; sugar ray; ray allen","B1"
"Recorder","/ɹɪˈkɔɹdɚ/","n.","recorder, recorders","record (v.)","equipment for making records","She used a small recorder to save the interview for later.","tape recorder; recorder or something; stereo recorder","B1"
"Receipt","/ɹɪˈsit/","n.","receipt, receipts","None","the act of receiving","Then people were very I think disparaging of people saying be wary of receipts.","receipt emailed; remember receipt; tax receipt","B1"
"Reaction","/ɹiˈækʃən/","n.","reaction, reactions","react (v.), reactionary (adj.)","a feeling, action, or response caused by something that has happened","His first reaction to the news was one of total surprise.","first reaction; physical reaction; instant reaction","B1"
"Recognize","/ˈɹɛkəˌɡnaɪz/","v.","recognize, recognizes, recognized, recognized, recognizing","recognition (n.)","accept (someone) to be what is claimed or accept his power and authority","I did not recognize my old friend after so many years apart.","widely recognize; recognize each; rightfully recognize","B1"
"React","/ɹiˈækt/","v.","react, reacts, reacted, reacted, reacting","reactant (n.), reaction (n.), reactive (adj.)","show a response or a reaction to something","Now, I could be over reacting to anger, which is not going to be helpful in my life.","react very strongly; react well; react apps","B1"
"Reasonable","/ˈɹizənəbəl/","adj.","reasonable, more reasonable, most reasonable","reasonableness (n.)","showing reason or sound judgment","I think that's a very reasonable proposal that Jewish people should feel safe somewhere in this world.","fairly reasonable; reasonable amount; reasonable care","B1"
"Receiver","/ɹəˈsivɚ/","n.","receiver, receivers","receive (v.), receivership (n.)","set that receives radio or tv signals","That includes giant cameras and lenses, tripods, micro receivers, headsets, everything.","receiver below; receiver observes; receiver cooperate perfectly","B1"
"Reduce","/ɹəˈdus/","v.","reduce, reduces, reduced, reduced, reducing","reducer (n.), reducing (n.), reducible (adj.), reductant (n.), reduction (n.), reductive (adj.)","cut down on; make a reduction in","The shop will reduce the price of these shoes next week.","dramatically reduce; reduce pain; acne reduce","B1"
"Relief","/ɹɪˈlif/","n. [U]","no changes","None","the feeling that comes when something burdensome is removed or reduced","There's anger, there's relief, there's sadness, there's loss, there's identity loss.","feel relief; big relief; emotional relief","B1"
"Relax","/ɹɪˈlæks/","v.","relax, relaxes, relaxed, relaxed, relaxing","relaxer (n.), relaxant (adj.), relaxation (n.)","become less tense, rest, or take one's ease","She likes to relax in a warm bath after a long day.","sit back relax; relax around each; deeply relax","B1"
"Regret","/ɹəˈɡɹɛt/","v.","regret, regrets, regretted, regretted, regretting","None","feel remorse for; feel sorry for; be contrite about","I really regret that I did not study harder for the test.","biggest regret; deeply regret; great regret","B1"
"Release","/ɹiˈlis/","n.","release, releases","None","merchandise issued for sale or public showing (especially a record or film)","The band will celebrate the release of their new album tonight.","a new release; the latest release; an album release","B1"
"Remind","/ɹiˈmaɪnd/","v.","remind, reminds, reminded, reminded, reminding","reminder (n.)","put in the mind of someone","I'm reminded of the whole Iran thing every time I fly.","remind ourselves; almost remind; regions which remind","B1"
"Regional","/ˈɹidʒənəl/","adj.","regional, more regional, most regional","None","characteristic of a region","The emerging global order is defined by transactional realism, where international law is increasingly superseded by regional spheres of influence.","regional identity; regional enemies hezbollah; biggest regional","B1"
"Reliable","/ɹɪˈlaɪəbəl/","adj.","reliable, more reliable, most reliable","reliability (n.), reliableness (n.)","worthy of reliance or trust","Based on the game and validation task data, we constructed reliable models to simultaneously predict eight cognitive abilities based on the users' in-game behavior.","always reliable; reliable partner; provide reliable","B1"
"Rely","/ɹɪˈlaɪ/","v.","rely, relies, relied, relied, relying","None","have confidence or faith in","Teams adopting async-first workflows report significantly higher productivity than those relying on synchronous real-time meetings for coordination.","rely purely; far rely; tech rely","B1"
"Religious","/ɹɪˈlɪdʒəs/","adj.","religious, more religious, most religious","religion (n.), religiosity (n.), religiousness (n.)","concerned with sacred matters or religion or the church","A Republican judge wants more expansive legal exemptions for religious conservatives.","religious groups; religious beliefs; classic religious","B1"
"Remain","/ɹɪˈmeɪn/","v.","remain, remains, remained, remained, remaining","remainder (n.)","stay the same; remain in a certain state","Please remain in your seats until the bus comes to a stop.","remain open; remain very limited; cause still remain","B1"
"Represent","/ˌɹɛpɹəˈzɛnt/","v.","represent, represents, represented, represented, representing","representation (n.), representative (adj.)","take the place of or be parallel or equivalent to","She was chosen to represent our school at the science fair.","accurately represent; hong kong represent; name represent","B1"
"Republic","/ɹiˈpʌblək/","n.","republic, republics","None","a political system in which the supreme power lies in a body of citizens who can elect people to represent them","The country became a republic after the king left the throne.","soviet socialist republic; bavarian soviet republic; people s republic","B1"
"Remote","/ɹɪˈmoʊt/","adj.","remote, more remote, most remote","remoteness (n.)","located far away spatially","They live in a remote village high in the mountains.","remote path; remote user remote; ipod remote","B1"
"Replace","/ˌɹiˈpleɪs/","v.","replace, replaces, replaced, replaced, replacing","replacing (n.), replacement (n.)","substitute a person or thing for (another that is broken or inefficient or lost or no longer working or yielding what is expected)","Of course, you can choose your favorite editor to change that file and replace this here with the domain name.","completely replace; get replace; replace repository","B1"
"Representative","/ˌɹɛpɹəˈzɛntətɪv/","n.","representative, representatives","represent (v.)","a person who represents others","A representative from the company came to answer our questions.","perfectly representative; fully representative; representative problems","B1"
"Request","/ɹɪˈkwɛst/","n.","request, requests","None","a formal message requesting something that is submitted to an authority","She sent a polite request for more information to the office.","ping request; http request; request here","B1"
"Resist","/ɹɪˈzɪst/","v.","resist, resists, resisted, resisted, resisting","resister (n.), resistant (adj.), resistive (adj.), resistance (n.)","elude, especially in a baffling way","It was hard to resist the smell of the fresh warm bread.","resist conquest; lands resist; longer resist","B1"
"Reserve","/ɹɪˈzɝv/","v.","reserve, reserves, reserved, reserved, reserving","reservation (n.)","hold back or set aside, especially for future use or contingency","I would like to reserve a table for four people on Friday.","probably reserve; biggest reserve; strategic reserve","B1"
"Resource","/ˈɹisɔɹs/","n.","resource, resources","None","available source of wealth; a new or reserve supply that can be drawn upon when needed","Water is a precious resource that we must not waste.","internal resource; scarce resource; resource needed","B1"
"Rid","/ˈɹɪd/","v.","rid, rids, rid, rid, ridding","riddance (n.)","relieve from","We tried hard to rid the garden of weeds before the summer.","gotten rid; wanted rid; rid yourself","B1"
"Ribbon","/ˈɹɪbən/","n.","ribbon, ribbons","ribbony (adj.)","any long object resembling a thin line","Before DRAM, computers relied on magnetic core memory, which had two types: fite and metallic ribbon.","folded ribbon; metallic ribbon; ribbon cables","B1"
"Response","/ɹɪˈspɑns/","n.","response, responses","None","a result","Her response to my email was quick and very polite.","response because; acute inflammatory response; response based","B1"
"Roar","/ˈɹɔɹ/","n.","roar, roars","roarer (n.), roaring (n.)","a deep prolonged loud noise","We heard the loud roar of the lion across the whole zoo.","roar back; bloody roar; roar arc went","B1"
"Ripe","/ˈɹaɪp/","adj.","ripe, riper, ripest","ripeness (n.)","fully developed or matured and ready to be eaten or used","Vision-guided robotic picking systems can distinguish between ripe fruit and leaves in complex, high-density canopies without causing any bruising.","ripe grain; ripe apples; till ripe","B1"
"Responsibility","/ɹiˌspɑnsəˈbɪləti/","n. [U]","no changes","responsible (adj.)","the social force that binds you to the courses of action demanded by that force","Of responsibility, but the infrastructure of the internet doesn't allow it.","responsibility now; assume responsibility; big responsibility","B1"
"Restrict","/ɹisˈtɹɪkt/","v.","restrict, restricts, restricted, restricted, restricting","restriction (n.), restrictive (adj.)","place restrictions on","It is also shown that this result can be utilized to optimize over a restricted class of measurements, such as sequential or separable measurements.","restrict class; restrict attention; restrict diets","B1"
"Reveal","/ɹɪˈvil/","v.","reveal, reveals, revealed, revealed, revealing","revealing (n.), revelation (n.), revelatory (adj.)","make visible","She pulled back the curtain to reveal a beautiful green garden.","reveal things; reveal themselves; reveal itself","B1"
"Rotten","/ˈɹɑtən/","adj.","rotten, more rotten, most rotten","rottenness (n.)","very bad","The apples at the bottom of the box were soft and rotten.","rotten egg; rotten fruit; rotten wood","B1"
"Roast","/ˈɹoʊst/","v.","roast, roasts, roasted, roasted, roasting","roaster (n.), roasting (n.)","cook with dry heat, usually in an oven","I eat the raw or roasted cacao beans.","roast potatoes; roast coffee sometimes; roast dinner","B1"
"Robbery","/ˈɹɑbɚi/","n.","robbery, robberies","rob (v.)","the crime of stealing money or things from a place or person","The police arrested two men after the robbery at the local bank.","a bank robbery; commit a robbery; an armed robbery","B1"
"Robe","/ˈɹoʊb/","n.","robe, robes","None","any loose flowing garment","Justices, robes, class photos, but its court's powers are slightly more broad in a way that's pivotal to the story.","funny robe; robe burn; robe it's putting","B1"
"Roughly","/ˈɹʌfli/","adv.","roughly, more roughly, most roughly","None","(of quantities) imprecise but fairly close to correct","Each year, medical schools collectively reject roughly as many applicants as they ultimately enroll.","roughly accurate; roughly doubled; business roughly","B1"
"Risk","/ˈɹɪsk/","n. [U]","no changes","risky (adj.)","a source of danger; a possibility of incurring loss or misfortune","Neuro-symbolic systems now provide 'traceable reasoning' pathways, allowing organizations to audit and defend AI decisions by connecting data patterns to explicit risk policies.","far greater risk; high risk; immediate systemic risk","B1"
"Rob","/ˈɹɑb/","v.","rob, robs, robbed, robbed, robbing","robber (n.), robbery (n.)","take something away by force or without the consent of the owner","I think Rob Reiner wrote that movie.","rob filed; flew rob; socket rob","B1"
"Rug","/ˈɹʌɡ/","n.","rug, rugs","None","floor covering consisting of a piece of thick heavy fabric (usually with nap or pile)","She put a soft rug on the floor in front of the fire.","rug i'm buying; nice rug; rug pulled out","B1"
"Sack","/ˈsæk/","n.","sack, sacks","sacking (n.)","a bag made of paper or plastic for holding customer's purchases","He carried a heavy sack of potatoes on his back to the house.","sack constantinople; brazil nut sack; foot with sack","B1"
"Rot","/ˈɹɑt/","v.","rot, rots, rotted, rotted, rotting","rotting (n.)","break down","The last thing we want is to put new walls on only to discover that we have rot in the wood.","rot into; rot anything; internal rot","B1"
"Rocket","/ˈɹɑkət/","n.","rocket, rockets","rocketry (n.)","any vehicle self-propelled by a rocket engine","The rocket rose into the sky and soon disappeared from view.","firing rocket; rocket across; rocket fired signifies","B1"
"Rough","/ˈɹʌf/","adj.","rough, rougher, roughest","roughness (n.)","having or caused by an irregular surface","I was in the beginning of my career doing training in emotional regulation in London, outside of London, a very rough and tough neighborhood.","rough mount fuji; rough around; little bit rough","B1"
"Rumor","/ˈɹumɚ/","n. [U]","no changes","None","gossip (usually a mixture of truth and untruth) passed around by word of mouth","There is a rumor that our school will close early on Friday.","rumor emerged; exaggerated rumor; interesting rumor","B1"
"Romantic","/ɹoʊˈmæntɪk/","adj.","romantic, more romantic, most romantic","romance (n.), romanticism (n.)","belonging to or characteristic of Romanticism or the Romantic Movement in the arts","I'm a romantic, I, when I read history, I usually end up rooting for the losers.","romantic comedy; something romantic; especially romantic","B1"
"Routine","/ɹuˈtin/","n.","routine, routines","None","an unvarying or habitual method or procedure","Getting up early is part of my daily morning routine.","square root routine; routine based; perfect routine","B1"
"Salary","/ˈsælɚi/","n.","salary, salaries","None","something that remunerates","She earns a good salary at her new job in the city.","high salary; japanese salary; salary plus","B1"
"Sake","/ˈseɪk/","n.","sake, sakes","None","a reason for wanting something done","For the sake of your health, you should sleep more at night.","goodness sake; efficiency sake; technologies sake","B1"
"Saucer","/ˈsɔsɚ/","n.","saucer, saucers","None","something with a round shape resembling a flat circular plate","The player controls a spaceship in an Asteroid belt which is periodically traversed by flying saucers.","saucer section; saucer gender explorations; saucer remained popular","B1"
"Satisfactory","/ˌsætəˈsfæktɹi/","adj.","satisfactory, more satisfactory, most satisfactory","satisfy (v.), satisfactoriness (n.)","giving satisfaction","We have to step up to higherend hardware to get a broadly satisfactory outcome.","satisfactory results; satisfactory performance; satisfactory account","B1"
"Sauce","/ˈsɔs/","n.","sauce, sauces","None","flavorful relish or dressing or topping served as an accompaniment to food","She poured a rich tomato sauce over the warm pasta.","sauce behind; open sauce; special sauce","B1"
"Sausage","/ˈsɔsədʒ/","n.","sausage, sausages","None","highly seasoned minced meat stuffed in casings","I also tried this ridiculously long sausage, which wound up a lot less impressive than I thought it would be.","sausage which wound; ridiculously long sausage; quality sausage","B1"
"Rush","/ˈɹʌʃ/","v.","rush, rushes, rushed, rushed, rushing","rushy (adj.), rusher (n.), rushing (n.)","move fast","It was put together in less than a month, totally rushed.","bush administration's rush; dopamine rush; situation rush","B1"
"Saving","/ˈseɪvɪŋ/","n.","saving, savings","None","an act of economizing; reduction in cost","She used her savings to buy a small car last year.","saving grace; saving private ryan; ones saving","B1"
"Scarce","/ˈskɛɹs/","adj.","scarce, scarcer, scarcest","scarcely (adv.), scarcity (n.)","deficient in quantity or number compared with the demand","Clean water became scarce in the village during the dry summer.","scarce world; scarce winters; scarce than others","B1"
"Scarf","/ˈskɑɹf/","n.","scarf, scarves","None","a garment worn around the head or neck or shoulders for warmth or decoration","You scarf down breakfast on the way to school.","scarf wear; scarf okay; red scarf","B1"
"Scary","/ˈskɛɹi/","adj.","scary, scarier, scariest","None","provoking fear terror","Other people call that scary and disregulated.","extremely scary; getting scary; scary everything's scary","B1"
"Scale","/ˈskeɪl/","n.","scale, scales","scaly (adj.), scalar (adj.), scaley (adj.), scalic (adj.), scalage (n.), scaling (n.)","an ordered reference standard","On a scale of one to ten, how much did you enjoy the film?","greater scale; bigger scale; small scale","B1"
"Scholarship","/ˈskɑlɚˌʃɪp/","n.","scholarship, scholarships","scholar (n.)","financial aid provided to a student on the basis of academic merit","He won a scholarship that paid for all his years at college.","a full scholarship; win a scholarship; apply for a scholarship","B1"
"Scholar","/ˈskɑlɚ/","n.","scholar, scholars","scholarly (adj.), scholarship (n.)","a learned person (especially in the humanities); someone who by long study has gained mastery in one or more disciplines","The young scholar spent many hours reading old books in the library.","modern scholar; regular scholar; favorite scholar","B1"
"Scout","/ˈskaʊt/","n.","scout, scouts","scouter (n.), scouting (n.)","a person employed to keep watch for some anticipated event","The army sent a scout ahead to check the road for danger.","scout cookies; selling girl scout; yahoo scout","B1"
"Seal","/ˈsil/","n.","seal, seals","sealer (n.), sealant (n.), sealing (n.)","fastener consisting of a resinous composition that is plastic when warm; used for sealing documents and parcels and letters","A grey seal swam close to the boat and looked at us.","former navy seal; really nice seal; seal team operator","B1"
"Scatter","/ˈskætɚ/","v.","scatter, scatters, scattered, scattered, scattering","scattering (n.)","to cause to separate and go in different directions","However, the scattered laser light in solid-state implementations can dominate over the single photons, imposing an outstanding challenge to perfect single-photon sources.","scatter plots; multiple scatter; side scatter","B1"
"Scissors","/ˈsɪzɚz/","n. [U]","no changes","None","an edge tool having two crossed pivoting blades","Great scissors, oh yeah, plus a really good pocket clip.","scissors oh yeah; great scissors; scissors against","B1"
"Scientific","/ˌsaɪəˈntɪfɪk/","adj.","scientific, more scientific, most scientific","None","of or relating to the practice of science","They used a scientific method to test their new idea carefully.","scientific rigor; scientific discovery; scientific community","B1"
"Scientist","/ˈsaɪəntɪst/","n.","scientist, scientists","science (n.)","a person with advanced knowledge of one or more sciences","The scientist did many tests before sharing the results with others.","social scientist; behavior scientist; incredible scientist","B1"
"Semester","/səˈmɛstɚ/","n.","semester, semesters","semestral (adj.), semestrial (adj.)","one of two divisions of an academic year","She will study three new subjects during the next semester at school.","next semester; spring semester; couple semester","B1"
"Screw","/ˈskɹu/","n.","screw, screws","screwing (n.)","someone who guards prisoners","He used a small screw to fix the loose handle on the door.","four screw; screw terminals; fan screw","B1"
"Scream","/ˈskɹim/","v.","scream, screams, screamed, screamed, screaming","screamer (n.), screaming (n.)","utter a sudden loud cry","The children began to scream when they saw the big spider.","guys scream; crazy scream; scream close","B1"
"Security","/sɪˈkjʊɹəti/","n. [U]","no changes","secure (adj.)","the state of being free from danger or injury","Nations now treat strategic control over compute and data corridors with the same national security weight as shipping lanes or oil pipelines.","security adviser under; need local security; entire un security","B1"
"Shampoo","/ʃæˈmpu/","n. [U]","no changes","None","cleansing agent consisting of soaps or detergents used for washing the hair","I don't use deodorant or shampoo or any of that stuff.","argue samurai shampoo; purple shampoo; shampoo over","B1"
"Shepherd","/ˈʃɛpɚd/","n.","shepherd, shepherds","None","a clergyman who watches over a group of people","The shepherd led his sheep across the hills to fresh grass.","idea but shepherd; shepherd singing; shepherd always knew","B1"
"Sensible","/ˈsɛnsəbəl/","adj.","sensible, more sensible, most sensible","sense (v.), sensibility (n.), sensibleness (n.)","showing reason or sound judgment","Now, back to your regular scheduled programming… To Target executives, this sounded the best, most sensible, long-term decision.","sensible defaults; sensible until; seem sensible","B1"
"Separation","/ˌsɛpɚˈeɪʃən/","n.","separation, separations","separate (v.)","the state of lacking unity","The separation of the two friends made them both very sad.","separation ordinance; separation principle; large separation","B1"
"Shadow","/ˈʃæˌdoʊ/","n.","shadow, shadows","shadowy (adj.), shadower (n.), shadowing (n.)","shade within clear boundaries","The tall tree cast a long shadow across the quiet garden.","creed shadow; shadow apps; under shadow","B1"
"Shallow","/ˈʃæloʊ/","adj.","shallow, shallower, shallowest","shallowness (n.)","lacking physical depth; having little spatial extension downward or inward from an outer surface or backward or outward from a center","It was known mostly for strong winds, unpredictable crosscurrents and shallow reefs that made navigating it dangerous.","vast shallow; shallow lake ecosystems; shallow reefs","B1"
"Shorten","/ˈʃɔɹtən/","v.","shorten, shortens, shortened, shortened, shortening","shortener (n.), shortening (n.)","make shorter than originally intended; reduce or retrench in length or duration","The first stage of an ovulation disorder is a luteal phase defect, meaning a shortening of your luteal phase.","shorten form; shorten version; shorten breaks","B1"
"Shiny","/ˈʃaɪni/","adj.","shiny, shinier, shiniest","shine (n.), shininess (n.)","reflecting light","For decades, visitors to China have marvelled at its built environment — the lightning-fast trains, the futuristic skylines, and shiny, colossal bridges.","shiny pieces; couple shiny; shiny light","B1"
"Silk","/ˈsɪlk/","n. [U]","no changes","silky (adj.)","a fabric made from the fine threads produced by certain insect larvae","She wore a soft silk dress to the wedding last weekend.","ancient silk; hub where silk; silk sheet","B1"
"Senior","/ˈsinjɚ/","adj.","senior, more senior, most senior","seniority (n.)","older; higher in rank; longer in length of tenure or service","She is a senior member of the team with many years of experience.","senior vice president; senior director; senior lecturer","B1"
"Shortly","/ˈʃɔɹtli/","adv.","shortly, more shortly, most shortly","None","for a short time","The train will arrive shortly, so please wait on the platform.","shortly afterwards; shortly cover; atmosphere shortly","B1"
"Shovel","/ˈʃʌvəl/","n.","shovel, shovels","shoveler (n.)","a hand tool for lifting loose material; consists of a curved container or scoop and a handle","He used a shovel to dig a hole for the new tree.","shovel knight; shovel says; man selling shovel","B1"
"Shrimp","/ˈʃɹɪmp/","n.","shrimp, shrimps","shrimpy (adj.), shrimper (n.)","disparaging terms for small people","Corin Cesaric-Epple/CNET Blackened shrimp with quinoa grits: This meal was one of my favorites, but it was not very filling.","ate big shrimp; flip on shrimp; shrimp options","B1"
"Sigh","/ˈsaɪ/","v.","sigh, sighs, sighed, sighed, sighing","None","heave or utter a sigh; breathe deeply and heavily","I think it's important to say yes, you can probably take a sigh of relief that most likely, you won't have trouble again.","sigh relief; damaged sigh; sigh over","B1"
"Signal","/ˈsɪɡnəl/","n.","signal, signals","signaler (n.), signaling (n.), signalize (v.), signaller (n.)","any nonverbal action or gesture that encodes a message","The driver gave a clear signal before he turned left at the corner.","honest signal; gps signal; input signal","B1"
