"word","ipa","pos","inflections","derivatives","definition","example","collocations","context_type"
"Lollipop","/ˈlɑliˌpɑp/","n.","lollipop, lollipops","None","ice cream or water ice on a small wooden stick","The little girl smiled as she licked her strawberry lollipop in the park.","lollipop even though; lollipop due; replace lollipop","B1"
"Loser","/ˈluzɚ/","n.","loser, losers","lose (v.)","a person who does not win a game, race, or competition","The loser of the match shook hands with the winner and smiled politely.","a sore loser; the loser of the game; a graceful loser","B1"
"Lobby","/ˈlɑbi/","n.","lobby, lobbies","lobbyist (n.)","a large entrance or reception room or area","AMD hasn't updated the links, after all, to its federal lobby and disclosure forms on its policy page for a year now.","federal lobby; lobby works too; china lobby","B1"
"Location","/loʊˈkeɪʃən/","n.","location, locations","locate (v.)","a point or extent in space","Change the site route to our location where the website is uploaded.","certain location; key location; highly strategic location","B1"
"Lover","/ˈlʌvɚ/","n.","lover, lovers","love (v.)","a person who loves someone or is loved by someone","She is a great lover of old films and watches one almost every night.","lover blind; liquid glass lover; lover more easily","B1"
"Lord","/ˈlɔɹd/","n.","lord, lords","lordly (adj.), lordship (n.)","terms referring to the Judeo","In the old story, the lord owned a large castle and many fields.","lord knows; lord okay; best five lord","B1"
"Loose","/ˈlus/","adj.","loose, looser, loosest","looseness (n.)","not compact or dense in structure or arrangement","Got loose when we were moving something.","loose cannon indian; dangerous loose; loose ends","B1"
"Log","/ˈlɔɡ/","n.","log, logs","logger (n.), logging (n.)","a segment of the trunk of a tree when stripped of branches","He sat on a fallen log by the river and ate his lunch.","securely log; query log; always log","B1"
"Lock","/ˈlɑk/","n.","lock, locks","locker (n.), lockage (n.)","a fastener fitted to a door or drawer to keep it firmly closed","You can start and stop containers, even deploy new projects or check locks.","lock lines; lock entries; guardian lock","B1"
"Luggage","/ˈlʌɡədʒ/","n. [U]","no changes","lug (v.)","cases used to carry belongings when traveling","We carried our heavy luggage up the stairs to the hotel room.","leave our luggage; off our luggage; lose their luggage","B1"
"Magician","/məˈdʒɪʃən/","n.","magician, magicians","magic (n.)","someone who performs magic tricks to amuse an audience","She's , ""You're a magician."" I'm , ""I'm not a magician.","influential magician; talented m magician; real deal magician","B1"
"Lung","/ˈlʌŋ/","n.","lung, lungs","None","either of two saclike respiratory organs in the chest of vertebrates; serves to remove carbon dioxide and provide oxygen to the blood","The doctor listened to my lungs and told me to breathe deeply.","tiny lung; lung samples; lung everything","B1"
"Magical","/ˈmædʒɪkəl/","adj.","magical, more magical, most magical","magic (n.)","possessing or using or characteristic of or appropriate to supernatural powers; - Shakespeare","I'm creating a vial of this magical juice that you can use for your rat.","magical place; magical formula; almost magical","B1"
"Maid","/ˈmeɪd/","n.","maid, maids","maidhood (n.)","a female domestic","The former are often recruited as maids, nannies, and cooks; the latter as drivers, construction workers, security guards, and electricians.","maid mea; maid cafes; perfect maid","B1"
"Mall","/ˈmɔl/","n.","mall, malls","None","a public area set aside as a pedestrian walk","We spent the whole afternoon shopping at the new mall in town.","dystopian mall; shopping mall; mall somebody shot","B1"
"Marble","/ˈmɑɹbəl/","n. [U]","no changes","marbleize (v.)","a smooth, hard stone used for floors, statues, and buildings","The grand hall had a shiny floor made of white marble.","white marble; marble floor; marble statue","B1"
"Majority","/məˈdʒɔɹəti/","n.","majority, majorities","major (adj.)","the property resulting from being or relating to the greater in number of two parts; the main part","The majority of students in our class enjoy learning foreign languages.","super majority; majority leader; absolute vast majority","B1"
"Marvelous","/ˈmɑɹvələs/","adj.","marvelous, more marvelous, most marvelous","marvel (n.)","extraordinarily good or great; used especially as intensifiers","On the other hand, how marvelous is it that nature created this phenomenon that allows it to be aware of itself.","marvelous job; truly marvelous; marvelous cake","B1"
"Magnet","/ˈmæɡnət/","n.","magnet, magnets","magnetic (adj.), magnetise (v.), magnetize (v.)","a piece of iron or steel that can pull other metal objects toward it","That nice cool feature to hold the lid on is created by some very strong magnets.","big magnet; huge finger magnet; couple magnet","B1"
"Meadow","/ˈmɛˌdoʊ/","n.","meadow, meadows","None","a field where grass or alfalfa are grown to be made into hay","The Meadow, Texas-based family winery operation filed its petition, No.","aux meadow; meadow discovered concerning; named timothy meadow","B1"
"Mayor","/ˈmeɪɚ/","n.","mayor, mayors","mayoral (adj.)","the head of a city government","The mayor promised to build more parks and schools for the city.","office mayor; describe mayor; mayor daley","B1"
"Marker","/ˈmɑɹkɚ/","n.","marker, markers","mark (v.)","some conspicuous object used to distinguish or mark something","Predictive injury systems integrate biomechanical data with physiological stress markers to provide an actionable readiness score for professional athletes.","marker gene trees; marker supplementary fig; canonical marker","B1"
"Melon","/ˈmɛlən/","n.","melon, melons","None","any of numerous fruits of the gourd family having a hard rind and sweet juicy flesh","She cut the sweet melon into small pieces for the children.","blind melon; about those melon; watch coco melon","B1"
"Medal","/ˈmɛdəl/","n.","medal, medals","medalist (n.), medallist (n.)","an award for winning a championship or commemorating some other event","A very talented YouTuber did, and he deserves a medal for it.","medal level; medal every four; medal winning mathematician","B1"
"Mathematical","/ˌmæθəˈmætɪkəl/","adj.","no changes","mathematics (n.)","of or pertaining to or of the nature of mathematics","Thus, the question whether accounting numbers through models based on mathematical economics truly affect business value has an answer: Maybe, yes.","mathematical proofs; mathematical investigation; mathematical reasoning","B1"
"Merry","/ˈmɛɹi/","adj.","merry, merrier, merriest","merriness (n.)","full of or showing high-spirited merriment; - Wordsworth","Everyone was merry and laughing at the birthday party last night.","merry gentlemen; merry month; yo merry","B1"
"Media","/ˈmidiə/","n.","media, medias","None","a means or instrumentality for storing or communicating information","Aura farming involves deliberately curating ones vibe and aesthetic on social media to appear cooler or more based to followers.","media platforms; media campaigns wherever; viz media","B1"
"Meaningful","/ˈminɪŋfəl/","adj.","meaningful, more meaningful, most meaningful","meaningfulness (n.)","having a meaning or purpose","The specialized experts are interpretable and causally meaningful -- ablating a module causes substantial drops on benchmarks requiring its specialized domain.","meaningful connections; meaningful impact; meaningful experiences","B1"
"Meanwhile","/ˈmiˌnwaɪl/","adv.","no changes","None","at the same time but in another place","Meanwhile, not only do taxes fail to compensate for this inequality, they actively make it worse.","now meanwhile; meanwhile we're talking; caroline meanwhile","B1"
"Microwave","/ˈmaɪkɹəˌweɪv/","n.","microwave, microwaves","None","a short electromagnetic wave (longer than infrared but shorter than radio waves); used for radar and microwave ovens and for transmitting telephone, facsimile, video and data","This is an old microwave front panel.","microwave craft; think home microwave; beam microwave","B1"
"Mess","/ˈmɛs/","n.","mess, messes","messy (adj.)","a state of confusion and disorderliness","It's it's a bit of a mess out there, but you're going to put some clarification on things for people.","whole mess; complete mess; giant mess","B1"
"Mental","/ˈmɛntəl/","adj.","mental, more mental, most mental","mentality (n.)","involving the mind or an intellectual process","Regular exercise is good for both your body and your mental health.","mental states; mental toughness; mental load","B1"
"Mighty","/ˈmaɪti/","adj.","mighty, mightier, mightiest","might (n.), mightiness (n.)","having or showing great strength or force or intensity; - Bulwer-Lytton","The mighty river flowed quickly past the small village in the valley.","avengers earth's mighty; mighty ethan; mighty technology industry","B1"
"Misery","/ˈmɪzɚi/","n. [U]","no changes","None","a state of ill-being due to affliction or misfortune","Sharing your misery at what your partner's done wrong is not going to motivate them to do it better for you.","sheer misery; cause misery; end the misery","B1"
"Miracle","/ˈmɪɹəkəl/","n.","miracle, miracles","miraculous (adj.)","any amazing or wonderful occurrence","The doctors said her quick recovery was nothing short of a miracle.","miracle drug; real miracle; incredible miracle","B1"
"Minus","/ˈmaɪnəs/","prep.","no changes","None","reduced by a particular amount; used to indicate subtraction or a temperature below zero","There are some that are telling you, almost a pregnancy test, plus minus, are sperm present, are sperm not.","cost per minus; candy brands minus; minus five","B1"
"Mission","/ˈmɪʃən/","n.","mission, missions","missioner (n.)","an organization of missionaries in a foreign land sent to carry on religious work","This computational demand is a major stumbling block to the motion planner's application to future NASA missions involving the swarm of space vehicles.","suicide mission; mission there; mission critical","B1"
"Mob","/ˈmɑb/","n.","mob, mobs","mobster (n.)","a disorderly crowd of people","I think we see that in cancel culture mobs.","online mob; drunk mob; mob came around","B1"
"Missing","/ˈmɪsɪŋ/","adj.","missing, more missing, most missing","None","not able to be found","Hybrid solar LED systems deliver natural sunlight to upper tiers of vertical farms while supplementing missing spectral gaps using PWM dimming.","missing out; missing pieces; probably missing","B1"
"Moisture","/ˈmɔɪstʃɚ/","n. [U]","no changes","moisten (v.), moisturise (v.), moisturize (v.)","wetness caused by water","He sopped up whatever moisture was on his laptop.","moisture content; moisture out; moisture particularly","B1"
"Mist","/ˈmɪst/","n.","mist, mists","misty (adj.)","a thin fog with condensation near the ground","It's a mist that is collected from the CNC mills that contains residues from oil.","invisible mist; mist off; pillow mist","B1"
"Moist","/ˈmɔɪst/","adj.","moist, moister, moistest","moistness (n.)","slightly wet","He has my issue where I don't think I don't know if he's capable of sounding not Moist Critical when it is.","warm moist; moist critical; sounding not moist","B1"
"Monk","/ˈmʌŋk/","n.","monk, monks","None","a male religious living in a cloister and devoting himself to contemplation and prayer and work","The old monk lived alone and spent his days praying and reading.","driveling monk; like monk; cowlless monk","B1"
"Missile","/ˈmɪsəl/","n.","missile, missiles","None","a rocket carrying a warhead of conventional or nuclear explosives; may be ballistic or directed by remote control","He starts shooting missiles and dropping bombs on Iranian cities all over the country, including the capitol.","cuban missile; intercontinental ballistic missile; missile destroyers","B1"
"Mosquito","/məˈskitoʊ/","n.","mosquito, mosquitoes","None","two-winged insect whose female has a long proboscis to pierce the skin and suck the blood of humans and animals","I fear a small mosquito has entered my oil and vinegar mixture.","mosquito biting; keep mosquito; mosquito away","B1"
"Mend","/ˈmɛnd/","v.","mend, mends, mended, mended, mending","mender (n.), mending (n.)","restore by replacing a part or putting together what is torn or broken","She used a needle and thread to mend the hole in her shirt.","somehow mend; mend broken items; included mend","B1"
"Mobile","/ˈmoʊbəl/","adj.","mobile, more mobile, most mobile","mobility (n.)","migratory","Older patients are often less mobile and need help moving around.","mobile strategy; every mobile; mint mobile","B1"
"Monster","/ˈmɑnstɚ/","n.","monster, monsters","monstrous (adj.)","an imaginary creature usually having various human and animal parts","The child was afraid of the monster he saw in his dream.","giant monster; monster ass; whole monster","B1"
"Motel","/moʊˈtɛl/","n.","motel, motels","None","a motor hotel","I feel it also."" And I went into No-Tell Motel, which was my favorite bar, to be in a familiar environment.","into no-tell motel; cheap motel; motel stories","B1"
"Monthly","/ˈmʌnθli/","adj.","no changes","month (n.)","of or occurring or payable every month","She pays a small monthly fee to use the local sports centre.","monthly subscription; monthly japanese artisan; monthly basis","B1"
"Moral","/ˈmɔɹəl/","adj.","moral, more moral, most moral","morality (n.)","concerned with principles of right and wrong or conforming to standards of behavior and character based on those principles","Transhumanists argue that super-intelligent but unfeeling AI is more dangerous than conscious ones because only empathy can provide a shared moral compass.","moral lessons; moral sentiments; moral beauty","B1"
"Melt","/ˈmɛlt/","v.","melt, melts, melted, melted, melting","melter (n.), melting (n.), meltable (adj.)","reduce or cause to be reduced from a solid to a liquid state, usually by heating","Once the game ends, we get a melt from them.","partially melt; cultural melt; both sides melt","B1"
"Moth","/ˈmɔθ/","n.","moth, moths","mothy (adj.)","an insect like a butterfly that usually flies at night","A small brown moth flew around the bright lamp all evening.","brown moth; tiny moth; moth flew","B1"
"March","/ˈmɑɹtʃ/","v.","march, marches, marched, marched, marching","marcher (n.), marching (n.)","march in a procession","The soldiers had to march for many hours across the open field.","early march; march orders; march comes","B1"
"Locate","/ˈloʊˌkeɪt/","v.","locate, locates, located, located, locating","locater (n.), locator (n.), location (n.)","discover the location of; determine the place of; find by searching or examining","We used a map to locate the small town near the coast.","locate nearby; currently locate; locate outside","B1"
"Mostly","/ˈmoʊstli/","adv.","mostly, more mostly, most mostly","None","in large part; mainly or chiefly","The audience was mostly made up of students and young families.","mostly nonsense; mostly protecting; mostly merchants","B1"
"Mushroom","/ˈmʌʃɹum/","n.","mushroom, mushrooms","None","common name for an edible agaric (contrasting with the inedible toadstool)","We picked fresh mushrooms in the forest and cooked them for dinner.","golden oyster mushroom; magic mushroom; collect mushroom","B1"
"Nap","/ˈnæp/","n.","nap, naps","nappy (adj.)","a period of time spent sleeping","After lunch he took a short nap on the sofa for an hour.","little nap; nap time; nap here","B1"
"Multiply","/ˈmʌltəˌplaɪ/","v.","multiply, multiplies, multiplied, multiplied, multiplying","multiplication (n.), multiple (n.)","combine by multiplication","If you multiply six by four, you get twenty-four as the answer.","propose multiply; dt multiply; maybe multiply","B1"
"Motor","/ˈmoʊtɚ/","n.","motor, motors","motoring (n.), motorist (n.), motorize (v.)","machine that converts other forms of energy into mechanical energy and so imparts motion","That visual signal then goes to your speech pathway in the motor cortex in front here in Brocas area.","hyundai motor; motor systems; motor pathways","B1"
"Napkin","/ˈnæpkɪn/","n.","napkin, napkins","None","a small piece of table linen that is used to wipe the mouth and to cover the lap in order to protect clothing","These incentives allow it to go from napkin sketch to completed skyscraper in no time flat.","a paper napkin; fold a napkin; a clean napkin","B1"
"Mystery","/ˈmɪstɚi/","n. [U]","no changes","mystify (v.), mysterious (adj.)","something that baffles understanding and cannot be explained","This is the big mystery of the Brazilian case incidentally is why the military said no to the coup because they were offered it.","big mystery; real mystery; whole mystery","B1"
"Naked","/ˈneɪkəd/","adj.","naked, more naked, most naked","nakedness (n.)","completely unclothed","The baby kicked happily on the bed with its naked feet in the air.","get naked; got naked; sleep naked","B1"
"Murder","/ˈmɝdɚ/","n.","murder, murders","murderer (n.), murderous (adj.)","unlawful premeditated killing of a human being by a human being","The detective spent years trying to solve the mysterious murder.","murder capital; murder each; murder everyone","B1"
"Muscle","/ˈmʌsəl/","n.","muscle, muscles","muscular (adj.)","one of the contractile organs of the body","New startups showcased systems that use EMG sensors and AI to analyze muscle activation and fatigue in real-time during live training.","muscle because; muscle groups; willpower muscle","B1"
"Navy","/ˈneɪvi/","n.","navy, navies","None","an organization of military vessels belonging to a country and available for sea warfare","Her brother joined the navy and now sails on a large ship.","navy fed offers; navy fed s; navy officials","B1"
"Necktie","/ˈnɛˌktaɪ/","n.","necktie, neckties","None","neckwear consisting of a long narrow piece of material worn (mostly by men) under a collar and tied in knot at the front","He wore a blue necktie with his white shirt to the interview.","necktie tightening moment; black necktie; black monday necktie","B1"
"Neat","/ˈnit/","adj.","neat, neater, neatest","neatness (n.)","clean or organized","Here, particles swirl in three-dimensional space according to player movement, which is a really neat effect.","pretty neat; neat algorithm; neat touch","B1"
"Novelist","/ˈnɑvələst/","n.","novelist, novelists","novel (n.)","one who writes novels","The young novelist spent two years writing her first long book.","bad boy novelist; novelist writers; great novelist","B1"
"Necessity","/nəˈsɛsəti/","n.","necessity, necessities","necessary (adj.), necessitate (v.), necessitous (adj.)","the condition of being essential or indispensable","Neural-symbolic AI has transitioned from research to a production necessity, driven by the need for 'provably correct' decisions in high-stakes fields healthcare and finance.","necessity driven; production necessity; structural necessity","B1"
"Native","/ˈneɪtɪv/","adj.","native, more native, most native","nativeness (n.)","characteristic of or existing by virtue of geographic origin","She speaks her native language at home and English at school.","native music fluency; native client; get native","B1"
"Nest","/ˈnɛst/","n.","nest, nests","nester (n.)","a structure in which animals lay eggs or give birth to their young","Two small birds built a nest in the tree outside my window.","nest look; nest operating system; against other nest","B1"
"Nickname","/ˈnɪˌkneɪm/","n.","nickname, nicknames","None","a familiar name for a person (often a shortened version of a person's given name)","Despite its nickname, Georgia doesn't even produce the most peaches in the US.","wolf wolves nickname; nickname based; favorite nickname","B1"
"Nun","/ˈnʌn/","n.","nun, nuns","None","a woman who lives in a religious community and has promised to serve God","The kind nun taught the village children to read and write every morning.","become a nun; a young nun; an old nun","B1"
"Oak","/ˈoʊk/","n.","oak, oaks","None","the hard durable wood of any oak; used especially for furniture and flooring","A tall oak tree gave us cool shade during the hot afternoon.","lovely solid oak; thousand oak; oak between","B1"
"Neighborhood","/ˈneɪbɚˌhʊd/","n.","neighborhood, neighborhoods","neighbor (n.)","a surrounding or nearby region","I was in the beginning of my career doing training in emotional regulation in London, outside of London, a very rough and tough neighborhood.","white neighborhood; neighborhood playhouse; broad neighborhood","B1"
"Normal","/ˈnɔɹməl/","adj.","normal, more normal, most normal","normality (n.)","usual, ordinary, or expected; not different or strange","It is normal to feel a little nervous before a big test.","normal life; perfectly normal; normal day","B1"
"Onion","/ˈʌnjən/","n.","onion, onions","None","the bulb of an onion plant","He cut up an onion and added it to the soup pot.","onion pizza; cutting onion; onion here","B1"
"Omit","/oʊˈmɪt/","v.","omit, omits, omitted, omitted, omitting","None","to leave out or not include something","He decided to omit the last paragraph because it was not really necessary.","omit a word; omit details; accidentally omit","B1"
"Occasion","/əˈkeɪʒən/","n.","occasion, occasions","None","an event that occurs at a critical time","It's a bit in fashion, the little black dress, you can bring it to any occasion, any moment.","occasion sharing meals; particular occasion; various occasion","B1"
"Odd","/ˈɑd/","adj.","odd, odder, oddest","oddity (n.), oddness (n.)","not divisible by two","It felt odd to see the busy streets so empty and quiet at noon.","odd choice; rather odd; odd easter egg","B1"
"Observe","/əˈbzɝv/","v.","observe, observes, observed, observed, observing","observer (n.), observant (adj.), observable (adj.), observance (n.), observation (n.)","discover or determine the existence, presence, or fact of","We show that extremely small differences in the revision frequency can easily explain the observed variation in margin loan pricing.","never observe; observe variation; currently observe","B1"
"Ongoing","/ˈɑˌnɡoʊɪŋ/","adj.","ongoing, more ongoing, most ongoing","None","currently happening","The repair work on the road is ongoing and may last all month.","ongoing process; ongoing discussion; ongoing transient-state dynamics","B1"
"Opportunity","/ˌɑpɚˈtunəti/","n.","opportunity, opportunities","opportune (adj.)","a possibility due to a favorable combination of circumstances","This job gives her a great opportunity to learn new skills.","real opportunity; opportunity because; great opportunity","B1"
"Operation","/ˌɑpɚˈeɪʃən/","n.","operation, operations","operate (v.), operative (adj.)","the state of being in effect or being operative","The whole operation went smoothly and the patient recovered in a week.","operation centers; floating point operation; operation depends","B1"
"Opposite","/ˈɑpəzət/","adj.","opposite, more opposite, most opposite","oppositeness (n.)","being directly across from each other; facing; - Longfellow","The two brothers have completely opposite views on almost everything.","exact opposite; polar opposite; opposite reaction","B1"
"Onto","/ˈɑntu/","prep.","no changes","None","moving to a position on top of or on a surface; aware of or discovering something important","This process maps the independent components of the sensory input onto the attractor relics, which acquire in this way a semantic meaning.","hold onto; feed back onto; go back onto","B1"
"Outdoor","/ˈaʊˌtdɔɹ/","adj.","no changes","None","located, suited for, or taking place in the open air","Here is another American colony, complete with air-conditioned houses, two hospitals, and an outdoor movie theater.","outdoor lighting; outdoor adventure sports; boundary between outdoor","B1"
"Organize","/ˈɔɹɡəˌnaɪz/","v.","organize, organizes, organized, organized, organizing","organizer (n.), organization (n.)","create (as an entity)","We need to organize the books on the shelves before the guests arrive.","well organize; stay organize; brain organize","B1"
"Oven","/ˈʌvən/","n.","oven, ovens","None","kitchen appliance used for baking or roasting","They're a type of incandescent and the point here is that you can't have LED lights in ovens because they melt.","oven apart because; oven meaning; oven because","B1"
"Organic","/ɔˈɹɡænɪk/","adj.","organic, more organic, most organic","organ (n.), organism (n.)","relating or belonging to the class of chemical compounds having a carbon basis","They're different from dopamine and serotonin in that they're not small organic molecules.","buy organic; organic certified; usda organic","B1"
"Optimistic","/ˌɑptəˈmɪstɪk/","adj.","optimistic, more optimistic, most optimistic","optimism (n.)","expecting the best in this best of all possible worlds","My answer to any question that begins, are you optimistic about the Supreme Court.","optimistic or pessimistic; quite optimistic; optimistic assumption","B1"
"Outdoors","/ˈaʊˈtdɔɹz/","adv.","no changes","outdoorsy (adj.)","outside a building","On warm summer evenings the children love to play outdoors until dark.","get outdoors; nights outdoors; anything that's outdoors","B1"
"Outer","/ˈaʊtɚ/","adj.","outer, more outer, most outer","None","being on the outside or further from a center","It did cook that outer layer pretty nice, though.","outer mongolia; outer side outer; outer component","B1"
"Owl","/ˈaʊl/","n.","owl, owls","owlet (n.)","nocturnal bird of prey with hawk-like beak and claws and large head with front-facing eyes","An owl sat in the dark tree and watched us with wide eyes.","owl technology finance; owl i'd ever; strongest owl","B1"
