"word","ipa","pos","inflections","derivatives","definition","example","collocations","context_type"
"Bomb","/ˈbɑm/","n.","bomb, bombs","bomber (n.), bombing (n.), bomblet (n.)","an explosive device fused to explode under specific conditions","He starts shooting missiles and dropping bombs on Iranian cities all over the country, including the capitol.","dropping bomb; truck bomb; bomb before","B1"
"Brake","/ˈbɹeɪk/","n.","brake, brakes","braky (adj.)","a restraint used to slow or stop a vehicle","Cutting methane emissions acts a climate emergency brake by slowing global warming during the critical transition to a carbon-neutral energy landscape.","brake or throttle; policies for brake; throttle brake","B1"
"Breeze","/ˈbɹiz/","n.","breeze, breezes","breezy (adj.)","a slight wind (usually refreshing)","If you could breeze through it, the brain has no reason to change.","breeze scent; ocean breeze; breeze this happened","B1"
"Breast","/ˈbɹɛst/","n.","breast, breasts","None","the front of the trunk from the neck to the abdomen","The robin has a bright red breast that is easy to recognise.","breast ovarian; mother nose breast; pale skin breast","B1"
"Bore","/ˈbɔɹ/","v.","bore, bores, bored, bored, boring","boredom (n.), boring (n.)","cause to be bored","Home Assistant is boring is something that you'll never hear me say.","pretty bore; bore work; too bore","B1"
"Bride","/ˈbɹaɪd/","n.","bride, brides","bridal (adj.)","a woman who has recently been married","The bride wore a beautiful white dress at the wedding.","new bride; rare bride; bride goes","B1"
"Brick","/ˈbɹɪk/","n.","brick, bricks","None","rectangular block of clay baked by the sun or in a kiln; used as a building or paving material","The only thing we've left is this archway, which is done in brick.","brick layers; brick lane; physical brick","B1"
"Breath","/ˈbɹɛθ/","n.","breath, breaths","None","the process of taking in and expelling air during breathing","Take a bre take a breath and maybe say something , ""Honey, gosh, that looks it's really hard.","zelda breath; normal breath; bad breath","B1"
"Brunch","/ˈbɹʌntʃ/","n.","brunch, brunches","None","a late morning meal eaten instead of breakfast and lunch","We met our friends for brunch on Sunday morning.","have brunch; Sunday brunch; brunch menu","B1"
"Broadcast","/ˈbɹɔˌdkæst/","n.","broadcast, broadcasts","broadcaster (n.)","message that is transmitted by radio or television","Originally, I came here to look at how timing equipment works with modern digital broadcast.","broadcast back; broadcast facility; whole broadcast","B1"
"Broadcast","/ˈbɹɔˌdkæst/","v.","broadcast, broadcasts, broadcasted, broadcast, broadcasting","broadcaster (n.)","broadcast over the airwaves, as in radio or television","Originally, I came here to look at how timing equipment works with modern digital broadcast.","broadcast facility; whole broadcast; broadcast center","B1"
"Breathe","/ˈbɹið/","v.","breathe, breathes, breathed, breathed, breathing","breather (n.), breathing (n.)","draw air into, and expel out of, the lungs","I know that we're obsessed in our world now with breathing and mindfulness, and it's great.","cardiac coherence breathe; breathe room; breathe strategy","B1"
"Bud","/ˈbʌd/","n.","bud, buds","None","a small part of a plant that grows into a flower or leaf","New buds appear on the trees every spring.","flower bud; new buds; buds open","B1"
"Buffalo","/ˈbʌfəˌloʊ/","n.","buffalo, buffaloes","None","large shaggy-haired brown bison of North American plains","A large buffalo stood near the river, drinking the cool water.","buffalo wild wings; gigantic buffalo; hunt things buffalo","B1"
"Buffet","/ˈbʌfət/","n.","buffet, buffets","buffeting (v.)","a piece of furniture that stands at the side of a dining room; has shelves and drawers","We were at some buffet line and I didn't know anybody.","buffet problem; buffet surrounded; breakfast buffet","B1"
"Bubble","/ˈbʌbəl/","n.","bubble, bubbles","bubbly (adj.), bubbler (n.)","a small ball of air or gas in a liquid","The children love to blow soap bubbles in the garden.","blow bubbles; soap bubble; a bubble bursts","B1"
"Bucket","/ˈbʌkət/","n.","bucket, buckets","None","a round open container with a handle for carrying water","She filled the bucket with warm water to wash the floor.","a bucket of water; fill the bucket; plastic bucket","B1"
"Bulb","/ˈbʌlb/","n.","bulb, bulbs","bulbar (adj.), bulbous (adj.), bulblike (adj.), bulbaceous (adj.)","a modified bud consisting of a thickened globular underground stem serving as a reproductive structure","Digital projectors often use similar bulbs, but the resulting images aren't as large or as bright.","olfactory bulb; bulb moment; bulb mode","B1"
"Bull","/ˈbʊl/","n.","bull, bulls","None","uncastrated adult male of domestic cattle","One of my favorite movies, if not my favorite movie, is Raging Bull, man.","bull thesis; bull semen; bull here","B1"
"Bump","/ˈbʌmp/","n.","bump, bumps","bumpy (adj.), bumper (n.)","a lump on the body caused by a blow","It could be a mild clock bump, maybe run the same profiles, etc., etc.","every bump; small bump; mild clock bump","B1"
"Budget","/ˈbʌdʒɪt/","n.","budget, budgets","budgetary (adj.)","a sum of money allocated for a particular purpose","Furthermore, it prioritizes models with low computational requirements, making it accessible to both individuals and institutions operating on limited computing budgets.","limited budget; unlimited budget; tight budget","B1"
"Cafeteria","/ˌkæfəˈtɪɹiə/","n.","cafeteria, cafeterias","None","a restaurant where you serve yourself and pay a cashier","Inside, scammers, whose passports are withheld, live in densely packed dormitories and eat from on-site cafeterias.","school cafeteria; cafeteria food; crowded cafeteria","B1"
"Bundle","/ˈbʌndəl/","n.","bundle, bundles","None","a collection of things wrapped or boxed together","She carried a heavy bundle of clothes up the stairs to her room.","plus requires bundle; single bundle; specific bundle","B1"
"Buzz","/ˈbʌz/","n.","buzz, buzzes","buzzer (n.)","sound of rapid vibration","The whole game there's a constant buzz.","buzz word; positive buzz; constant buzz","B1"
"Bullet","/ˈbʊlət/","n.","bullet, bullets","None","a small piece of metal that is shot from a gun","The police found a bullet on the ground near the wall.","fire a bullet; a single bullet; bullet hole","B1"
"Cabin","/ˈkæbən/","n.","cabin, cabins","None","small room on a ship or boat where people sleep","We slept in a small wooden cabin near the lake during our holiday.","lake cabin; cabin leak suspected; longest cabin","B1"
"Capable","/ˈkeɪpəbəl/","adj.","capable, more capable, most capable","capability (n.), capableness (n.)","(usually followed by `of') having capacity or ability","She is more than capable of leading the team on her own.","capable efficient; capable eating; capable violence","B1"
"Campus","/ˈkæmpəs/","n.","campus, campuses","None","a field on which the buildings of a university are situated","The students walked across the campus to reach the library.","campus cops; campus digital transformation; campus mail delivery","B1"
"Bunch","/ˈbʌntʃ/","n.","bunch, bunches","bunchy (adj.)","a grouping of a number of similar things","Element has a bunch of great tasting flavors.","bunch more justices; bunch more regular; bunch more top","B1"
"Bury","/ˈbɛɹi/","v.","bury, buries, buried, buried, burying","None","to put something or someone into the ground and cover it","The dog likes to bury its bones in the garden.","bury in the ground; bury a body; bury treasure","B1"
"Canyon","/ˈkænjən/","n.","canyon, canyons","None","a ravine formed by a river in an area with little rainfall","All the secret water spots hidden deep in red rock slot canyons.","boulder canyon; meat canyon; rock slot canyon","B1"
"Bush","/ˈbʊʃ/","n.","bush, bushes","bushy (adj.), bushing (n.)","a plant with many small branches that is smaller than a tree","A small bird hid inside the thick green bush in our garden.","thick bush; rose bush; thorny bush","B1"
"Captain","/ˈkæptən/","n.","captain, captains","captainship (n.)","an officer holding a rank below a major but above a lieutenant","The captain told the crew to prepare the ship for the long journey.","captain kirk; captain tape covering; captain scott","B1"
"Cable","/ˈkeɪbəl/","n.","cable, cables","None","a telegram sent abroad","One of the things I found out is that these cables over here are all analog.","link cable; rf cable; network cable","B1"
"Career","/kɚˈɪɹ/","n.","career, careers","careerist (n.)","the particular occupation for which you are trained","I was in the beginning of my career doing training in emotional regulation in London, outside of London, a very rough and tough neighborhood.","entire career; previous career; career forever","B1"
"Cart","/ˈkɑɹt/","n.","cart, carts","carter (n.), cartage (n.)","a heavy open wagon usually having two wheels and drawn by an animal","The farmer loaded the heavy cart with fresh vegetables for the market.","grocery cart; food cart; rolling chapman cart","B1"
"Carpenter","/ˈkɑɹpəntɚ/","n.","carpenter, carpenters","carpentry (n.)","a woodworker who makes or repairs wooden objects","These are your electricians, plumbers, carpenters, and construction workers.","cory carpenter; every carpenter; carpenter with ai","B1"
"Casual","/ˈkæʒəwəl/","adj.","casual, more casual, most casual","casually (adv.), casualty (n.)","relaxed and not formal","He wore casual clothes to the party.","casual clothes; casual conversation; a casual meeting","B1"
"Carriage","/ˈkæɹɪdʒ/","n.","carriage, carriages","carry (v.)","a railcar where passengers ride","Type run and carriage return to execute demonstration program.","carriage instead; around by carriage; carriage companies","B1"
"Cattle","/ˈkætəl/","n.","cattle, cattles","cattleship (n.)","domesticated bovine animals as a group regardless of sex or age; - Bible","They create these cattle stampedes, they block canyons, anything to slow the federal troops down.","cattle die; cattle wagon; called cattle","B1"
"Capture","/ˈkæptʃɚ/","v.","capture, captures, captured, captured, capturing","capturer (n.)","succeed in representing or expressing something intangible","The photographer tried to capture the beauty of the sunset.","motion capture; facial capture; capture more margin","B1"
"Carpet","/ˈkɑɹpət/","n.","carpet, carpets","carpeting (n.)","a thick soft cover for a floor made of cloth","They put a soft red carpet in the living room.","lay a carpet; clean the carpet; soft carpet","B1"
"Champion","/ˈtʃæmpiən/","n.","champion, champions","None","someone who has won first place in a competition","She trained for years and finally became the champion of the race.","british champion; chess champion; national ai champion","B1"
"Charm","/ˈtʃɑɹm/","n.","charm, charms","charmer (n.)","attractiveness that interests or pleases or stimulates","In fact, that's part of its charm.","charm pdf; whimsical charm; charm offensive since","B1"
"Cheerful","/ˈtʃɪɹfəl/","adj.","cheerful, more cheerful, most cheerful","cheerfulness (n.)","being full of or promoting cheer; having or showing good spirits","I don't want to insult them, but and they're and they're very cheerful.","always cheerful; cheerful part; folk song cheerful","B1"
"Cast","/ˈkæst/","v.","cast, casts, cast, cast, casting","caster (n.), casting (n.)","put or send forth","Shadows cast by distant environmental features seem to be pre-calculated, blending poorly with the game's real-time shadow apps.","cast calls; shadows cast; whole cast","B1"
"Cave","/ˈkeɪv/","n.","cave, caves","None","a geological formation consisting of an underground enclosure with access from the surface of the ground or from the sea","Shortly after the fighting begins, Al Houthi is killed in a cave in the north.","cave paintings; cave walls; zero g cave","B1"
"Cheek","/ˈtʃik/","n.","cheek, cheeks","cheeky (adj.)","either side of the face below the eyes","One thing they tend to have in common is this mole on left cheek, which I made up.","left cheek; ass cheek; cheek first","B1"
"Chill","/ˈtʃɪl/","n.","chill, chills","chilly (adj.), chilling (n.)","coldness due to a cold environment","There was a sudden chill in the air as the sun went down.","felt chill; chill productivity; dude chill","B1"
"Chilly","/ˈtʃɪli/","adj.","chilly, chillier, chilliest","chill (n.), chilliness (n.)","not characterized by emotion","You can make the arena a little bit chilly and provide warmth at that location.","chilly more chilly; little bit chilly; chilly tonight","B1"
"Cherry","/ˈtʃɛɹi/","n.","cherry, cherries","None","a small round red fruit with a hard seed inside","She picked a bowl of fresh cherries from the tree.","a bowl of cherries; ripe cherry; cherry tree","B1"
"Chimney","/ˈtʃɪmni/","n.","chimney, chimneys","None","a tall pipe that carries smoke up from a fire out of a building","Smoke rose slowly from the chimney on the cold night.","smoke from the chimney; a tall chimney; clean the chimney","B1"
"Chat","/ˈtʃæt/","n.","chat, chats","chatty (adj.)","an informal conversation","I'd love to chat a moment about facial expression many of which are subconscious.","best chat; different chat; voice chat","B1"
"Chest","/ˈtʃɛst/","n.","chest, chests","chesty (adj.)","the part of the human torso between the neck and the diaphragm or the corresponding part in other vertebrates","That activation of the vagus nerve gives people a sense of warmth in your chest, which sounds the heart chakra.","chest hair; chest wall; treasure chest","B1"
"Chin","/ˈtʃɪn/","n.","chin, chins","None","the protruding part of the lower jaw","He rested his chin on his hands and thought for a while.","getting my chin; angle triple chin; jimmy chin","B1"
"Circus","/ˈsɝkəs/","n.","circus, circuses","None","a travelling company of entertainers; including trained animals","The children laughed at the funny clowns at the circus.","circus comes; traveling circus; circus stronger","B1"
"Chip","/ˈtʃɪp/","n.","chip, chips","chipping (n.)","a small fragment of something broken off from the whole","You've propelled NVIDIA into a new era in AI, moving beyond its focus on chip scale design to now rack scale design.","chip act; guy chip; networking chip","B1"
"Clay","/ˈkleɪ/","n. [U]","no changes","None","a very fine-grained soil that is plastic when moist but hard when fired","Clay underpins really who we are and what we're about.","clay than expected; far more clay; into clay","B1"
"Cinema","/ˈsɪnəmə/","n.","cinema, cinemas","cinematic (adj.)","a medium that disseminates moving pictures","You bust in through the back door of the cinema.","go to the cinema; a local cinema; the cinema screen","B1"
"Chop","/ˈtʃɑp/","v.","chop, chops, chopped, chopped, chopping","choppy (adj.), chopper (n.)","cut into pieces","Chopping up Palestinian land, oppressing them, keeping them in this occupation, was only going to produce more violence.","chop here; chop block; chop wood carry","B1"
"Cigarette","/ˌsɪɡɚˈɛt/","n.","cigarette, cigarettes","None","finely ground tobacco wrapped in paper; for smoking","Things autoimmune disease, insulin resistance, endometriosis, smoking cigarettes.","cigarette somewhere; lit cigarette; buy cigarette","B1"
"Clinic","/ˈklɪnɪk/","n.","clinic, clinics","clinical (adj.)","a medical establishment run by a group of medical specialists","She took her sick cat to the clinic early in the morning.","mayo clinic; cleveland clinic; aids clinic","B1"
"Citizen","/ˈsɪtəzən/","n.","citizen, citizens","citizenship (n.)","a native or naturalized member of a state or other political community","Every citizen has the right to vote in the national election.","israeli citizen; citizen governance; citizen alike","B1"
"Cleaner","/ˈklinɚ/","n.","cleaner, cleaners","clean (v.)","a preparation used in cleaning something","Once you do that, your dashboard will make the header and sidebar disappear, make it look cleaner, more room for the dashboard.","little bit cleaner; cleaner diet; cleaner about","B1"
"Client","/ˈklaɪənt/","n.","client, clients","None","a person who seeks the advice of a lawyer","The lawyer met her client to talk about the difficult case.","client installed; client access; retail client","B1"
"Closet","/ˈklɑzət/","n.","closet, closets","None","a small room (or recess) or cabinet used for storage space","He hung his coat in the closet near the front door.","server closet; broom closet; water closet","B1"
"Civil","/ˈsɪvəl/","adj.","civil, more civil, most civil","civility (n.)","applying to ordinary citizens as contrasted with the military","They tried to stay civil even though they disagreed.","civil liberties; civil disobedience; dei higher civil","B1"
"Clip","/ˈklɪp/","n.","clip, clips","clipper (n.), clipping (n.)","a metal frame or container holding cartridges; can be inserted into an automatic gun","She used a small metal clip to hold the loose papers together.","context clip; good pocket clip; patreon clip","B1"
"Clown","/ˈklaʊn/","n.","clown, clowns","clowning (n.)","a rude or vulgar fool","Mozilla is the latest clown to get into the car for AI.","clown car; find your clown; clown outfit","B1"
"Coach","/ˈkoʊtʃ/","n.","coach, coaches","coaching (n.)","(sports) someone in charge of training an athlete or a team","You're not going to be a sloavvenly coach.","inner coach; search coach; head coach","B1"
"Clue","/ˈklu/","n.","clue, clues","None","a slight indication","I rather naively had no clue that these records would even still exist.","first clue; clue point; whatever these clue","B1"
"Coconut","/ˈkoʊkəˌnʌt/","n.","coconut, coconuts","None","the edible white meat of a coconut; often shredded for use in e.g. cakes and curries","You think you fell out of a coconut tree.","coconut water; coconut crabs everywhere; huge coconut","B1"
"Collection","/kəˈlɛkʃən/","n.","collection, collections","collect (v.)","several things grouped together or considered as a whole","This critical period is designed to facilitate the collection of real-world operational data and empirical evidence from autonomous vessel trials conducted across various jurisdictions.","watch collection; broad collection; collection worth","B1"
"Cocktail","/ˈkɑˌkteɪl/","n.","cocktail, cocktails","None","a short mixed drink","She ordered a fruity cocktail and sat by the pool to relax.","sometimes molotov cocktail; full drug cocktail; cocktail through","B1"
"Colorful","/ˈkʌlɚfəl/","adj.","colorful, more colorful, most colorful","None","having striking color","Combat produces gigantic blasts of colorful VFX as enemies emit orbs for the players to dodge.","colorful characters; quite colorful; colorful well","B1"
"Clothe","/ˈkloʊð/","v.","clothe, clothes, clothed, clothed, clothing","clothing (n.)","provide with clothes or put clothes on","The charity works hard to feed and clothe the poor families.","beautiful clothe; wearing clothe; sell clothe","B1"
"Colony","/ˈkɑləni/","n.","colony, colonies","colonial (adj.), colonise (v.), colonist (n.), colonize (v.)","a body of people who settle far from home but maintain ties with their homeland; inhabitants remain nationals of their home state but are not literally under the home state's system of government","Here is another American colony, complete with air-conditioned houses, two hospitals, and an outdoor movie theater.","different colony; colony complete; american colony","B1"
"Collar","/ˈkɑlɚ/","n.","collar, collars","None","a band that fits around the neck and is usually folded over","It appears that these entrylevel white collar jobs are the ones that are now suffering.","collar elements; collar bones popped; huge collar","B1"
"Complaint","/kəmˈpleɪnt/","n.","complaint, complaints","complain (v.)","an often persistent bodily disorder or disease; a cause for complaining","The customer made a complaint about the cold food in the restaurant.","big complaint; legitimate complaint; complaint said","B1"
"Comma","/ˈkɑmə/","n.","comma, commas","None","a punctuation mark (,) used to indicate the separation of elements within the grammatical structure of a sentence","For whatever reason, it needs a comma at this point.","start self comma; comma humanity; comma pouring out","B1"
"Column","/ˈkɑləm/","n.","column, columns","columnar (adj.), columnist (n.)","a line of units following one after another","It has to be split into three sections in order to fit around the structural columns that are supporting the stands above.","third column; fifth column; second column","B1"
"Comfort","/ˈkʌmfɚt/","n. [U]","no changes","comforter (n.)","a state of being relaxed and feeling no pain","There exists a need for autonomous vehicles to negotiate a multi-agent environment while ensuring safety and comfort.","comfort over; comfort designed; find comfort","B1"
"Cone","/ˈkoʊn/","n.","cone, cones","None","any cone-shaped artifact","The child happily licked the ice cream from the sweet cone.","cone because; downward closed cone; cone up","B1"
"Comparison","/kəˈmpɛɹəsən/","n.","comparison, comparisons","compare (v.)","the act of examining resemblances","A quick comparison of the two phones shows that one is much cheaper.","image quality comparison; tame by comparison; comparison group","B1"
"Communicate","/kəˈmjunəˌkeɪt/","v.","communicate, communicates, communicated, communicated, communicating","communicator (n.), communicating (n.), communication (n.), communicative (adj.), communicatory (adj.)","transmit information","It is important to communicate clearly when you work in a team.","communicate back; communicate effectively; start communicate","B1"
"Concert","/ˈkɑnsɚt/","n.","concert, concerts","concertise (v.), concertize (v.)","a performance of music by players or singers not involving theatrical staging","We bought tickets to a concert by our favourite band.","taylor swift concert; loves concert; concert pianist","B1"
"Compete","/kəˈmpit/","v.","compete, competes, competed, competed, competing","competitor (n.), competition (n.), competitive (adj.), competitory (adj.)","compete for something; engage in a contest; measure oneself against others","If you have five ticketing platforms instead of one, they have to compete on the fees.","compete stores; compete visions; possibly compete","B1"
"Complain","/kəmˈpleɪn/","v.","complain, complains, complained, complained, complaining","complaint (n.), complainer (n.), complainant (n.)","express complaints, discontent, displeasure, or unhappiness","Several customers complained about the slow service at the restaurant.","stop complain; women complain; russians started complain","B1"
"Committee","/kəˈmɪti/","n.","committee, committees","commit (v.)","a special group delegated to consider some matter","Currently, the bill has moved out of the committee and still needs Senate and House approval to move forward.","financial services committee; church committee; committee that's named","B1"
"Confuse","/kənˈfjuz/","v.","confuse, confuses, confused, confused, confusing","confusion (n.)","mistake one thing for another","The new road signs confuse many drivers who visit the city.","easily confuse; confuse the two; confuse people","B1"
"Conclusion","/kənˈkluʒən/","n.","conclusion, conclusions","conclude (v.)","a position or opinion or judgment reached after consideration","After hours of talking, they finally reached a sensible conclusion.","natural conclusion; conclusion now; general conclusion","B1"
"Cotton","/ˈkɑtən/","n. [U]","no changes","cottony (adj.)","soft silky fibers from cotton plants in their raw state","This soft shirt is made from pure cotton and feels very comfortable.","farming cotton; thought if cotton; cotton gin","B1"
"Costly","/ˈkɑstli/","adj.","costly, costlier, costliest","cost (n.), costliness (n.)","entailing great loss or sacrifice","Fixing the old car turned out to be a very costly mistake.","often costly; costly process; quite costly","B1"
"Confirm","/kəˈnfɝm/","v.","confirm, confirms, confirmed, confirmed, confirming","confirmation (n.), confirmative (adj.), confirmatory (adj.)","establish or strengthen as with new evidence or facts","Then, we compare the statistical analysis results with previous qualitative analysis results to confirm our findings.","confirm works; later confirm; findings confirm","B1"
"Continent","/ˈkɑntənənt/","n.","continent, continents","contain (v.), continence (n.), continency (n.), continental (adj.)","one of the large landmasses of the earth","Africa is a huge continent with many different countries and cultures.","european continent; continent except australia; seventh continent","B1"
"Cooker","/ˈkʊkɚ/","n.","cooker, cookers","cook (v.)","a utensil for cooking","She put the rice and water into the cooker and turned it on.","greatest cooker; cooker eggs; true cooker","B1"
"Cough","/ˈkɑf/","n.","cough, coughs","coughing (n.)","a sudden noisy expulsion of air from the lungs that clears the air passages; a common symptom of upper respiratory infection or bronchitis or pneumonia or tuberculosis","She had a bad cough and stayed in bed for the whole day.","whooping cough; bad cough; cough over","B1"
"Considerable","/kəˈnsɪdɚəbəl/","adj.","considerable, more considerable, most considerable","None","large or relatively large in number or amount or extent or degree","Our research highlights the considerable impact of social media on financial markets, particularly in shaping shareholders' perception of ESG reputation.","considerable amount; considerable impact; considerable potential","B1"
