"word","ipa","pos","inflections","derivatives","definition","example","collocations","context_type"
"Discipline","/ˈdɪsəplən/","n.","discipline, disciplines","disciplinary (adj.)","a branch of knowledge","I provide a brief overview of research on design cognition in other disciplines, and discuss opportunities for VIS to build an analogous research program.","discipline involved; every discipline; weird discipline","B2"
"Dispute","/dɪsˈpjut/","n.","dispute, disputes","disputable (adj.)","a disagreement or argument about something important","For all their differences, the gulf between Moldova and Transnistria was still relatively small compared to nearly every other post-Soviet dispute.","legal dispute; trade dispute; processing dispute","B2"
"Disorder","/dɪˈsɔɹdɚ/","n.","disorder, disorders","None","a physical condition in which there is a disturbance of normal functioning","And I feel I have a bit of a social interaction disorder for those first few minutes.","mood disorder; cognitive disorder; autoimmune disorder","B2"
"Distinguished","/dɪˈstɪŋɡwɪʃt/","adj.","distinguished, more distinguished, most distinguished","None","(used of persons) standing above others in character or attainment or reputation","I call now on the distinguished Secretary of State of the United States of America.","distinguished players; distinguished secretary; distinguished engineer","B2"
"Distribution","/ˌdɪstɹəˈbjuʃən/","n.","distribution, distributions","distribute (v.)","(statistics) an arrangement of values of a variable showing their observed or theoretical frequency of occurrence","This is running on a small virtual private server with the Ubuntu Linux distribution in the cloud.","power distribution; spatial distribution; inverse chi-square distribution","B2"
"District","/ˈdɪstɹɪkt/","n.","district, districts","None","a region marked off for administrative or other purposes","You've had school districts that have had to come up with plans for when ICE comes to their door.","castro district; entertainment district; district banks participate","B2"
"Distinct","/dɪˈstɪŋkt/","adj.","distinct, more distinct, most distinct","distinctly (adv.), distinction (n.)","(often followed by `from') not alike; different in nature or quality","Human cognitive behavior arises from the interaction of specialized brain networks dedicated to distinct functions, such as language, logic, and social reasoning.","really distinct; distinct look distinct; distinct areas","B2"
"Disturb","/dɪˈstɝb/","v.","disturb, disturbs, disturbed, disturbed, disturbing","disturbance (n.)","move deeply","And humans also play a role in disturbing their natural ecosystems.","disturb steady borders; disturb again; super disturb","B2"
"Distribute","/dɪsˈtɹɪbjut/","v.","distribute, distributes, distributed, distributed, distributing","distributer (n.), distributor (n.), distribution (n.), distributive (adj.)","administer or bestow, as in small portions","And to that end, these clocks do fine distributing timing over the IP network using a protocol called PTP.","distribute supplies; distribute evenly; distribute the profits","B2"
"Distinguish","/dɪˈstɪŋɡwɪʃ/","v.","distinguish, distinguishes, distinguished, distinguished, distinguishing","distinction (n.)","mark as different","The integration of HaptiSense technology into robotic platforms allows surgeons to distinguish between healthy and cancerous tissues through high-fidelity tactile feedback.","distinguish features; results distinguish; distinguish himself","B2"
"Diversity","/dɪˈvɝsəti/","n.","diversity, diversities","diverse (adj.), diversify (v.)","noticeable heterogeneity","In the current contribution we explore a new design of radar based target recognition, where angular diversity is used in a cognitive manner to attain better performance.","geographic diversity; ideological diversity; diversity equity","B2"
"Divine","/dɪˈvaɪn/","adj.","divine, more divine, most divine","diviner (n.), divinity (n.), divination (n.), divinatory (adj.)","emanating from God","You're not You don't have the divine to rule and you play by the rules.","divine providence; divine resonance; divine well","B2"
"Divorce","/dɪˈvɔɹs/","n.","divorce, divorces","divorcee (n.), divorcement (n.)","the legal dissolution of a marriage","Divorce can be messy, but even more if you're wealthy.","net worth divorce; highest divorce; divorce cases","B2"
"Dodge","/ˈdɑdʒ/","v.","dodge, dodges, dodged, dodged, dodging","dodgy (adj.), dodger (n.), dodging (n.)","make a sudden movement in a new direction so as to avoid","Combat produces gigantic blasts of colorful VFX as enemies emit orbs for the players to dodge.","long dodge; dodge bullets; dodge falling down","B2"
"Diverse","/daɪˈvɝs/","adj.","diverse, more diverse, most diverse","diversity (n.), diverseness (n.)","many and different","The World Economic Forum warns that this fragmentation creates 'data silos' that severely hinder the scaling of AI, which requires vast, diverse, and cross-border datasets to remain effective.","generate diverse; diverse environments; diverse bodies","B2"
"Dominant","/ˈdɑmənənt/","adj.","dominant, more dominant, most dominant","dominate (v.), dominance (n.)","exercising influence or control","Linguistic hybridization is becoming the dominant mode of professional communication in virtual workspaces across the globe.","dominant drivers; dominant role; powerful dominant","B2"
"Draft","/ˈdɹæft/","n.","draft, drafts","drafty (adj.), draftee (n.), drafter (n.), drafting (n.)","a document ordering the payment of money; drawn by one person or bank on another","Now, whenever a message request comes in, I can forward that directly to our bot, which will analyze it, draft a response, run it through the Python script, and give us back the final voice memo.","draft form; accurate draft; generated draft","B2"
"Dread","/ˈdɹɛd/","v.","dread, dreads, dreaded, dreaded, dreading","None","be afraid or scared of; be frightened of","And now Mythos, without even being publicly available, has many feeling existential dread for the first time.","dread rock; dread internet; dread moving everything","B2"
"Drowsy","/ˈdɹaʊzi/","adj.","drowsy, drowsier, drowsiest","drowse (n.), drowsiness (n.)","half asleep","Wait, that's when I went when I had my surgery, they gave me drowsy meds and I think I was too anxious that I that did nothing to me.","drowsy meds; getting drowsy; drowsy sleeper rich","B2"
"Dusty","/ˈdʌsti/","adj.","dusty, dustier, dustiest","dust (n.), dustiness (n.)","covered with a layer of dust","Don't doives in a super dusty thing.","dusty american west; dusty streets; dusty thing","B2"
"Durable","/ˈdʊɹəbəl/","adj.","durable, more durable, most durable","durability (n.)","existing for a long time","These plates are sleek and durable with clean curved edges, there's no framing required.","durable mistrust; durable consensus against; durable truth","B2"
"Drill","/ˈdɹɪl/","n.","drill, drills","drilling (n.)","a tool with a sharp point and cutting edges for making holes in hard materials (usually rotating rapidly or by repeated blows)","Beijing has no trouble denouncing Maduro’s capture days after conducting its own military drills against Taiwan.","power drill; footwork drill; drill dozens","B2"
"Dominate","/ˈdɑməˌneɪt/","v.","dominate, dominates, dominated, dominated, dominating","dominant (adj.), dominion (n.), dominance (n.), domination (n.)","be larger in number, quantity, power, status or importance","Generally, optimization models are useful for farmers to find no dominated solutions, but it remains difficult if the farmers have to agree on one solution.","dominate over; country dominate; region dominate","B2"
"Dye","/ˈdaɪ/","v.","dye, dyes, dyed, dyed, dyeing","dyer (n.), dyeing (n.)","color with dye","But then the amount of food dye that's in the human food is a tiny fraction of that.","soul becomes dye; never dye; dye either","B2"
"Drift","/ˈdɹɪft/","v.","drift, drifts, drifted, drifted, drifting","drifter (n.), driftage (n.), drifting (n.)","be in motion due to some air or water current","Within this framework, I show how belief distortion, motivational drift, counterfactual evaluation, and the limits of mutual understanding arise from purely algebraic constraints.","drift rate; random drift; drift going","B2"
"Dynasty","/ˈdaɪnəsti/","n.","dynasty, dynasties","dynastic (adj.)","a sequence of powerful leaders in the same family","I knew a lot about Trump dynasty growing up.","zhou dynasty; jin dynasty; yuan dynasty","B2"
"Earphone","/ˈɪˌɹfoʊn/","n.","earphone, earphones","None","electro-acoustic transducer for converting electric signals into sounds; it is held over or inserted into the ear","Turn Bluetooth off your phone if you aren’t using it Bluetooth is a helpful technology that allows you to connect devices over short distances, such as using wireless earphones with your phone.","versus wearing earphone; earphone award calling; audiobook an earphone","B2"
"Earnest","/ˈɝnɪst/","adj.","earnest, more earnest, most earnest","earnestness (n.)","characterized by a firm and humorless belief in the validity of your opinions","Please know that I am earnest in my efforts to tell this story with clarity and with accuracy.","earnest prayers; earnest attention; earnest disposition","B2"
"Economical","/ˌɛkəˈnɑmɪkəl/","adj.","economical, more economical, most economical","economy (n.)","using the minimum of time or resources necessary for effectiveness","Building the same plant over and over again is the key to making nuclear incredibly economical, incredibly boring and incredibly financeable.","economical approach towards; economical growth; economical ocean-going ships","B2"
"Dynamic","/daɪˈnæmɪk/","adj.","dynamic, more dynamic, most dynamic","dynamics (n.)","characterized by action or forcefulness or force of personality","New dynamic spectrum LEDs responding in real-time to plant physiological feedback have demonstrated yield boosts of up to forty percent.","fully dynamic; small dynamic; dynamic allocation","B2"
"Economic","/ˌɛkəˈnɑmɪk/","adj.","economic, more economic, most economic","economy (n.)","of or relating to an economy, the system of production and management of material wealth","The World Economic Forum warns that this fragmentation creates 'data silos' that severely hinder the scaling of AI, which requires vast, diverse, and cross-border datasets to remain effective.","economic impact; economic downturn; economic policy","B2"
"Economics","/ˌɛkəˈnɑmɪks/","n. [U]","no changes","None","the branch of social science that deals with the production and distribution and consumption of goods and services and their management","Thus, the question whether accounting numbers through models based on mathematical economics truly affect business value has an answer: Maybe, yes.","austrian economics; behavioral economics; mainstream economics","B2"
"Elastic","/ɪˈlæstɪk/","adj.","elastic, more elastic, most elastic","elasticity (n.)","capable of resuming original shape after stretching or compression; springy","With that said, Oliver, what you were saying earlier, price points, they can be very elastic when it comes to Nintendo games.","elastic protective layer; elastic membrane; gum elastic","B2"
"Economy","/ɪˈkɑnəmi/","n.","economy, economies","economic (adj.), economist (n.), economize (v.), economical (adj.)","the system of production and distribution and consumption","Moreover, contributes with learning processes and heuristics fit to the task including economy of cognition and memory to cope with the environment.","second largest economy; software economy; task including economy","B2"
"Elementary","/ˌɛləˈmɛntɹi/","adj.","elementary, more elementary, most elementary","element (n.)","easy and not involved or complicated","For me, it started when I was an elementary school student.","elementary example; elementary divide; sampling from elementary","B2"
"Electronics","/ɪˌlɛkˈtɹɑnɪks/","n. [U]","no changes","electronic (adj.)","the branch of physics that deals with the emission and effects of electrons and with the use of electronic devices","We also have a fresh round of our highly heatresistant silicone projects and soldering mats in multiple colors that are useful for any art project, but especially for soldering and electronics repair.","continental electronics; buys modern electronics; electronics market","B2"
"Elegant","/ˈɛləɡənt/","adj.","elegant, more elegant, most elegant","elegance (n.)","refined and tasteful in appearance or behavior or style","I didn't put up with that I stood up."" No, I want you to say, ""I was really elegant.","elegant interface; elegant relatively simple; elegant solutions","B2"
"Economist","/ɪˈkɑnəmɪst/","n.","economist, economists","economy (n.)","an expert in the science of economics","Mainstream economists agree, though for different reasons.","mathematical economist; austrian economist; economist agree though","B2"
"Efficiency","/ɪˈfɪʃənsi/","n. [U]","no changes","efficient (adj.)","the ratio of the output to the input of any system","Simulation results verify the efficiency of the proposed algorithms and reveal the impacts of CSI uncertainties on ST's minimum transmit power and feasibility rate of the optimization problems.","citing efficiency; efficiency rather; efficiency itself","B2"
"Embassy","/ˈɛmbəsi/","n.","embassy, embassies","None","a diplomatic building where ambassadors live or work","These culinary outposts — shining beacons of American decadence, multiculturalism, and abundance — are as effective an ambassador as any of its embassies, movies, or pop songs.","american embassy; embassy attack omar; africa embassy","B2"
"Eliminate","/ɪˈlɪməˌneɪt/","v.","eliminate, eliminates, eliminated, eliminated, eliminating","eliminator (n.), elimination (n.)","terminate, end, or take out","Projecting the states directly onto a robot's operating environment has the advantages of being direct, accurate, and more salient, eliminating mental inference about the robot's intention.","successfully eliminate; eliminate distractions; eliminate fears","B2"
"Enclose","/ɪnˈkloʊz/","v.","enclose, encloses, enclosed, enclosed, enclosing","enclosing (n.), enclosure (n.)","enclose or enfold completely with or as if with a covering","Front matter is a section at the very beginning of this file that is a key value pair block enclosed by the triple dash delimiter.","enclose spaces; enclose their ghetto; pair block enclose","B2"
"Elsewhere","/ˈɛlˌswɛɹ/","adv.","no changes","None","in or to another place","It's a comparison that I can't get elsewhere.","happened elsewhere; whatever happens elsewhere; companies moved elsewhere","B2"
"Endanger","/ɛˈndeɪndʒɚ/","v.","endanger, endangers, endangered, endangered, endangering","None","pose a threat to; present a danger to","It might not be a small D democratic regime, but it might be one that the US and its partners can work with, one that is certainly not endangering the US and its allies.","endanger languages; directly endanger; endanger national security","B2"
"Embarrass","/ɪˈmbɛɹəs/","v.","embarrass, embarrasses, embarrassed, embarrassed, embarrassing","embarrassment (n.)","cause to be embarrassed; cause to feel self-conscious","And that's mainly what we study in psychological science is that, oh, I'm feeling angry or ashamed or embarrassed or love or compassion.","felt embarrass; embarrass amount; embarrass moment","B2"
"Emphasis","/ˈɛmfəsəs/","n.","emphasis, emphases","emphatic (adj.), emphasize (v.)","special importance or significance","The main emphasis will be then on two paradigmal neural network architectures showing continuously ongoing transient-state dynamics: saddle point networks and networks of attractor relics.","too much emphasis; main emphasis; certain emphasis","B2"
"Empire","/ˈɛmpaɪɚ/","n.","empire, empires","None","the domain ruled by an emperor or empress; the region over which imperial dominion is exercised","Your writing and podcasts take us from the Vikings to the Normans to Crusades, to the collapse of the East Roman Empire, also known as the Byzantine Empire.","british empire; empire out; empire here","B2"
"Endure","/ɛnˈdjʊɹ/","v.","endure, endures, endured, endured, enduring","endurance (n.)","put up with something or somebody unpleasant","The citizens of Barbados would really have no choice but to endure this hardship.","ever endure; endure conflict; endure insights","B2"
"Encounter","/ɪˈnkaʊntɚ/","v.","encounter, encounters, encountered, encountered, encountering","None","come together","The game can be pretty tough before the second boss encounter, but it seems to ease up in the immediate aftermath if you do avail yourself of these protections.","regularly encounter; encounter challenges; land they've encounter","B2"
"Emerge","/ɪˈmɝdʒ/","v.","emerge, emerges, emerged, emerged, emerging","emergence (n.), emergent (adj.)","come out into view, as from concealment","The emerging global order is defined by transactional realism, where international law is increasingly superseded by regional spheres of influence.","emerge world power; time emerge; interesting rumor emerge","B2"
"Enlarge","/ɛˈnlɑɹdʒ/","v.","enlarge, enlarges, enlarged, enlarged, enlarging","enlarger (n.), enlargement (n.)","make larger","Israel now controls important pieces of land that enlarge their Jewish country.","enlarge normandy until; enlarge their jewish; land that enlarge","B2"
"Equality","/ɪˈkwɑləti/","n. [U]","no changes","equal (adj.)","the quality of being the same in quantity or measure or value or status","Turns out that there's this equality to all the neurom modulators.","equality part; set equality; equality regardless","B2"
"Engineering","/ˈɛndʒəˈnɪɹɪŋ/","n. [U]","no changes","engineer (v.)","the practical application of science to commerce or industry","We'll get back to how this all comes together, but those drives are part of this blue engineering section.","electrical engineering; social engineering; engineering problems","B2"
"Enthusiasm","/ɪˈnθuziˌæzəm/","n. [U]","no changes","enthusiastic (adj.)","a feeling of excitement","I find that investors are typically excited about firms that end up exceeding expectations, yet their enthusiasm results in lower announcement returns.","enthusiasm results; yet their enthusiasm; enthusiasm around","B2"
"Enforce","/ɛˈnfɔɹs/","v.","enforce, enforces, enforced, enforced, enforcing","enforcer (n.), enforcement (n.)","ensure observance of laws and rules","And where labor laws do exist, they’re rarely enforced.","enforce its debt; enforce policies across; enforce laws","B2"
"Entertain","/ˌɛntɚˈteɪn/","v.","entertain, entertains, entertained, entertained, entertaining","entertainer (n.), entertainment (n.)","provide entertainment for","And of course that makes for much less entertaining shows.","entertain ourselves; entertain themselves; iran he's entertain","B2"
"Enormous","/ɪˈnɔɹməs/","adj.","enormous, more enormous, most enormous","enormity (n.), enormousness (n.)","extraordinarily large in size or extent or amount or power or degree","It's not an enormous release, but it's a significant increase.","enormous amounts; enormous respect; enormous power","B2"
"Ensure","/ɛˈnʃʊɹ/","v.","ensure, ensures, ensured, ensured, ensuring","None","make certain of","New builds often feature central forest courtyards designed to ensure eighty percent of floor plates receive natural sunlight.","ensure security; ensure sufficient optimization; ensure eighty percent","B2"
"Era","/ˈɛɹə/","n.","era, eras","None","a period marked by distinctive character or reckoned from a fixed point or event","Global value chains have entered an era of 'structural volatility,' where disruption is no longer a cyclical shock but a permanent feature of the landscape.","certain era; golden era; early era","B2"
"Ethnic","/ˈɛθnɪk/","adj.","ethnic, more ethnic, most ethnic","ethnicity (n.)","denoting or deriving from or distinctive of the ways of living built up by a group of people","Logically, this didn’t make a ton of sense — ethnic Moldovans were a minority in their titular republic from day one.","ethnic cleansing; minority ethnic; sense ethnic","B2"
"Equip","/ɪˈkwɪp/","v.","equip, equips, equipped, equipped, equipping","equipage (n.), equipment (n.), equipping (n.)","provide with (something) usually for a specific purpose","We describe a chemical robotic assistant equipped with a curiosity algorithm that can efficiently explore the state a complex chemical system can exhibit.","businesses aren't equip; equip practitioners; equip robots","B2"
"Essential","/ɪˈsɛnʃəl/","adj.","essential, more essential, most essential","essence (n.), essentiality (n.), essentialness (n.)","absolutely necessary; vitally necessary","Relocation algorithms are now being used to identify service deserts to prevent spatial segregation for essential workers in urban zones.","essential part; absolutely essential; essential oils","B2"
"Eventual","/əˈvɛntʃuəl/","adj.","eventual, more eventual, most eventual","None","expected to follow in the indefinite future from causes already operating","As the post-trial and remedies process plays out, headlines could pressure the stock, creating attractive entry points, especially if the eventual penalties are lighter than expected.","eventual goal; eventual resolution; eventual release","B2"
"Estimate","/ˈɛstəmət/","v.","estimate, estimates, estimated, estimated, estimating","estimator (n.), estimation (n.)","judge tentatively or form an estimate of (quantities or time)","The CDC estimates that more than one in three American adults has pre-diabetes and that many of these people don't know they are living with pre-diabetes.","estimate both; precisely estimate; cdc estimate","B2"
"Establish","/ɪˈstæblɪʃ/","v.","establish, establishes, established, established, establishing","establishment (n.)","set up or found","Kurt Lewin, inspired by theoretical physics, tried to establish topological and vector psychology analyzing patterns of interaction between the individual and her/his environment.","establish yourself; server establish; establish based","B2"
"Evaluation","/ɪˌvæljuˈeɪʃən/","n.","evaluation, evaluations","evaluate (v.)","act of ascertaining or fixing the value or worth of","Despite its simplicity, the evaluation metrics show outstanding results, making it a valuable privacy-focused and cost-effective approach.","empirical evaluation; experimental evaluation; quantitative evaluation","B2"
"Evaluate","/ɪˈvæljuˌeɪt/","v.","evaluate, evaluates, evaluated, evaluated, evaluating","evaluator (n.), evaluation (n.), evaluative (adj.)","evaluate or estimate the nature, quality, ability, extent, or significance of","For each of these challenges, we specify the exact meaning of the challenge, present some approaches from the literature, and specify some metrics for evaluating that challenge.","often evaluate; evaluate existing frameworks; evaluate meaning","B2"
"Evident","/ˈɛvədənt/","adj.","evident, more evident, most evident","evidently (adv.), evidence (n.)","easy to see or understand; clear and obvious","Her happiness was evident from the big smile on her face.","clearly evident; becomes evident; evident from","B2"
"Evidence","/ˈɛvədəns/","n. [U]","no changes","evident (adj.), evidential (adj.), evidentiary (adj.)","your basis for belief or disbelief; knowledge on which to base belief","This critical period is designed to facilitate the collection of real-world operational data and empirical evidence from autonomous vessel trials conducted across various jurisdictions.","evidence into; video evidence; first evidence","B2"
"Exaggerate","/ɪˈɡzædʒɚˌeɪt/","v.","exaggerate, exaggerates, exaggerated, exaggerated, exaggerating","exaggeration (n.)","to enlarge beyond bounds or the truth","And what happens eventually these nerve fibers start shooting and our central nervous system starts going in overdrive and exaggerating those pains.","exaggerate effects; exaggerate differences; video chris exaggerate","B2"
"Exception","/ɪˈksɛpʃən/","n.","exception, exceptions","except (v.), exceptional (adj.)","a deliberate act of omission","And the last thing you'll need to do is make sure you add an exception in the recorder to not fill up your Home Assistant database with tons of unnecessary data from all the different flights.","exception required; notable exception; exception specifically","B2"
"Exhaust","/ɪˈɡzɔst/","v.","exhaust, exhausts, exhausted, exhausted, exhausting","exhaustion (n.)","wear out completely","It's a long journey and it's really exhausting.","exhaust especially; emotionally exhaust; physically exhaust","B2"
"Expand","/ɪkˈspænd/","v.","expand, expands, expanded, expanded, expanding","expansion (n.), expansive (adj.), expandible (adj.), expansible (adj.)","extend in one or more directions","In our method, the agent first learns safety constraints by expanding the safe region, and then optimizes the cumulative reward in the certified safe region.","expand beyond; probably expand; expand ultimately expand","B2"
"Explanation","/ˌɛkspləˈneɪʃən/","n. [U]","no changes","explain (v.)","a statement that makes something comprehensible by describing the relevant structure or operation or circumstances etc.","The accomplished solution includes a highly performant prediction ability, an efficient energy use, and feature importance explanation for predicted probabilities.","simple explanation; fourth explanation; feature importance explanation","B2"
