"word","ipa","pos","inflections","derivatives","definition","example","collocations","context_type"
"Accidental","/ˌæksəˈdɛntəl/","adj.","accidental, more accidental, most accidental","accident (n.)","happening by chance or unexpectedly or unintentionally","And whatever value that has is offset by the risk of an accidental launch.","accidental mutation; avoid accidental; accidental launch","B2"
"Acceptance","/æˈksɛptəns/","n. [U]","no changes","accept (v.), acceptant (adj.)","the mental attitude that something is believable and should be accepted as true","And you and then that helps them because you are radiating that acceptance that they need to come to, which is hard.","consumer acceptance; acceptance condition; acceptance itself","B2"
"Abstract","/æbsˈtɹækt/","adj.","abstract, more abstract, most abstract","abstraction (n.), abstractly (adv.)","existing only in the mind; separated from embodiment","Making sense of the world and acting in it relies on building simplified mental representations that abstract away aspects of reality.","quite abstract; abstract beings; purely abstract","B2"
"Absolute","/ˈæbsəˌlut/","adj.","no changes","absoluteness (n.)","perfect or complete or pure","The MVPF gives policymakers important information about the equity-efficiency trade-off that is not necessarily conveyed by absolute welfare measures.","absolute terms; absolute certainty; absolute cinema","B2"
"Accent","/əˈksɛnt/","n.","accent, accents","accentual (adj.), accentuate (v.)","distinctive manner of oral expression","They give you also a theme manager to slightly modify it if you want to swap out the background image and change the accent color.","chinese accent; icelandic accent; goofy accent","B2"
"Access","/ˈæˌksɛs/","n. [U]","no changes","accession (n.), accessible (adj.)","the right to enter","You access your Hostinger's control panel, select the Docker manager, and quickly see everything that's running.","lose access; got access; private internet access","B2"
"Accountant","/əˈkaʊntənt/","n.","accountant, accountants","account (v.), accountancy (n.), accountantship (n.)","someone who maintains and audits business accounts","When we want to be our own accountant and try to determine, how are we doing.","accountant time; accountant probably needs; every accountant","B2"
"Acquaintance","/əˈkweɪntəns/","n.","acquaintance, acquaintances","acquaint (v.), acquaintanceship (n.)","personal knowledge or information about someone or something","And this was an acquaintance of both of ours.","brief acquaintance; enigmatic acquaintance; case acquaintance","B2"
"Academic","/ˌækəˈdɛmɪk/","adj.","academic, more academic, most academic","academia (n.), academically (adv.)","associated with academia or an academy","In addition, the paper provides a survey-based implementation guide for benchmarking current climate-risk practices and data needs across industry and academic stakeholders.","academic literature; average academic; academic study","B2"
"Addict","/əˈdɪkt/","n.","addict, addicts","addiction (n.), addictive (adj.)","someone who is so ardently devoted to something that it resembles an addiction","We had a guest on this podcast who's a self-admitted gambling addict.","addict too; morphine addict; real addict","B2"
"Accuracy","/ˈækjɚəsi/","n. [U]","no changes","None","the quality of being near to the true value","Recent breakthroughs in magneto-surgical microrobots enable precise three-dimensional navigation through complex arterial networks to deliver localized drug treatments with unprecedented accuracy.","reasonable accuracy; accuracy demonstrating; improves predictive accuracy","B2"
"Adequate","/ˈædəkwət/","adj.","adequate, more adequate, most adequate","adequacy (n.), adequately (adv.)","having the requisite qualities or resources to meet a task","We find that popular keyword-based models are not adequate for such a complex and evolving task.","perfectly adequate; adequate academic; powers adequate","B2"
"Admirable","/ˈædmɚəbəl/","adj.","admirable, more admirable, most admirable","admirability (n.), admirableness (n.)","deserving of the highest esteem or admiration","The legacy of World War II and the Japanese people’s admirable commitment to peace created a taboo against anything resembling war — one that still lingers today.","admirable quality; think it's admirable; deeply admirable","B2"
"Admiration","/ˌædmɚˈeɪʃən/","n. [U]","no changes","admire (v.)","a feeling of delighted approval and liking","And going all the way to Constantinople, and having a deep admiration for Constantinople, enough to then begin to dream of sacking Constantinople.","deep admiration; romantic admiration; shared admiration","B2"
"Admission","/æˈdmɪʃən/","n. [U]","no changes","admit (v.)","the act of admitting someone to enter","You should apply for early admissions this year."" Early admission.","own admission; admission exclusion; arrival admission","B2"
"Access","/ˈæˌksɛs/","v.","access, accesses, accessed, accessed, accessing","accession (n.), accessible (adj.)","obtain or retrieve from a storage device; as of information on a computer","You access your Hostinger's control panel, select the Docker manager, and quickly see everything that's running.","lose access; got access; private internet access","B2"
"Addict","/əˈdɪkt/","v.","addict, addicts, addicted, addicted, addicting","addiction (n.), addictive (adj.)","to cause (someone or oneself) to become dependent (on something, especially a narcotic drug)","Number one, the world had become addicted to fossil fuels, oil and gas, which was the lifeblood of their economies.","addict parent; word addict; born addict","B2"
"Accompany","/əˈkʌmpəni/","v.","accompany, accompanies, accompanied, accompanied, accompanying","accompaniment (n.)","be present or associated with an event or entity","The examples are accompanied by detailed tutorials and code samples that allow readers to apply the methods described in this review to their own data.","often accompany; components accompany; breathing everything accompany","B2"
"Accomplish","/əˈkɑmplɪʃ/","v.","accomplish, accomplishes, accomplished, accomplished, accomplishing","accomplishable (adj.), accomplishment (n.)","put in effect","The accomplished solution includes a highly performant prediction ability, an efficient energy use, and feature importance explanation for predicted probabilities.","accomplish a goal; accomplish a task; accomplish the mission","B2"
"Accuse","/əˈkjuz/","v.","accuse, accuses, accused, accused, accusing","accusation (n.), accusatory (adj.)","bring an accusation against; level a charge against","There's been no shenanigans other than both sides accusing each other of spying on each other constantly.","both sides accuse; accuse itself; accuse carter","B2"
"Adapt","/əˈdæpt/","v.","adapt, adapts, adapted, adapted, adapting","adaptation (n.), adaptable (adj.)","make fit for, or change to suit a new purpose","He spent much time on this box, it's adapted to him.","problem by adapt; adapt by michael; adapt instead","B2"
"Adjust","/əˈdʒʌst/","v.","adjust, adjusts, adjusted, adjusted, adjusting","adjuster (n.), adjustor (n.), adjustive (adj.), adjustable (adj.), adjustment (n.)","alter or regulate so as to achieve accuracy or conform to a standard","And there's a couple guys who are adjusting color, aperture, and all that stuff.","adjust instead; adjust based; slowly adjust","B2"
"Absorb","/əˈbzɔɹb/","v.","absorb, absorbs, absorbed, absorbed, absorbing","absorber (n.), absorbate (n.), absorbent (adj.), absorbable (adj.), absorption (n.), absorptive (adj.)","become imbued","Look at a page and somehow absorb all that information and commit it to memory.","absorb everything; completely absorb; absorb cost","B2"
"Acquire","/əˈkwaɪɚ/","v.","acquire, acquires, acquired, acquired, acquiring","acquisition (n.), acquisitive (adj.)","come into the possession of something concrete or abstract","This process maps the independent components of the sensory input onto the attractor relics, which acquire in this way a semantic meaning.","acquire language capabilities; grounding problem acquire; acquire circuits","B2"
"Adopt","/əˈdɑpt/","v.","adopt, adopts, adopted, adopted, adopting","adoptee (n.), adopter (n.), adoption (n.), adoptive (adj.), adoptable (adj.)","choose and follow; as of theories, ideas, policies, strategies or plans","Teams adopting async-first workflows report significantly higher productivity than those relying on synchronous real-time meetings for coordination.","mine adopt; recently adopt; adopt chinese","B2"
"Agreeable","/əˈɡɹiəbəl/","adj.","agreeable, more agreeable, most agreeable","agreeably (adv.), agree (v.)","conforming to your own liking or feelings or nature; - Disraeli","There's no guarantee under the First Amendment that you that everyone that speaks will say things that you find pleasing and agreeable.","particularly agreeable; agreeable guy; pretty agreeable","B2"
"Allowance","/əˈlaʊəns/","n.","allowance, allowances","allow (v.)","an amount allowed or granted (as during a given period)","A large number of parents , the future of what we see happening on Roblox when I was younger, I got an allowance to go buy comic books at the local drugstore.","finite allowance; make allowance; got an allowance","B2"
"Agency","/ˈeɪdʒənsi/","n.","agency, agencies","agent (n.), agential (adj.)","an administrative unit of government","Designers are embracing imperfection and glitch effects as a form of visual protest to signal human agency and digital soul.","high agency; atomic energy agency; agency over","B2"
"Ambiguous","/æˈmbɪɡjuəs/","adj.","ambiguous, more ambiguous, most ambiguous","ambiguity (n.), ambiguously (adv.)","open to two or more interpretations; or of uncertain nature or significance; or (often) intended to mislead","However, automating this process is a challenge, as climate change is a complex, fast-moving, and often ambiguous topic with scarce resources for popular text-based AI tasks.","highly ambiguous; an ambiguous statement; morally ambiguous","B2"
"Alcohol","/ˈælkəˌhɑl/","n. [U]","no changes","alcoholic (adj.), alcoholize (v.)","a liquor or brew containing alcohol as the active agent","I don't want to hear that alcohol is bad for me.","alcohol because; alcohol problem; often because alcohol","B2"
"Alert","/əˈlɝt/","v.","alert, alerts, alerted, alerted, alerting","alertness (n.)","warn or arouse to a sense of danger or call to a state of preparedness","The Methane Alert and Response System uses thirty-five satellite instruments to detect massive human-caused methane sources and provide actionable data to governments and industry leaders.","create alert; stay alert; alert later","B2"
"Alert","/əˈlɝt/","adj.","alert, more alert, most alert","alertness (n.)","engaged in or accustomed to close observation","The Methane Alert and Response System uses thirty-five satellite instruments to detect massive human-caused methane sources and provide actionable data to governments and industry leaders.","email alert; critical alert; stay alert","B2"
"Agent","/ˈeɪdʒənt/","n.","agent, agents","agency (n.), agential (adj.)","an active and efficient cause; capable of producing a certain effect","The rise of 'Meta-Cognitive Controllers' allows AI agents to decide when to use fast intuition versus slow, deliberate logic, enabling systems to recognize their own limitations.","made agent; agent ourselves; white agent","B2"
"Amateur","/ˈæməˌtɝ/","adj.","amateur, more amateur, most amateur","None","engaged in as a pastime","I went from a novice two weeks later to compete in the World Games against Buried Demay, who became a top Olympian, Matt Mendesol, who was the best amateur in USA at the time.","an amateur photographer; an amateur athlete; amateur theatre","B2"
"Amateur","/ˈæməˌtɝ/","n.","amateur, amateurs","None","someone who pursues a study or sport as a pastime","I went from a novice two weeks later to compete in the World Games against Buried Demay, who became a top Olympian, Matt Mendesol, who was the best amateur in USA at the time.","a talented amateur; a complete amateur; a keen amateur","B2"
"Aggressive","/əˈɡɹɛsɪv/","adj.","aggressive, more aggressive, most aggressive","aggression (n.), aggressively (adv.)","having or showing determination and energetic pursuit of your ends","Our major finding is that provided its policy is not too aggressive the Central Bank is successful in achieving its goals.","aggressive version; aggressive algorithm; got aggressive","B2"
"Alternative","/ɔˈltɝnətɪv/","n.","alternative, alternatives","None","one of a number of things from which only one can be chosen","But I think what I will do in the future is I will think more about alternatives to reverse proxies and web servers.","promising alternative; alternative approach; alternative sources","B2"
"Alternative","/ɔˈltɝnətɪv/","adj.","alternative, more alternative, most alternative","None","serving or used in place of another","Then it describes several alternative mathematical methods for mapping fundamental quantum concepts to fundamental psychological concepts.","promising alternative; alternative hypotheses; alternative sources","B2"
"Anniversary","/ˌænəˈvɝsɚi/","n.","anniversary, anniversaries","None","the date on which an event occurred in some previous year (or the celebration of it)","And although I had anniversary plans, I imagine this is how John Muir felt when he said, ""The comments are calling and I must go."" The idea for Atlas is pretty simple.","anniversary last week; year anniversary; anniversary plans","B2"
"Amuse","/əˈmjuz/","v.","amuse, amuses, amused, amused, amusing","amusive (adj.), amusement (n.)","occupy in an agreeable, entertaining or pleasant fashion","Now, to some, this is all an amusing — perhaps even endearing — feature of the Chinese landscape.","amuse anyone; amuse life lessons; found amuse","B2"
"Analyze","/ˈænəˌlaɪz/","v.","analyze, analyzes, analyzed, analyzed, analyzing","analyst (n.), analysis (n.), analyzer (n.)","consider in detail and subject to an analysis in order to discover essential features or meaning","New startups showcased systems that use EMG sensors and AI to analyze muscle activation and fatigue in real-time during live training.","analyze everything; execute commands analyze; start analyze","B2"
"Ambitious","/æˈmbɪʃəs/","adj.","ambitious, more ambitious, most ambitious","ambition (n.), ambitiousness (n.)","having a strong desire for success or achievement","The time is ripe to reformulate his ambitious goals, searching for ways to interpret objectively measured brain processes in terms of suitable psychological constructs.","ambitious about; ambitious vision; real ambitious","B2"
"Applicant","/ˈæplɪkənt/","n.","applicant, applicants","apply (v.)","a person who requests or seeks something such as assistance or employment or admission","Each year, medical schools collectively reject roughly as many applicants as they ultimately enroll.","among loan applicant; classify applicant; march applicant","B2"
"Analysis","/əˈnæləsəs/","n.","analysis, analyses","analyze (v.), analytic (adj.), analytical (adj.)","an investigation of the component parts of a whole and their relations in making up the whole","Microbiome-first strategies use RNA analysis and AI to deliver hyper-personalized supplement recommendations as the gut environment shifts over time.","comparative analysis; cognitive data analysis; deep political analysis","B2"
"Ancestor","/ˈæˌnsɛstɚ/","n.","ancestor, ancestors","ancestral (adj.), ancestry (n.)","someone from whom you are descended (but usually more remote than a grandparent)","This is where I imagine myself as a Viking and one of my ancestors perhaps.","founder ancestor; last common ancestor; recent common ancestor","B2"
"Anxiety","/æˈŋzaɪəti/","n. [U]","no changes","None","(psychiatry) a relatively permanent state of worry and nervousness occurring in a variety of mental disorders, usually accompanied by compulsive behavior or attacks of panic","I've had anxiety or live with it for a lot of my life, but sometimes I say hello to it.","feel anxiety; reducing anxiety; looming anxiety","B2"
"Apology","/əˈpɑlədʒi/","n.","apology, apologies","apologise (v.), apologist (n.), apologize (v.), apologetic (adj.)","an expression of regret at having caused trouble for someone","She offered a sincere apology for arriving late and disrupting the meeting.","apology tour coming; talk about apology; studied apology","B2"
"Approval","/əˈpɹuvəl/","n. [U]","no changes","approve (v.), approbate (v.)","the formal act of approving","New regulations in Turkey have digitalized the EIA process and introduced a direct EIA Positive status for streamlined approval pipelines.","seek approval; win approval; gain approval","B2"
"Apparent","/əˈpɛɹənt/","adj.","apparent, more apparent, most apparent","apparency (n.), apparentness (n.)","clearly revealed to the mind or the senses or judgment","When are people's life trajectories really starting to be apparent.","heir apparent; immediately apparent; boundary conditions apparent","B2"
"Annoy","/əˈnɔɪ/","v.","annoy, annoys, annoyed, annoyed, annoying","annoyer (n.), annoyance (n.)","cause annoyance in; disturb, especially by minor irritations","I agree that not everybody might need DNS challenges, but in my case, I'm often running services behind firewalls and I still want trusted TLS certificates to get rid of this annoying browser warning.","super annoy; slightly annoy; quite annoy","B2"
"Annual","/ˈænjuəl/","adj.","no changes","None","completing its life cycle within a year","This is published in annual review of psychology.","annual review template; annual tradition; annual comparisons","B2"
"Aquarium","/əˈkwɛɹiəm/","n.","aquarium, aquariums","None","a tank or pool or bowl filled with water for keeping live fish and underwater animals","Elodea is rather unextraordinary: a staple in home aquariums and middle school science classes.","launch project aquarium; aquarium shops; aquarium botanical gardens","B2"
"Appoint","/əˈpɔɪnt/","v.","appoint, appoints, appointed, appointed, appointing","appointee (n.), appointive (adj.)","create and charge with a task or function","It no longer had a king appointed by God.","newly appoint; appoint through; recently appoint","B2"
"Appreciation","/əˌpɹiʃiˈeɪʃən/","n. [U]","no changes","appreciate (v.), appreciative (adj.)","understanding of the nature or meaning or quality or magnitude of something","This makes me feel a deep appreciation for the internet and the algorithms that helped give me a career.","deep appreciation; appreciation affection love; typically appreciation","B2"
"Arch","/ˈɑɹtʃ/","n.","arch, arches","None","a curved shape in the vertical plane that spans an opening","Their arches, their writing systems, their agricultural practices, all very similar.","arch kim; use arch; robust arch","B2"
"Arch","/ˈɑɹtʃ/","v.","arch, arches, arched, arched, arching","None","form an arch or curve","It's been studied in the context of the -called lordosis response the receptivity or arching of the back of the female to receive intrammission and mating from the male.","arch kim; use arch; robust arch","B2"
"Ashamed","/əˈʃeɪmd/","adj.","ashamed, more ashamed, most ashamed","None","feeling shame or guilt or embarrassment or remorse","Why would it be that many boys feel they're going to be perceived as feminine if they say they're disappointed or sad or ashamed.","ashamed emotions; sad disappointment ashamed; often deeply ashamed","B2"
"Application","/ˌæpləˈkeɪʃən/","n.","application, applications","apply (v.)","the act of bringing something to bear; using it for a particular purpose","This is the official website where you can download the application or get a link to the documentation or the GitHub repository where you find the source code.","chat application; application possible; greatest application","B2"
"Aspirin","/ˈæspɹɪn/","n.","aspirin, aspirins","None","the acetylated derivative of salicylic acid; used as an analgesic anti-inflammatory drug (trade names Bayer, Empirin, and St. Joseph) usually taken in tablet form; used as an antipyretic; slows clotting of the blood by poisoning platelets","They send people looking for plants that then they can find isolates and everything from aspirin to umratom to anesthetics cocaine.","everything from aspirin; aspirin you'll feel; aspirin for instance","B2"
"Appropriate","/əˈpɹoʊpɹiət/","adj.","appropriate, more appropriate, most appropriate","appropriation (n.), appropriateness (n.)","suitable for a particular person or place or condition etc","Firstly, appropriate terms are introduced and used in explanations related to the framework and within the definition of a mechanism.","appropriate dose; appropriate amount; word appropriate","B2"
"Artistic","/ɑˈɹtɪstɪk/","adj.","artistic, more artistic, most artistic","art (n.), artist (n.)","relating to or characteristic of art or artists","And when people say your brain is your artistic brain and your left brain is your thinking brain, this is what they're referring to.","artistic vision; artistic integrity; artistic intent","B2"
"Acid","/ˈæsəd/","n.","acid, acids","acidify (v.), acidity (n.), acidulate (v.)","any of various water-soluble compounds having a sour taste and capable of turning litmus red and reacting with a base to form a salt","Peptides are derived from little pieces of amino acids which think of them as the Legos that make up the human body.","acid sequences; acid tail; usually acid","B2"
"Artificial","/ˌɑɹtəˈfɪʃəl/","adj.","artificial, more artificial, most artificial","artificiality (n.)","contrived by art rather than nature","Organizations BIMCO are embedding artificial intelligence into digital platforms to streamline the drafting of charterparties and identify potential legal inconsistencies.","artificial agents; artificial sources; artificial boom","B2"
"Arise","/ɚˈaɪz/","v.","arise, arises, arose, arisen, arising","None","come into existence; take on form or shape","A natural question arises as to whether quantum logical nondistributivity in human logic can be tested experimentally.","problem arise; ever arise; arise within","B2"
"Arms","/ˈɑɹmz/","n.","arms, armses","None","weapons considered collectively","The cavity mode, after getting split from beam splitter, interacts with two independent Bose-Einstein Condensates transversely trapped in the arms of the cavity along $x$-axis and $y$-axis.","ai arms; large arms; arms snap","B2"
"Aspect","/ˈæˌspɛkt/","n.","aspect, aspects","aspectual (adj.)","a distinct feature or element in a problem","I'll get back to that aspect later in the tape room.","beautiful aspect; murder mystery aspect; scaling aspect","B2"
"Assemble","/əˈsɛmbəl/","v.","assemble, assembles, assembled, assembled, assembling","assemblage (n.)","create by putting components or members together","We show the applicability of our approach in a real-world assembly domain, where a bi-manual Baxter robot collaborates with a human teammate to assemble furniture.","robots assemble; assemble 'em inside; assemble here","B2"
"Assistance","/əˈsɪstəns/","n. [U]","no changes","assist (v.)","the activity of contributing to the fulfillment of a need or furtherance of an effort or purpose","We revisit the task of visible compression of an ensemble of quantum states with entanglement assistance in the one-shot setting.","assistance available; analytical assistance; personalized assistance","B2"
"Assembly","/əˈsɛmbli/","n.","assembly, assemblies","None","a group of machine parts that fit together to form a self-contained unit","We show the applicability of our approach in a real-world assembly domain, where a bi-manual Baxter robot collaborates with a human teammate to assemble furniture.","assembly processes; assembly systems enhance; various assembly","B2"
"Assurance","/əˈʃʊɹəns/","n.","assurance, assurances","assure (v.)","freedom from doubt; belief in yourself and your abilities","AMD further said it quote expects to apply for licenses but there is no assurance that licenses will be granted.","age assurance; assurance department; qa quality assurance","B2"
"Assign","/əˈsaɪn/","v.","assign, assigns, assigned, assigned, assigning","assignee (n.), assignable (adj.), assignment (n.), assignation (n.)","give an assignment to (a person) to a post, or assign a task to (a person)","Global availability of information and self-modeling are now used to assign a consciousness probability score that dictates legal protections.","automatically assign; auto assign; assign jointly","B2"
"Assure","/əˈʃʊɹ/","v.","assure, assures, assured, assured, assuring","assurance (n.)","make certain of","And they assure me, oh, the campus cops, they'll look the other way.","mutual assure; assure your listeners; assure me oh","B2"
"Athletic","/æˈθlɛtɪk/","adj.","athletic, more athletic, most athletic","athlete (n.), athletics (n.)","relating to or befitting athletics or athletes","We'll talk a little bit about your life and maybe your athletic life a little bit later, but I want to talk about dopamine.","athletic outfit; athletic maybe; athletic accomplishments","B2"
"Associate","/əˈsoʊsiət/","v.","associate, associates, associated, associated, associating","associable (adj.), association (n.), associative (adj.), associatory (adj.)","make a logical or causal connection","And as a little Easter egg, my dad noticed the truck is made by Gerling and Associates, a familyrun company that we met at NEB last year.","often associate; typically associate; associate game designer","B2"
