"word","ipa","pos","inflections","derivatives","definition","example","collocations","context_type"
"Diaper","/ˈdaɪpɚ/","n.","diaper, diapers","None","garment consisting of a folded cloth drawn up between the legs and fastened at the waist; worn by infants to catch excrement","In comparison, emerging self-care assistive technologies include health and emotion monitoring, smart diapers, smart medication dispensing and management or feeding assistant robot.","changing diaper; wear diapers; change diapers","C1"
"Diameter","/daɪˈæmətɚ/","n.","diameter, diameters","diametral (adj.), diametric (adj.), diametrical (adj.)","the length of a straight line passing through the center of a circle and connecting two points on the circumference","It has a number of different diameter holes has a number of different diameter holes and a film inside.","diameter rope; smaller diameter; outer diameter","C1"
"Dilemma","/dɪˈlɛmə/","n.","dilemma, dilemmas","None","state of uncertainty or perplexity especially as requiring a choice between equally unfavorable options","Ethical Dilemmas in the Atomic Age The goal of the Alsace mission was to stop the Nazi atomic bomb project, however they could.","interesting dilemma; moral dilemma; face dilemma","C1"
"Destructive","/dɪsˈtɹʌktɪv/","adj.","destructive, more destructive, most destructive","destroy (v.), destructiveness (n.)","causing destruction or much damage","It was among the most destructive storms to strike the state in its modern history.","destructive force; extremely destructive; destructive effects","C1"
"Destination","/ˌdɛstəˈneɪʃən/","n.","destination, destinations","destine (v.)","the place designated as the end (as of a race or journey)","Of the parks and natural destinations, Alabama's Gulf Coast topped the list with 6,700,000 visitors.","final destination; dream destination; popular tourist destination","C1"
"Dialect","/ˈdaɪəˌlɛkt/","n.","dialect, dialects","dialectal (adj.)","the usage or vocabulary that is characteristic of a specific group of people","Modern Standard Arabic coexists with a rich landscape of regional dialects that differ significantly in vocabulary, syntax, phonology, and cultural grounding.","local dialect; native dialect; regional dialects","C1"
"Digestion","/daɪˈdʒɛstʃən/","n. [U]","no changes","digest (v.)","the process of decomposing organic matter (as in sewage) by bacteria or by chemical action or heat","Bo's body isn't his own or digestion.","sugar improving digestion; improve digestion; with digestion","C1"
"Diagnosis","/ˌdaɪəˈɡnoʊsəs/","n.","diagnosis, diagnoses","diagnose (v.), diagnostic (adj.)","identifying the nature or cause of some phenomenon","An early diagnosis gave the patient a much better chance of a full recovery.","bad diagnosis; get diagnosis; cognitive diagnosis","C1"
"Disapprove","/ˌdɪsəˈpɹuv/","v.","disapprove, disapproves, disapproved, disapproved, disapproving","disapproval (n.)","consider bad or wrong","Her parents strongly disapprove of the long hours she spends playing video games.","disapprove atrocities; disapprove of trials; disapprove of songs","C1"
"Diagnose","/ˌdaɪəˈɡnoʊs/","v.","diagnose, diagnoses, diagnosed, diagnosed, diagnosing","diagnosis (n.), diagnosing (n.)","determine or distinguish the nature of a problem or an illness through a diagnostic analysis","Doctors diagnosed a bony growth between his fifth and sixth vertebrae, requiring surgery.","diagnose yourself; diagnose patients; diagnose disease","C1"
"Discriminate","/dɪsˈkɹɪməˌneɪt/","v.","discriminate, discriminates, discriminated, discriminated, discriminating","discriminator (n.), discrimination (n.), discriminative (adj.), discriminatory (adj.)","recognize or perceive the difference","Our method generates candidate symmetries and trains a recurrent neural network to discriminate between the original trajectories and the transformed trajectories for each candidate symmetry.","discriminate based; discriminate on grounds; discriminate between models","C1"
"Disconnect","/dɪskəˈnɛkt/","v.","disconnect, disconnects, disconnected, disconnected, disconnecting","disconnection (n.)","pull the plug of (electrical appliances) and render inoperable","This has led, at times, to more specific criticisms that the Academy is disconnected from the audience, e.","disconnect from work; disconnect from society; disconnect family","C1"
"Directory","/dɚˈɛktɚi/","n.","directory, directories","None","an alphabetical list of names and addresses","ANSI also accredits standards developing organizations (SDOs) and provides a searchable directory of accredited standards developers (ASDs).","data directory; current directory; themes directory","C1"
"Diplomatic","/ˌdɪpləˈmætɪk/","adj.","diplomatic, more diplomatic, most diplomatic","diplomacy (n.)","relating to or characteristic of diplomacy","In terms of commercial contacts, diplomatic contacts, and on, they're more us than one might expect, walking around outside.","diplomatic ties; diplomatic relations; diplomatic efforts","C1"
"Discourse","/ˈdɪskɔɹs/","n.","discourse, discourses","None","extended verbal expression in speech or writing","The lecture sparked a lively discourse about the future of renewable energy.","scientific discourse; public discourse; political discourse","C1"
"Diminish","/dɪˈmɪnɪʃ/","v.","diminish, diminishes, diminished, diminished, diminishing","diminutive (n.)","decrease in size, extent, or range","Take for example, what happens if the level of water is diminishing.","significantly diminish; diminish returns; diminish quality","C1"
"Disclose","/dɪsˈkloʊz/","v.","disclose, discloses, disclosed, disclosed, disclosing","disclosure (n.)","make known to the public information that was previously known only to a few people or that was meant to be kept a secret","However, we disclose a nontrivial mutual-exclusion relationship between these critical representation properties through an exploratory demonstration on self-supervised learning.","disclose things; disclose information; disclose sources","C1"
"Discrimination","/dɪsˌkɹɪməˈneɪʃən/","n. [U]","no changes","discriminate (v.)","unfair treatment of a person or group on the basis of prejudice","This paper examines the impact of racial discrimination in hiring on employment, wages, and wealth disparities between black and white workers.","systemic discrimination; widespread discrimination; face discrimination","C1"
"Dimension","/dɪˈmɛnʃən/","n.","dimension, dimensions","None","the magnitude of something in a particular direction (especially length or width or height)","The first buildings were built narrowly in order to hold the roof, and when the dimensions changed some mathematical relations became necessary in order to keep the original forms.","fourth dimension; political dimension; multiple dimensions","C1"
"Distinctive","/dɪˈstɪŋktɪv/","adj.","distinctive, more distinctive, most distinctive","distinctiveness (n.)","of a feature that helps to distinguish a person or thing","In the movie “Contact,” the character that plays Jill Tarter eventually gets a message on the radio telescope that's a distinctive message from another intelligent civilization.","distinctive aspects; distinctive features; distinctive patterns","C1"
"Dissolve","/dɪˈzɑlv/","v.","dissolve, dissolves, dissolved, dissolved, dissolving","dissolver (n.), dissolvent (n.), dissolving (n.), dissolution (n.)","become weaker","After the death of its founder, William Frédéric Edwards, in 1842, it gradually declined in activity until it eventually dissolved in 1862.","dissolve in water; dissolve crystals; dissolve bonds","C1"
"Dock","/ˈdɑk/","n.","dock, docks","docker (n.), dockage (n.), docking (n.)","an enclosure in a court of law where the defendant sits during the trial","The population of Ketchikan, Alaska for example fluctuates dramatically on many days—up to four large cruise ships can dock there at the same time.","dock onto; in dock; on dock","C1"
"Disrupt","/dɪˈsɹʌpt/","v.","disrupt, disrupts, disrupted, disrupted, disrupting","disruption (n.), disruptive (adj.)","make a break in","The heavy snowfall threatened to disrupt travel across much of the region.","disrupt power delivery; disrupt sleep; disrupt flow","C1"
"Doctrine","/ˈdɑktɹən/","n.","doctrine, doctrines","doctrinal (adj.)","a belief (or system of beliefs) accepted as authoritative by some group or school","It cannot be reduced to socialism, and is best seen as a separate and distinctive doctrine.","military doctrine; religious doctrine; new doctrine","C1"
"Document","/ˈdɑkjəmɛnt/","v.","document, documents, documented, documented, documenting","documental (adj.), documentary (adj.), documentation (n.)","record in detail","This has been documented in many studies.","document evolution; document in book; document about war","C1"
"Document","/ˈdɑkjəmɛnt/","n.","document, documents","documental (adj.), documentary (adj.), documentation (n.)","writing that provides information (especially information of an official nature)","Its historical methods and materials go beyond the standard use of documents and manuscripts.","internal document; unusual document; public documents","C1"
"Distinction","/dɪˈstɪŋkʃən/","n.","distinction, distinctions","distinct (adj.), distinctive (adj.)","a discrimination between things as different and distinct","As of 2020, the production of the Academy Awards telecast held the distinction of winning one the highest number of Emmy Awards in history, with 54 wins and 280 nominations overall.","key distinction; sharp distinction; make distinction","C1"
"Distract","/dɪsˈtɹækt/","v.","distract, distracts, distracted, distracted, distracting","distraction (n.)","draw someone's attention away from something","Five minutes into the descent burn, and above the surface of the Moon, the Apollo Guidance Computer (LGC) distracted the crew with the first of several unexpected 1201 and 1202 program alarms.","distract investors; distract audience; distract from development","C1"
"Dough","/ˈdoʊ/","n. [U]","no changes","doughy (adj.)","a flour mixture stiff enough to knead or roll","Petulla, a traditional fried dough, is also a popular speciality, and is served with powdered sugar or feta cheese and different sorts of Fruit preservess.","dough rises; knead dough; ferment dough","C1"
"Dreadful","/ˈdɹɛdfəl/","adj.","dreadful, more dreadful, most dreadful","dreadfulness (n.)","causing fear or dread or terror","The weather was so dreadful that the outdoor concert had to be cancelled.","dreadful takeoff; dreadful hack; dreadful tempest","C1"
"Domain","/doʊˈmeɪn/","n.","domain, domains","None","a particular environment or walk of life","Questions of ethics fall outside the domain of pure scientific measurement.","domain expertise; auditory domain; domain specific languages","C1"
"Doorway","/ˈdɔˌɹweɪ/","n.","doorway, doorways","None","the entrance (the space in a wall) through which you enter or leave a room or building; the space that a door can close","There's a young teenage girl at Mycenae, for example, who tried to shelter in the doorway of her house.","doorway into participation; foundational doorway; doorway to connection","C1"
"Donate","/ˈdoʊˌneɪt/","v.","donate, donates, donated, donated, donating","donation (n.)","give to a charity or good cause","They often donated land and labor as well.","donate huge sums; donate embryos; donate money","C1"
"Donation","/doʊˈneɪʃən/","n.","donation, donations","donate (v.)","a voluntary gift (as of money or service or ideas) made to some worthwhile cause","For example, by making a donation to a highly making a donation to a highly cost-effective organization.","ad hoc donation; donation form; make donation","C1"
"Donor","/ˈdoʊnɚ/","n.","donor, donors","None","person who makes a gift of property","This has been used by charities that give small gifts to potential donors hoping to induce reciprocity.","donor program; donor eggs; donor embryos","C1"
"Documentary","/ˌdɑkjəˈmɛntɚi/","n.","documentary, documentaries","document (v.)","a film or TV program presenting the facts about a person or event","Since the 90th Academy Awards, presented in 2018, multi-part and limited series have been ineligible for the Best Documentary Feature award.","great documentary; watch documentary; make documentary","C1"
"Documentary","/ˌdɑkjəˈmɛntɚi/","adj.","no changes","document (v.)","relating to or consisting of or derived from documents","Since the 90th Academy Awards, presented in 2018, multi-part and limited series have been ineligible for the Best Documentary Feature award.","documentary screenings; documentary base; great documentary","C1"
"Driveway","/ˈdɹaɪˌvweɪ/","n.","driveway, driveways","None","a road leading up to a private house","On game days, many residents rent out their yards and driveways to people looking for parking spots.","driveway lights; in driveway; on driveway","C1"
"Drought","/ˈdɹaʊt/","n.","drought, droughts","None","a shortage of rainfall","And I think that makes a lot more sense than saying, oh, the sea peoples did it or oh, there was a drought.","severe drought; massive drought; mega drought","C1"
"Ecology","/ɪˈkɑlədʒi/","n. [U]","no changes","ecologic (adj.), ecologist (n.), ecological (adj.)","the environment as it relates to living organisms","The interaction between elephants and their environment has profound implications for both ecology and conservation strategies.","of ecology; in ecology; study ecology","C1"
"Eligible","/ˈɛlədʒəbəl/","adj.","eligible, more eligible, most eligible","eligibility (n.)","qualified for or allowed or worthy of being chosen","We then synthesised the ten eligible studies, conducting reciprocal translation and line-of-argument synthesis guided by eMERGe, informed by CASP quality appraisal.","eligible retail platform; eligible debt; eligible customers","C1"
"Eloquent","/ˈɛləkwənt/","adj.","eloquent, more eloquent, most eloquent","eloquence (n.)","expressing yourself readily, clearly, effectively","As eloquent as current language models feel, there's nobody home.","eloquent answers; become eloquent; eloquent writers","C1"
"Elaborate","/ɪˈlæbɹət/","adj.","elaborate, more elaborate, most elaborate","elaboration (n.), elaborative (adj.)","marked by complexity and richness of detail","That is elaborate kabuki that is masquerading as the real thing.","elaborate prompts; extremely elaborate; elaborate enemies","C1"
"Ecological","/ikəˈlɑdʒɪkəl/","adj.","no changes","ecology (n.)","characterized by the interdependence of living organisms in an environment","Our comprehensive approach enables us to predict the potential impact of these ecological determinants on elephant migration, a critical step in establishing informed conservation strategies.","ecological interactions; towards greater ecological; ecological collapse","C1"
"Elaborate","/ɪˈlæbɹət/","v.","elaborate, elaborates, elaborated, elaborated, elaborating","elaboration (n.), elaborative (adj.)","add details, as to an account or idea; clarify the meaning of and discourse in a learned way, usually in writing","That is elaborate kabuki that is masquerading as the real thing.","elaborate on concept; elaborate on application; elaborate response","C1"
"Ecosystem","/ˈikoʊˌsɪstəm/","n.","ecosystem, ecosystems","None","a system formed by the interaction of a community of organisms with their physical environment","Pollution can damage a delicate ecosystem far more quickly than people expect.","entire ecosystem; natural ecosystem; service ecosystem","C1"
"Ego","/ˈiɡoʊ/","n.","ego, egos","None","an inflated feeling of pride in your superiority to others","And mattering is a sense that we belong and that there is more to life than our own teeny little ego.","own ego; have ego; put ego","C1"
"Enthusiastic","/ɪˌnθuziˈæstɪk/","adj.","enthusiastic, more enthusiastic, most enthusiastic","enthusiasm (n.)","having or showing great excitement and interest","Focus on a (growing) niche The best ambassador for your library is not you, but an enthusiastic user.","enthusiastic proponent; enthusiastic users; enthusiastic response","C1"
"Embrace","/ɛmˈbɹeɪs/","n.","embrace, embraces","embracing (n.), embracement (n.)","the act of clasping another person in the arms (as in greeting or affection)","And I think that we should embrace more uncertainty.","warm embrace; in embrace; of embrace","C1"
"Entitle","/ɛˈntaɪtəl/","v.","entitle, entitles, entitled, entitled, entitling","entitlement (n.)","give the right to","A valid ticket will entitle you to free entry into all of the museum's galleries.","entitled to life; entitle to half; entitled to pleasure","C1"
"Enterprise","/ˈɛntɚˌpɹaɪz/","n.","enterprise, enterprises","enterpriser (n.)","a purposeful or industrious undertaking (especially one that requires effort or boldness)","Launching a new restaurant is a risky enterprise that demands careful planning.","large enterprise; enterprise cloud; free enterprise","C1"
"Envious","/ˈɛnviəs/","adj.","envious, more envious, most envious","enviousness (n.)","showing extreme cupidity; painfully desirous of another's advantages","Pearl encouraged the Clampetts to move to Beverly Hills and is envious of their wealth.","extremely envious; envious wife; envious dislike","C1"
"Embrace","/ɛmˈbɹeɪs/","v.","embrace, embraces, embraced, embraced, embracing","embracing (n.), embracement (n.)","include in scope; include as part of something broader; have as one's sphere or territory","And I think that we should embrace more uncertainty.","embrace technology; embrace practical solutions; embrace change","C1"
"Emission","/ɪˈmɪʃən/","n.","emission, emissions","None","the act of emitting; causing to flow forth","Now, fast radio bursts have been in the news for a couple of years because there was much energy in these mysterious bursts of radio emission that we couldn't explain what was going on.","emission costs; of emissions; reduce emissions","C1"
"Envision","/ɛˈnvɪʒən/","v.","envision, envisions, envisioned, envisioned, envisioning","envisioning (n.)","imagine; conceive of; see in one's mind","The architects envision a green roof where residents can grow their own vegetables.","people envision; envision future; envision world","C1"
"Entity","/ˈɛntəti/","n.","entity, entities","None","that which is perceived or known or inferred to have its own distinct existence (living or nonliving)","The charity operates as a separate legal entity from the company that founded it.","commercial entity; big entity; single entity","C1"
"Epidemic","/ˌɛpəˈdɛmɪk/","n.","epidemic, epidemics","None","a widespread outbreak of an infectious disease; many people are infected at the same time","A combination of violence and disease epidemics caused the indigenous peoples Algerian population to decline by nearly one-third from 1830 to 1872.","epidemic disease; past viral epidemic; epidemic of loneliness","C1"
"Entrepreneur","/ˌɑntɹəpɹəˈnɝ/","n.","entrepreneur, entrepreneurs","entrepreneurial (adj.)","someone who organizes a business venture and assumes the risk for it","Rand provided a positive view of business; subsequently, many business executives and entrepreneurs have admired and promoted her work.","chinese entrepreneur; individual entrepreneur; greatest entrepreneur","C1"
"Epidemic","/ˌɛpəˈdɛmɪk/","adj.","epidemic, more epidemic, most epidemic","None","(especially of medicine) of disease or anything resembling a disease; attacking or affecting many individuals in a community or a population simultaneously","Many of them likely died on the way or later in the gold mines by the Spanish colonizers or during the devastating smallpox epidemic of 1518.","epidemic disease; opioid epidemic; epidemic diseases","C1"
"Erect","/ɪˈɹɛkt/","v.","erect, erects, erected, erected, erecting","erecting (n.), erection (n.), erectness (n.)","construct, build, or erect","How did they erect those giant statues on Easter Island.","erect barbed wire; erect barriers; erect wall","C1"
"Episode","/ˈɛpəˌsoʊd/","n.","episode, episodes","None","a happening that is distinctive in a series of related events","Gershwin's first A episode introduces the two main ""walking"" themes in the ""Allegretto grazioso"" and develops a third theme in the ""Subito con brio""","last episode; episode seven; first episode","C1"
"Errand","/ˈɛɹənd/","n.","errand, errands","None","a short trip that is taken in the performance of a necessary task or mission","Let her pulsations for a moment pause on their errands, and creation's self ebbs instantly into chaos and invisibility again.","errand boy; run errands; run errand","C1"
"Erupt","/ɪˈɹʌpt/","v.","erupt, erupts, erupted, erupted, erupting","eruption (n.), eruptive (adj.)","start abruptly","First, they got headaches and nausea, but then their skin began to nausea, but then their skin began to erupt with bumps, pestules, and acne.","erupt over issues; erupt on border; erupt over portrayal","C1"
"Escalator","/ˈɛskəˌleɪtɚ/","n.","escalator, escalators","None","a clause in a contract that provides for an increase or a decrease in wages or prices or benefits etc. depending on certain conditions (as a change in the cost of living index)","Everything seemed fine, but inside the escalator was a problem.","on escalator; down escalator; in escalator","C1"
"Equivalent","/ɪˈkwɪvələnt/","adj.","equivalent, more equivalent, most equivalent","equivalence (n.)","being essentially equal to something","That amount, only some of which is Radiative forcing, is equivalent to a 138 ppm increase of atmospheric carbon dioxide.","effectively equivalent; equivalent formulations; equivalent classification performance","C1"
"Equivalent","/ɪˈkwɪvələnt/","n.","equivalent, equivalents","equivalence (n.)","a person or thing equal to another in value or measure or force or effect or significance etc","That amount, only some of which is Radiative forcing, is equivalent to a 138 ppm increase of atmospheric carbon dioxide.","equivalent to problem; of equivalents; own equivalent","C1"
"Equation","/ɪˈkweɪʒən/","n.","equation, equations","equate (v.)","a mathematical statement that two expressions are equal","The reflectivity of a water surface is calculated using the Fresnel equations.","field equation; wave maps equation; differential equations","C1"
"Equity","/ˈɛkwəti/","n. [U]","no changes","None","the difference between the market value of a property and the claims held against it","In tort, equity (law), or other civil matters either party to a previous case may file an appeal.","equity risk premium; equity considerations; private equity","C1"
"Essence","/ˈɛsəns/","n. [U]","no changes","essential (adj.)","the choicest or most essential or most vital part of some idea or experience","According to this Marxist view, that a social idea would follow directly from this human ideal and out of the free will of every individual formed its essence.","pure essence; human essence; in essence","C1"
"Exaggeration","/ɪˌɡzædʒɚˈeɪʃən/","n.","exaggeration, exaggerations","exaggerate (v.)","extravagant exaggeration","It's a multitude of causes and that caused a domino effect for one thing and it also caused an exaggeration, where one thing was made much worse because of the next.","general exaggeration; without exaggeration; much exaggeration","C1"
"Ethical","/ˈɛθəkəl/","adj.","ethical, more ethical, most ethical","ethics (n.)","of or relating to the philosophical study of ethics","Anarchists may be motivated by humanism, God, enlightened self-interest, Veganarchism, or any number of alternative ethical doctrines.","ethical standards; ethical values; ethical implications","C1"
"Estate","/ɪˈsteɪt/","n.","estate, estates","None","everything you own; all of your assets (whether real property or personal property) and liabilities","Lincoln's father bought multiple farms in Kentucky but could not get clear Recording (real estate) to any, losing hundreds of acres in legal disputes.","council estate; real estate; buy estate","C1"
"Eternal","/ɪˈtɝnəl/","adj.","no changes","eternity (n.)","continuing forever or indefinitely","Maybe time is eternal in both directions.","eternal life; eternal struggle; eternal war","C1"
"Exclusive","/ɪksˈklusɪv/","adj.","exclusive, more exclusive, most exclusive","exclude (v.), exclusiveness (n.)","not divided or shared with others","Members enjoyed exclusive access to the gardens before they opened to the public.","exclusive deals; exclusive access; exclusive content","C1"
"Exclaim","/ɪksˈkleɪm/","v.","exclaim, exclaims, exclaimed, exclaimed, exclaiming","exclaiming (n.), exclamation (n.), exclamatory (adj.)","utter aloud; often with surprise, horror, or joy","PI upon being informed of the results PI upon being informed of the results exclaimed that's total nonsense.","often loudly exclaim; exclaim against; exclaim on tables","C1"
"Excessive","/ɪˈksɛsɪv/","adj.","excessive, more excessive, most excessive","excessively (adv.), excess (n.)","beyond normal limits","McClellan's slow progress and excessive precautions frustrated Lincoln.","excessive amounts; excessive production; excessive regulation","C1"
"Exceptional","/ɪˈksɛpʃənəl/","adj.","exceptional, more exceptional, most exceptional","exception (n.)","far beyond what is usual in magnitude or degree","Benefiting from the substantial progress of Large Language Models , dialogue agents have acquired an exceptional capability in context understanding and response generation.","exceptional preservation; deliver exceptional; exceptional performance","C1"
