"word","ipa","pos","inflections","derivatives","definition","example","collocations","context_type"
"Banquet","/ˈbæŋkwət/","n.","banquet, banquets","None","A large celebratory meal; a feast.","For this book, I attended an authentic Roman banquet and ate strange foods of all kinds, everything from caterpillars to walruses.","formal banquet; banquet hall; state banquet","C2"
"Barbarian","/bɑˈɹbɛɹiən/","n.","barbarian, barbarians","None","a member of an uncivilized people","In one famous example, he counsels Alexander to be ""a leader to the Greeks and a despot to the barbarians""","ancient barbarian; barbarian invasion; barbarian tribe","C2"
"Bass","/ˈbæs/","n.","bass, basses","None","A low spectrum of sound tones.","The deep bass of the cello filled the concert hall with a rich, resonant tone.","bass guitar; deep bass; bass note","C2"
"Backbone","/ˈbæˌkboʊn/","n.","backbone, backbones","None","The fundamental support or most important part of something; the mainstay.","This study enhances Re:PolyWorld's performance on complex urban residential structures by incorporating attention-based backbones and additional area segmentation loss.","form the backbone; backbone of society; strong backbone","C2"
"Beautify","/ˈbjutɪˌfaɪ/","v.","beautify, beautifies, beautified, beautified, beautifying","beauty (n.), beautification (n.)","make more beautiful","The farmers complained that something was wrong with an electoral system which produced parliamentarians who spent money beautifying vampire-cities instead of developing the interior.","beautify the city; beautify with flowers; efforts to beautify","C2"
"Beep","/ˈbip/","n.","beep, beeps","beeper (n.)","a short high tone produced as a signal or warning","The microwave let out a sharp beep when the timer reached zero.","loud beep; a short beep; beep to signal","C2"
"Awesome","/ˈɑsəm/","adj.","awesome, more awesome, most awesome","None","Causing awe or terror; inspiring wonder or excitement.","And it's awesome to see someone else coming up who's dancing and singing, and seeing how all these kids relate to her.","an awesome sight; truly awesome; an awesome responsibility","C2"
"Bilateral","/baɪˈlætɚəl/","adj.","no changes","bilaterality (n.)","having identical parts on each side of an axis","We estimate a vector autoregressive model for prove the bilateral causality and impacts of macroeconomic and macroprudential policies.","bilateral agreement; bilateral talks; bilateral relations","C2"
"Beverage","/ˈbɛvɚɪdʒ/","n.","beverage, beverages","None","any liquid suitable for drinking","The Alabama Alcoholic Beverage Control Board controls the sale and distribution of alcoholic beverages in the state.","alcoholic beverage; hot beverage; soft beverage","C2"
"Blaze","/ˈbleɪz/","n.","blaze, blazes","None","A fire, especially a fast-burning fire producing a lot of flames and light.","The sun blazes harsh and wrong somehow.","blaze a trail; house ablaze; blazing fire","C2"
"Blond","/ˈblɑnd/","n. [U]","no changes","blondness (n.)","A pale yellowish (golden brown) color, especially said of hair color.","She had naturally blond hair that turned a darker shade as she grew older.","blond hair; natural blond; a blond child","C2"
"Beforehand","/bɪˈfɔˌɹhænd/","adv.","no changes","None","At an earlier or preceding time.","If you had told me beforehand, I would have prepared the documents in advance.","prepare beforehand; know beforehand; plan everything beforehand","C2"
"Blonde","/ˈblɑnd/","n. [U]","no changes","None","Alternative form of blond (“person with fair hair”). (Used especially of a woman. See the usage notes in the entry blond.)","The film concerns the hunt for a Jack the Ripper-style serial killer who, wearing a black cloak and carrying a black bag, is murdering young blonde women in London, and only on Tuesdays.","bleach blonde; natural blonde; dye hair blonde","C2"
"Blot","/ˈblɑt/","n.","blot, blots","blotter (n.)","A blemish, spot or stain made by a coloured substance.","A drop of ink left an ugly blot on the freshly signed document.","blot out the sun; ink blot; blot dry","C2"
"Bleach","/ˈblitʃ/","v.","bleach, bleaches, bleached, bleached, bleaching","bleacher (n.)","To treat with bleach, especially so as to whiten (fabric, paper, etc.) or lighten (hair).","However, warming oceans still remain a most severe concern for coral reef survival, as anomalously high temperatures can cause fatal coral bleaching, a major driver of coral reef decline.","household bleach; bleach clothing; bleach solution","C2"
"Boulevard","/ˈbʊləˌvɑɹd/","n.","boulevard, boulevards","None","a wide street or thoroughfare","The parade moved slowly down the broad boulevard lined with cheering crowds.","tree-lined boulevard; wide boulevard; stroll along the boulevard","C2"
"Blunt","/ˈblʌnt/","adj.","blunt, blunter, bluntest","bluntness (n.), bluntly (adv.)","Having a thick edge or point; not sharp.","To be blunt, they were no coincidence.","blunt remark; blunt instrument; blunt force","C2"
"Booklet","/ˈbʊklɪt/","n.","booklet, booklets","book (n.)","a small book usually having a paper cover","He was also upset about a booklet for propagandists the Ministry of Information had put out.","instruction booklet; slim booklet; information booklet","C2"
"Bosom","/ˈbʊzəm/","n.","bosom, bosoms","bosomy (adj.)","a person's chest, especially a woman's","The frightened child rested safely against her mother's bosom.","warm bosom; mother's bosom; bosom friend","C2"
"Bodily","/ˈbɑdəli/","adj.","no changes","None","Of, relating to, or concerning the body.","I was also starting to sweat and there was blood and bodily fluids coming out of this deer skull that I was working on.","bodily changes; bodily functions; bodily odor","C2"
"Boycott","/ˈbɔɪˌkɑt/","v.","boycott, boycotts, boycotted, boycotted, boycotting","None","To abstain, either as an individual or a group, from using, buying, or dealing with someone or some organization as an expression of protest.","Consumers decided to boycott the company until it changed its labor practices.","organize a boycott; call for boycott; consumer boycott","C2"
"Breakup","/ˈbɹeɪˌkʌp/","n.","breakup, breakups","None","The act of breaking up; disintegration or division.","The sudden breakup of the partnership left both founders searching for new investors.","painful breakup; relationship breakup; breakup fee","C2"
"Boxing","/ˈbɑksɪŋ/","n. [U]","no changes","box (v.)","fighting with the fists","He challenged the young and sturdy men to a boxing match, only to behead them when they were defeated; he hung the decapitated heads to an oak tree.","boxing match; boxing ring; boxing champion","C2"
"Bra","/ˈbɹɑ/","n.","bra, bras","None","An item of clothing, usually underwear worn to support the breasts.","She packed a sports bra and running shoes for her morning workout.","a sports bra; a lace bra; a comfortable bra","C2"
"Brace","/ˈbɹeɪs/","v.","brace, braces, braced, braced, bracing","bracer (n.), bracing (n.)","To prepare for something bad, such as an impact or blow.","The passengers were told to brace themselves for a sudden drop in altitude.","brace for impact; knee brace; brace oneself","C2"
"Breadth","/ˈbɹɛdθ/","n. [U]","no changes","None","The extent or measure of how broad or wide something is; width.","Despite the breadth of methods available to address psychological research questions, social network analysis is not yet a standard practice in psychological research.","full breadth; incredible breadth; impressive breadth","C2"
"Breakdown","/ˈbɹeɪˌkdaʊn/","n.","breakdown, breakdowns","None","A failure, particularly one which is mechanical in nature.","In the past, their self-identification was often overlooked as the state tried to impose a binary breakdown of society into white and black.","mental breakdown; system breakdown; detailed breakdown","C2"
"Bribe","/ˈbɹaɪb/","v.","bribe, bribes, bribed, bribed, bribing","briber (n.), bribery (n.), bribable (adj.)","To give a bribe to; specifically, to ask a person to do something against their original will, in exchange for some type of reward or relief from potential trouble.","Some teachers may reportedly demand payment or bribes directly from their pupils.","offer a bribe; accept a bribe; bribery and corruption","C2"
"Broth","/ˈbɹɔθ/","n. [U]","no changes","None","Water in which food (meat, vegetable, etc.) has been boiled.","A well-seasoned broth requires careful simmering to extract the full depth of flavor from the bones and vegetables.","chicken broth; bone broth; vegetable broth","C2"
"Broil","/ˈbɹɔɪl/","v.","broil, broils, broiled, broiled, broiling","broiler (n.)","cook under a broiler","Most popular were ""broiling, roasting, boiling and steaming"", followed by ""pickling in salt, wine, sauce and the like""","broil fish; broil at high heat; broil until golden","C2"
"Brook","/ˈbɹʊk/","n.","brook, brooks","None","A body of running water smaller than a river; a small stream.","A shallow brook wound through the meadow, its clear water glittering in the afternoon sun.","babbling brook; clear brook; flow of the brook","C2"
"Brink","/ˈbɹɪŋk/","n.","brink, brinks","None","The edge, margin, or border of a steep place, as of a precipice; a bank or edge.","The fragile ceasefire held, pulling both nations back from the brink of full-scale war.","on the brink; brink of collapse; brink of war","C2"
"Brochure","/bɹoʊˈʃʊɹ/","n.","brochure, brochures","None","a small book usually having a paper cover","The travel brochure featured colorful photos of beaches and historic landmarks.","tourist brochure; official brochure; print a brochure","C2"
"Broaden","/ˈbɹɔdən/","v.","broaden, broadens, broadened, broadened, broadening","None","To make broad or broader.","This work broadens our understanding of commitments in game theory and raises critical questions about how to safeguard strategic interactions from exploitation through non-coercive extortion.","broaden horizons; broaden the mind; broaden one's knowledge","C2"
"Bulky","/ˈbʌlki/","adj.","bulky, bulkier, bulkiest","bulk (n.), bulkiness (n.)","Being large in size, mass, or volume; big, fat or muscular.","State-of-the-art methods in cognitive science work offline and/or involve bulky equipment hardly deployable in industrial settings.","bulky package; bulky equipment; bulky frame","C2"
"Calligraphy","/kəˈlɪɡɹəfi/","n. [U]","no changes","calligrapher (n.), calligraphist (n.), calligraphical (adj.)","beautiful handwriting","She spent years mastering calligraphy until her brushwork looked effortlessly graceful.","practice calligraphy; calligraphy class; Chinese calligraphy","C2"
"Brotherhood","/ˈbɹʌðɚˌhʊd/","n.","brotherhood, brotherhoods","brother (n.)","The state of being brothers or a brother (also figuratively).","The soldiers developed a deep sense of brotherhood during their months of training together.","sense of brotherhood; foster brotherhood; brotherhood among","C2"
"Calculator","/ˈkælkjəˌleɪtɚ/","n.","calculator, calculators","calculate (v.)","an expert at calculation (or at operating calculating machines)","For example, a human can produce a much greater, and more accurate, volume of mathematical calculation in a unit of time using a calculator or a spreadsheet application on a computer.","scientific calculator; pocket calculator; use a calculator","C2"
"Caffeine","/kæˈfin/","n. [U]","no changes","None","a bitter alkaloid found in coffee and tea that is responsible for their stimulating effects","He cut back on caffeine because too much coffee was disturbing his sleep at night.","caffeine intake; caffeine dependency; high caffeine","C2"
"Bureaucrat","/ˈbjʊɹəˌkɹæt/","n.","bureaucrat, bureaucrats","None","an official of a bureaucracy","An overly cautious bureaucrat delayed the permit for months by demanding more paperwork.","government bureaucrat; senior bureaucrat; local bureaucrat","C2"
"Cape","/ˈkeɪp/","n.","cape, capes","None","A piece or point of land, extending beyond the adjacent coast into a sea or lake; a promontory; a headland.","The superhero swept the villain aside with one swing of her red cape.","wear a cape; cape of a cloak; billowing cape","C2"
"Captive","/ˈkæptɪv/","n. [U]","no changes","captivate (v.), captivity (n.)","One who has been captured or is otherwise confined.","We're here with our lovely captive audience.","held captive; take captive; captive audience","C2"
"Capsule","/ˈkæpsəl/","n.","capsule, capsules","capsular (adj.), capsulate (v.), capsulise (v.), capsulize (v.)","A membranous envelope.","Another feature, unique to frogs and salamanders, is the columella-operculum complex adjoining the auditory capsule which is involved in the transmission of both airborne and seismic signals.","time capsule; space capsule; medicine capsule","C2"
"Bypass","/ˈbaɪˌpæs/","v.","bypass, bypasses, bypassed, bypassed, bypassing","None","To avoid an obstacle etc, by constructing or using a bypass.","A sixth route, Interstate 685 (Alabama), will be formed when I-85 is rerouted along a new southern bypass of Montgomery.","bypass the system; cardiac bypass; bypass security","C2"
"Cardinal","/ˈkɑɹdənəl/","adj.","no changes","cardinalship (n.)","Of fundamental importance; crucial, pivotal.","Other terms with this type of ambiguity are: satisfiable, true, false, function, property, class, relation, cardinal, and ordinal.","cardinal rule; cardinal sin; cardinal direction","C2"
"Captivity","/kæˈptɪvəti/","n. [U]","no changes","captive (adj.)","The state of being captive.","Octopuses won’t breed in captivity, for instance, meaning that researchers must rely on wild-caught animals.","egyptian captivity; held in captivity; breed in captivity","C2"
"Carefree","/ˈkɛɹˌfɹi/","adj.","carefree, more carefree, most carefree","carefreeness (n.)","Without cares or worries; free of concern or worries; without difficulty.","Her carefree attitude during the trip made everyone relax and enjoy the journey.","carefree attitude; carefree life; carefree childhood","C2"
"Cardboard","/ˈkɑɹˌdbɔɹd/","n. [U]","no changes","None","a stiff moderately thick paper","The bellows is located between the right- and left-hand keyboards, and is made from pleated layers of cloth and cardboard, with added leather and metal.","cardboard box; cardboard cutout; folded cardboard","C2"
"Caretaker","/ˈkɛˌɹteɪkɚ/","n.","caretaker, caretakers","None","Someone who takes care of a place or thing; someone looking after a place, or responsible for keeping it in good repair.","A new caretaker government was announced on 7 September.","primary caretaker; caretaker role; working caretaker","C2"
"Caption","/ˈkæpʃən/","n.","caption, captions","captious (adj.)","The descriptive heading or title, of a document or part thereof.","An affidavit that is prepared for use within the context of litigation may also include a caption that identifies the venue and parties to the relevant judicial proceedings.","photo caption; add a caption; image caption","C2"
"Carton","/ˈkɑɹtən/","n.","carton, cartons","None","An inexpensive, disposable box-like container fashioned from either paper, paper with wax-covering (wax paper), or other lightweight material.","She poured the last of the milk from the carton into her morning bowl of cereal.","milk carton; juice carton; egg carton","C2"
"Cashier","/kæˈʃɪɹ/","n.","cashier, cashiers","None","a person who takes payments from customers in a shop","The friendly cashier scanned my items and told me the total price.","store cashier; bank cashier; friendly cashier","C2"
"Casualty","/ˈkæʒəwəlti/","n.","casualty, casualties","None","someone injured or killed or captured or missing in a military engagement","Driver attention prediction can play an instrumental role in mitigating and preventing high-risk events, collisions and casualties.","civilian casualty; war casualty; heavy casualties","C2"
"Caterpillar","/ˈkætəˌpɪlɚ/","n.","caterpillar, caterpillars","None","a wormlike and often brightly colored and hairy or spiny larva of a butterfly or moth","For this book, I attended an authentic Roman banquet and ate strange foods of all kinds, everything from caterpillars to walruses.","fuzzy caterpillar; caterpillar crawls; caterpillar cocoon","C2"
"Celery","/ˈsɛlɚi/","n. [U]","no changes","None","widely cultivated herb with aromatic leaf stalks that are eaten raw or cooked","She chopped celery, carrots, and onions to form the aromatic base of the soup.","fresh celery; celery stalk; celery soup","C2"
"Census","/ˈsɛnsəs/","n.","census, censuses","None","a periodic count of the population","We exploit quasi-random variation around the multi-threshold criteria used to classify Census Towns and focus on settlements near the thresholds that are likely to obtain statutory recognition.","national census; conduct a census; census data","C2"
"Chairperson","/ˈtʃɛˌɹpɝsən/","n.","chairperson, chairpersons","None","A chairman or chairwoman, someone who presides over a meeting, board, etc.","The chairperson opened the meeting and warmly welcomed all the new members.","elect a chairperson; acting chairperson; appoint a chairperson","C2"
"Cavity","/ˈkævəti/","n.","cavity, cavities","None","a hollow space or hole within a solid object or the body","And then once they had the organs out they had to wash the inner cavity and then use the mineral that he had found in Egypt to dry the body out.","chest cavity; oral cavity; inner cavity","C2"
"Cater","/ˈkeɪtɚ/","v.","cater, caters, catered, catered, catering","caterer (n.)","To provide, particularly","The main advantage of this framework is that it can cater for paradoxical and irrational human decision making.","cater to needs; cater for guests; cater to demand","C2"
"Celsius","/ˈsɛlsiəs/","n. [U]","no changes","None","A scale for measuring temperature in which water freezes at 0 degrees and boils at 100 degrees.","Temperatures dropped to minus ten degrees Celsius overnight in the mountain village.","degrees Celsius; in Celsius; convert to Celsius","C2"
"Catastrophe","/kəˈtæstɹəfi/","n.","catastrophe, catastrophes","catastrophic (adj.)","a sudden event that causes great harm or destruction","The flood was a catastrophe that destroyed hundreds of homes.","natural catastrophe; major catastrophe; avoid a catastrophe","C2"
"Cement","/səˈmɛnt/","n. [U]","no changes","cementitious (adj.)","To join or consolidate firmly; to strengthen or make permanent.","But even , exchanging one princess one way was enough to cement a new diplomatic treaty.","pour cement; wet cement; cement a relationship","C2"
"Checkup","/ˈtʃɛˌkʌp/","n.","checkup, checkups","None","a thorough physical examination; includes a variety of tests depending on the age and sex and health of the person","The doctor recommended an annual checkup to monitor her blood pressure and cholesterol levels.","annual checkup; routine checkup; medical checkup","C2"
"Ceramic","/sɚˈæmɪk/","n. [U]","no changes","ceramics (n.)","A hard, brittle, inorganic, nonmetallic material, usually made from a material, such as clay, then firing it at a high temperature.","The artist shaped a small ceramic bowl on her potter's wheel.","ceramic tile; fired ceramic; ceramic artwork","C2"
"Chemist","/ˈkɛmɪst/","n.","chemist, chemists","chemistry (n.)","A person who specializes in the science of chemistry, especially at a professional level.","After earning her doctorate, she worked as a chemist developing new medicines.","industrial chemist; research chemist; trained chemist","C2"
"Champagne","/ʃæˈmpeɪn/","n. [U]","no changes","None","a white sparkling wine either produced in Champagne or resembling that produced there","The guests raised their glasses of champagne to toast the couple's engagement.","glass of champagne; toast with champagne; champagne flute","C2"
"Charitable","/ˈtʃæɹətəbəl/","adj.","charitable, more charitable, most charitable","charitableness (n.)","Pertaining to charity.","Men perform charitable acts in the early stages of a romantic relationship or simply when in the presence of an attractive woman.","charitable donation; charitable organization; charitable act","C2"
"Certify","/ˈsɝtəˌfaɪ/","v.","certify, certifies, certified, certified, certifying","certifiable (adj.), certificate (n.), certification (n.), certificatory (adj.)","To attest to (a fact) as the truth.","A licensed official must certify that the documents are genuine before the trial.","certify a document; officially certify; certify as compliant","C2"
"Chant","/ˈtʃænt/","v.","chant, chants, chanted, chanted, chanting","chanter (n.), chanting (n.)","To sing, especially without instruments, and as applied to monophonic and pre-modern music.","The monks gathered in the stone chapel each morning to chant their ancient hymns in unison.","protest chant; crowd chants; repeat the chant","C2"
"Cellular","/ˈsɛljəlɚ/","adj.","no changes","cell (n.), cellularity (n.)","Of, relating to, consisting of, or resembling a cell or cells.","The scientists studied cellular respiration to understand how the body converts nutrients into energy.","cellular biology; cellular network; cellular respiration","C2"
"Chestnut","/ˈtʃɛˌsnʌt/","n.","chestnut, chestnuts","None","wood of any of various chestnut trees of the genus Castanea","Every autumn, street vendors roasted chestnuts over open charcoal fires throughout the city.","roasted chestnut; chestnut tree; chestnut brown","C2"
"Chimpanzee","/tʃɪˈmpænzi/","n.","chimpanzee, chimpanzees","None","intelligent somewhat arboreal ape of equatorial African forests","Researchers documented chimpanzees crafting tools from twigs to extract termites from mounds.","wild chimpanzee; chimpanzee behavior; study chimpanzees","C2"
"Chili","/ˈtʃɪli/","n.","chili, chilis","None","ground beef and chili peppers or chili powder often with tomatoes and kidney beans","Agricultural products include tomatoes, corn, watermelon, beans, green chili peppers, and melons.","hot chili; chili sauce; chili pepper","C2"
"Chirp","/ˈtʃɝp/","v.","chirp, chirps, chirped, chirped, chirping","chirpy (adj.)","To make a short, sharp, cheerful note, as of small birds or crickets; to chitter; to twitter.","The sparrows chirped energetically at dawn, filling the garden with their cheerful calls.","bird chirp; chirp softly; sparrows chirped","C2"
"Cigar","/sɪˈɡɑɹ/","n.","cigar, cigars","None","a roll of tobacco for smoking","Manufacturing output consists mainly of cigarettes, cigars, and furniture.","light a cigar; smoke a cigar; Cuban cigar","C2"
"Cholesterol","/kəˈlɛstɚˌɔl/","n. [U]","no changes","None","an animal sterol that is normally synthesized by the liver; the most abundant steroid in animal tissues","Cells that produce steroid hormones can acquire cholesterol through two paths.","high cholesterol; lower cholesterol; cholesterol levels","C2"
"Clasp","/ˈklæsp/","v.","clasp, clasps, clasped, clasped, clasping","None","To take hold of; to grasp.","She clasped her daughter's hand tightly as they crossed the busy street.","gold clasp; clasp hands; metal clasp","C2"
"Civilize","/ˈsɪvəˌlaɪz/","v.","civilize, civilizes, civilized, civilized, civilizing","civilization (n.)","To bring a society or person to a more advanced or cultured state of development.","Our economy is in recession and the civilized world faces unprecedented dangers.","civilize society; bring civilization; civilized world","C2"
"Climax","/ˈklaɪˌmæks/","n.","climax, climaxes","climactic (adj.)","A rhetorical device in which a series is arranged in ascending order.","A child prodigy of exceptional talents, Francisco was dubbed the ""climax"" of the d'Anconia line, an already prestigious Argentine family of skilled industrialists.","reach a climax; dramatic climax; climax of the story","C2"
"Clam","/ˈklæm/","n.","clam, clams","None","burrowing marine mollusk living on sand or mud; the shell closes with viselike firmness","In 2019 a giant clam was sighted in the territory for the first time since 2006.","fresh clam; steamed clam; clam chowder","C2"
"Clockwise","/ˈklɑˌkwaɪz/","adv.","no changes","None","in the direction that the hands of a clock move","For large lesions, a different part of the tumour was injected at each cycle in a clockwise manner.","move clockwise; distinguish between clockwise; clockwise manner","C2"
"Clearance","/ˈklɪɹəns/","n.","clearance, clearances","clear (v.)","The act of clearing or something (such as a space) cleared.","If the peg and hole are designed with transition fit, machining errors may lead to either a clearance or an interference fit for a specific pair of components, with uncertain fit amounts.","security clearance; get clearance; low overhead clearance","C2"
"Colloquial","/kəˈloʊkwiəl/","adj.","colloquial, more colloquial, most colloquial","colloquialism (n.), colloquially (adv.)","Characteristic of familiar conversation, of common parlance; informal.","Colloquial Algerian Arabic has some Berber loanwords which represent 8% to 9% of its vocabulary.","colloquial expression; colloquial language; colloquial term","C2"
"Coastline","/ˈkoʊsˌtlaɪn/","n.","coastline, coastlines","None","the outline of a coast","They suck up carbon and filter water, making coastlines cleaner.","rugged coastline; scenic coastline; protect the coastline","C2"
"Closure","/ˈkloʊʒɚ/","n.","closure, closures","close (v.)","An event or occurrence that signifies an ending.","The grieving family finally found closure years after the long investigation ended.","achieve closure; school closure; factory closure","C2"
