"word","ipa","pos","inflections","derivatives","definition","example","collocations","context_type"
"Acclaim","/əˈkleɪm/","n. [U]","no changes","acclamation (n.)","Enthusiastic public praise or approval.","The young pianist won great acclaim for her brilliant and moving performance.","critical acclaim; widespread acclaim; win acclaim","C2"
"Aboriginal","/ˌæbɚˈɪdʒənəl/","adj.","no changes","aborigine (n.)","First according to historical or scientific records; original; indigenous; primitive.","The first use of bitumen in the New World was by aboriginal peoples.","indigenous aboriginal; aboriginal community; aboriginal rights","C2"
"Accordance","/əˈkɔɹdəns/","n. [U]","no changes","accord (v.), accordant (adj.)","Agreement; harmony; conformity; compliance.","In accordance with the doctrine of Nils Bohr, the operations carry individual names of classical significance.","in accordance with; full accordance; accordance with law","C2"
"Accessory","/æˈksɛsɚi/","n.","accessory, accessories","accessorial (adj.)","Something that belongs to part of another main thing; something additional and subordinate, an attachment.","She wore a simple black dress with a silver bracelet as her only accessory.","fashion accessory; charged as accessory; accessory to crime","C2"
"Accordingly","/əˈkɔɹdɪŋli/","adv.","accordingly, more accordingly, most accordingly","None","Agreeably; correspondingly; suitably","To safely and efficiently interact with other road participants, AVs have to accurately predict the behavior of surrounding vehicles and plan accordingly.","act accordingly; respond accordingly; adjust accordingly","C2"
"Academy","/əˈkædəmi/","n.","academy, academies","academic (adj.), academician (n.)","An institution for the study of higher learning; a college or a university; typically a private school.","She enrolled at a prestigious music academy to refine her skills as a concert pianist.","military academy; science academy; music academy","C2"
"Abundance","/əˈbʌndəns/","n. [U]","no changes","abundant (adj.)","A large quantity; many.","But now we live in times of abundance, but that hardwiring to crave the donuts hasn't gone away.","natural abundance; in abundance; abundance of resources","C2"
"Abstraction","/æbsˈtɹækʃən/","n.","abstraction, abstractions","abstract (v.)","The act of abstracting, separating, withdrawing, or taking away; withdrawal; the state of being taken away.","His paintings move toward pure abstraction, leaving behind any recognizable shapes or figures.","abstraction properties; abstraction approach; hierarchical abstraction","C2"
"Accountable","/əˈkaʊntəbəl/","adj.","accountable, more accountable, most accountable","account (v.), accountability (n.)","Obliged, when called upon, to answer (for one’s deeds); answerable.","SMART goals are really useful because they hold you accountable.","hold accountable; remain accountable; accountable to the public","C2"
"Acre","/ˈeɪkɚ/","n.","acre, acres","None","a unit of area (4840 square yards) used in English-speaking countries","The farmer purchased five acres of fertile land along the riverbank.","vast acres; acres of land; several thousand acres","C2"
"Acne","/ˈækni/","n. [U]","no changes","None","A skin condition, usually of the face, that is common in adolescents. It is characterised by red pimples, and is caused by the inflammation of sebaceous glands through bacterial infection; acne vulgaris.","The dermatologist recommended a topical treatment to control the patient's severe acne.","severe acne; treat acne; acne breakout","C2"
"Accusation","/ˌækjəˈzeɪʃən/","n.","accusation, accusations","accusatory (adj.), accuse (v.)","The act of accusing.","Tebboune rejects these accusations, claiming to be the victim of a witch hunt.","face an accusation; false accusation; deny the accusation","C2"
"Accumulation","/əˌkjumjəˈleɪʃən/","n. [U]","no changes","accumulate (v.)","The act of amassing or gathering, as into a pile.","The accumulation of adaptations in an open-ended manner during lifetime learning is a holy grail in reinforcement learning, intrinsic motivation, artificial curiosity, and developmental robotics.","gradual accumulation; accumulation of wealth; toxic accumulation","C2"
"Admiral","/ˈædmɚəl/","n.","admiral, admirals","None","The commander of a naval squadron or fleet, regardless of formal rank.","The admiral ordered the fleet to retreat once the storm made further fighting impossible.","fleet admiral; rear admiral; admiral in command","C2"
"Addiction","/əˈdɪkʃən/","n.","addiction, addictions","addictive (adj.)","A state that is characterized by compulsive drug use or compulsive engagement in rewarding behavior, despite negative consequences.","He sought professional help to overcome his addiction and slowly rebuilt his shattered life.","drug addiction; addiction to gambling; overcome addiction","C2"
"Adolescence","/ˌædəˈlɛsəns/","n. [U]","no changes","adolesce (v.), adolescent (adj.)","the time period between the beginning of puberty and adulthood","There's childhood, there's adolescence, and there's adulthood.","during adolescence; early adolescence; adolescent challenges","C2"
"Adaptation","/ˌædəˈpteɪʃən/","n.","adaptation, adaptations","adapt (v.)","The process of adapting something or becoming adapted to a situation; adjustment, modification.","In the case of living things, it implies adaptation to a particular way of life.","cultural adaptation; biological adaptation; successful adaptation","C2"
"Affectionate","/əˈfɛkʃənət/","adj.","affectionate, more affectionate, most affectionate","affection (n.), affectionateness (n.)","Having affection or warm regard; loving; fond.","The cat is absent for long periods and is forgiven because her excuses are so convincing and she is naturally charming and affectionate.","deeply affectionate; affectionate gesture; affectionate nickname","C2"
"Aesthetic","/ɛˈsθɛtɪk/","adj.","aesthetic, more aesthetic, most aesthetic","aesthetically (adv.), aestheticism (n.)","Concerned with beauty, artistic effect, or appearance.","The 19th-century neo-impressionist movement had an ecological aesthetic and offered an example of an anarchist perception of the road towards socialism.","aesthetic appeal; strong aesthetic; aesthetic value","C2"
"Advisory","/æˈdvaɪzɚi/","adj.","advisory, more advisory, most advisory","advise (v.)","Having the power to give advice or recommendations, not to make decisions.","The committee plays a purely advisory role and cannot enforce any of its suggestions.","advisory board; advisory committee; advisory role","C2"
"Airtight","/ˈɛˌɹtaɪt/","adj.","no changes","None","Impermeable to air or other gases.","Drebbel’s airtight submersibles and methodical trials echo in the motion studies and environmental chambers of Salomon’s House.","airtight container; airtight seal; airtight argument","C2"
"Airway","/ˈɛˌɹweɪ/","n.","airway, airways","None","The trachea.","Smooth muscle is found in the walls of the uterus, bladder, intestines, stomach, oesophagus, respiratory airways, and blood vessels.","upper airway; open the airway; airway obstruction","C2"
"Algebra","/ˈældʒəbɹə/","n. [U]","no changes","algebraic (adj.), algebraist (n.), algebraical (adj.)","the mathematics of generalized arithmetical operations","Without presupposing any quantization scheme, this algebra is inherently non-commutative and comprises a large set of dynamics.","linear algebra; basic algebra; algebra equation","C2"
"Abbreviate","/əˈbɹiviˌeɪt/","v.","abbreviate, abbreviates, abbreviated, abbreviated, abbreviating","abbreviation (n.)","To shorten by omitting parts or details.","Editors often abbreviate long organisation names to save space within a headline.","abbreviate a word; commonly abbreviate; abbreviate the title","C2"
"Administrate","/æˈdmɪnɪsˌtɹeɪt/","v.","administrate, administrates, administrated, administrated, administrating","administrable (adj.), administrator (n.), administrative (adj.)","to administer","I don't want to say this is the perfect solution to administrate your server without you having to do something.","administrate a system; administrate resources; administrate the program","C2"
"Accustom","/əˈkʌstəm/","v.","accustom, accustoms, accustomed, accustomed, accustoming","accustomed (v.)","make psychologically or physically used (to something)","The new recruits quickly accustomed themselves to the rigorous demands of the training schedule.","become accustomed; accustom to change; accustom oneself","C2"
"Abound","/əˈbaʊnd/","v.","abound, abounds, abounded, abounded, abounding","abundance (n.), abundant (adj.)","To be full to overflowing; to bristle.","The animals of Animal Farm are terrified of Frederick, as rumours abound of him abusing his animals and entertaining himself with cockfighting.","wildlife abounds; opportunities abound; abound with life","C2"
"Affirm","/əˈfɝm/","v.","affirm, affirms, affirmed, affirmed, affirming","affirmer (n.), affirmable (adj.), affirmation (n.), affirmative (adj.), affirmatory (adj.)","To agree, verify or concur; to answer positively.","Assessments using metrics such as precision , recall , coverage , graph consistency , novelty detection , and expert validation affirm its robustness and coherence.","affirm identity; firmly affirm; affirm a belief","C2"
"Abide","/əˈbaɪd/","v.","abide, abides, abided, abided, abiding","abidance (n.)","To endure without yielding; to withstand.","Those who abide by the rules of the competition will have a fair chance to win.","abide by rules; abide the outcome; abide by the decision","C2"
"Affiliate","/əˈfɪliˌeɪt/","v.","affiliate, affiliates, affiliated, affiliated, affiliating","affiliation (n.)","To formally join or associate with a larger organization; to bring into close connection.","The independent clinic decided to affiliate with the regional hospital network to share resources.","affiliate with; close affiliate; affiliated organization","C2"
"Administer","/əˈdmɪnəstɚ/","v.","administer, administers, administered, administered, administering","administrable (adj.), administration (n.), administrative (adj.)","To manage or supervise; to give or apply something officially, such as medicine or a test.","The nurse will administer the medicine to the patient every morning.","administer a test; administer medication; administer justice","C2"
"Alienate","/ˈeɪljəˌneɪt/","v.","alienate, alienates, alienated, alienated, alienating","alienation (n.)","To cause someone to feel isolated or estranged; to make someone hostile or indifferent.","His cold and dismissive attitude alienated many of his closest colleagues over the years.","feel alienated; alienate supporters; become alienated","C2"
"Aluminum","/əˈlumənəm/","n. [U]","no changes","aluminise (v.), aluminize (v.), aluminous (adj.)","a silvery ductile metallic element found primarily in bauxite","The lightweight bicycle frame was made of aircraft-grade aluminum.","aluminum alloy; lightweight aluminum; aluminum frame","C2"
"Alligator","/ˈæləˌɡeɪtɚ/","n.","alligator, alligators","None","Either of two large aquatic reptiles (Alligator mississippiensis or Alligator sinensis) with a broad snout, powerful jaws, and tough hide, native to the Americas and China.","An alligator basked on the muddy bank of the swamp, its eyes just above the water.","wild alligator; alligator attack; alligator habitat","C2"
"Altitude","/ˈæltəˌtud/","n.","altitude, altitudes","altitudinal (adj.), altitudinous (adj.)","The absolute height of a location, usually measured from sea level.","At high altitude, the reduced oxygen pressure forces mountaineers to acclimatize gradually.","high altitude; altitude sickness; gain altitude","C2"
"Accumulate","/əˈkjumjəˌleɪt/","v.","accumulate, accumulates, accumulated, accumulated, accumulating","accumulation (n.), accumulative (adj.)","To heap up in a mass; to pile up; to collect or bring together (either literally or figuratively), often gradually and without active intent.","These normally play an important role in controlling the growth of algae and also forage on detritus that accumulates as sediment on the bottom.","accumulate debt; gradually accumulate; accumulate savings","C2"
"Allege","/əˈlɛdʒ/","v.","allege, alleges, alleged, alleged, alleging","allegation (n.)","To state under oath, to plead.","But they do not worship Hercules, alleging as a reason that he ravaged their country.","allege misconduct; the alleged victim; allegedly commit","C2"
"Ambiguity","/ˌæmbɪˈɡjuəti/","n.","ambiguity, ambiguities","ambiguous (adj.)","The state of being ambiguous; the state of leaving room for more than one interpretation.","The ambiguity in the contract wording gave rise to a protracted legal dispute between the two companies.","create ambiguity; resolve ambiguity; legal ambiguity","C2"
"Align","/əˈlaɪn/","v.","align, aligns, aligned, aligned, aligning","alignment (n.)","To form a line; to fall into line.","Simply put, excellence is involved engagement in something worthwhile that aligns with your values.","align with values; align interests; align politically","C2"
"Anthem","/ˈænθəm/","n.","anthem, anthems","None","A song of praise or loyalty, especially one adopted as the official song of a nation, organization, or movement.","The crowd stood in silence as the national anthem played before the championship game.","national anthem; play the anthem; anthem for a generation","C2"
"Annoyance","/əˈnɔɪəns/","n.","annoyance, annoyances","annoy (v.)","That which annoys.","A malicious applet can infect a computer system in many ways, including denial of service, invasion of privacy, and annoyance.","express annoyance; source of annoyance; minor annoyance","C2"
"Analogy","/əˈnælədʒi/","n.","analogy, analogies","analogise (v.), analogist (n.), analogize (v.), analogous (adj.), analogical (adj.)","A relationship of resemblance or equivalence between two situations, people, or objects, especially when used as a basis for explanation or extrapolation.","Socrates uses various analogies, discussing athletics and the sciences to prove his point.","good analogy; relevant analogy; financial analogy","C2"
"Amplify","/ˈæmpləˌfaɪ/","v.","amplify, amplifies, amplified, amplified, amplifying","amplification (n.), amplifier (n.)","To render larger, more extended, or more intense.","But really, they're amplifying what's already there.","amplify the effect; greatly amplify; amplify the signal","C2"
"Anchor","/ˈæŋkɚ/","n.","anchor, anchors","anchorage (n.)","A tool used to moor a vessel to the bottom of a sea or river to resist movement.","The sailors dropped the anchor as soon as the ship reached the sheltered bay.","cast anchor; anchor point; serve as anchor","C2"
"Anticipation","/æˌntɪsəˈpeɪʃən/","n.","anticipation, anticipations","anticipate (v.)","The act of anticipating, taking up, placing, or considering something beforehand, or before the proper time in natural order.","Alongside Stoicism, Taoism has been said to have had ""significant anticipations"" of anarchism.","in anticipation; build anticipation; sense of anticipation","C2"
"Animate","/ˈænəmət/","v.","animate, animates, animated, animated, animating","animator (n.), animateness (n.)","To impart motion or the appearance of motion to.","Awards in short film categories (Best Documentary Short Subject, Best Animated Short Film, and Best Live Action Short Film) have different eligibility rules from most other competitive awards.","animate a character; animate the scene; digitally animate","C2"
"Analytical","/ˌænəˈlɪtɪkəl/","adj.","analytical, more analytical, most analytical","analysis (n.)","Of or pertaining to analysis; resolving into elements or constituent parts","This picture allows for an efficient contraction with a simple diagrammatic interpretation and is amenable to analytical study of holographic quantum error-correcting codes.","analytical skills; analytical approach; analytical framework","C2"
"Antibiotic","/ˌæntibiˈɑtɪk/","n.","antibiotic, antibiotics","None","a chemical substance derivable from a mold or bacterium that can kill microorganisms and cure bacterial infections","Environmental issues include greenhouse gas emissions from agriculture, depletion of aquifers, deforestation, antibiotic resistance, and Agricultural pollution.","prescribe antibiotics; antibiotic resistance; take antibiotics","C2"
"Antonym","/ˈæn.təˌnɪm/","n.","antonym, antonyms","antonymous (adj.)","A word that has the opposite meaning of another word.","In linguistics, 'hot' and 'cold' are antonyms because each expresses the opposite meaning of the other.","near antonym; antonym pair; semantic antonym","C2"
"Applaud","/əˈplɔd/","v.","applaud, applauds, applauded, applauded, applauding","applauder (n.), applaudable (adj.)","To express approval (of something) by clapping the hands.","Some members of Congress applauded Obama's decision to extend diplomatic outreach, though others remained skeptical.","warmly applaud; applaud the decision; audience applauded","C2"
"Apprentice","/əˈpɹɛntəs/","n.","apprentice, apprentices","apprenticeship (n.)","A trainee, especially in a skilled trade.","When observing task demonstrations, human apprentices are able to identify whether a given task is executed correctly long before they gain expertise in performing that task.","trade apprentice; take on an apprentice; skilled apprentice","C2"
"Archaeology","/ˌɑɹkiˈɑlədʒi/","n. [U]","no changes","archaeologic (adj.), archaeologist (n.), archaeological (adj.)","the branch of anthropology that studies prehistoric people and their cultures","Resurrecting Ancient Practices If you're thinking of Indiana Jones, traditional archaeology is not that.","field archaeology; study archaeology; archaeology findings","C2"
"Assassinate","/əˈsæsəˌneɪt/","v.","assassinate, assassinates, assassinated, assassinated, assassinating","assassin (n.), assassinator (n.), assassination (n.)","To murder someone, especially an important person, by a sudden or obscure attack, especially for ideological or political reasons.","The spy was sent to assassinate the foreign minister during a public appearance.","attempt to assassinate; assassinate a leader; assassinated in cold blood","C2"
"Applicable","/ˈæpləkəbəl/","adj.","applicable, more applicable, most applicable","apply (v.), applicability (n.)","Suitable for application, relevant.","The framework scales in real-world scenarios, is compatible with downstream feature-based modeling, and is applicable in both supervised and unsupervised learning settings.","broadly applicable; widely applicable; applicable skills","C2"
"Ascend","/əˈsɛnd/","v.","ascend, ascends, ascended, ascended, ascending","ascent (n.), ascender (n.), ascendant (adj.), ascendent (adj.), ascension (n.), ascensive (adj.)","To move upward, to fly, to soar.","These networks have implications for evolution in rugged landscapes, allowing adaptation to proceed after a local fitness peak has been ascended.","ascend to power; slowly ascend; ascend the throne","C2"
"Aspire","/əˈspaɪɹ/","v.","aspire, aspires, aspired, aspired, aspiring","aspirer (n.), aspirant (adj.), aspiration (n.)","To have a strong desire or ambition to achieve something.","I hear from a lot of aspiring writers and authors who come to me for advice.","aspiring writer; aspiring musician; aspire for greatness","C2"
"Archive","/ˈɑˌɹkaɪv/","n.","archive, archives","archival (adj.), archivist (n.)","A place for storing earlier, and often historical, material. An archive usually contains documents (letters, records, newspapers, etc.) or other types of media kept for historical interest.","The museum keeps an extensive archive of letters and photographs from the war.","national archive; public archive; archive footage","C2"
"Approximate","/əˈpɹɑksəmət/","adj.","approximate, more approximate, most approximate","approximative (adj.)","close to a number or amount but not exact","The approximate cost of the trip is about three hundred dollars.","approximate value; approximate cost; approximate number","C2"
"Arithmetic","/ˌɛɹɪˈθmɛtɪk/","n. [U]","no changes","arithmetical (adj.), arithmetician (n.)","The mathematics of numbers (integers, rational numbers, real numbers, or complex numbers) under the operations of addition, subtraction, multiplication, and division.","The term ""arithmetic mean"" is preferred in some contexts in mathematics and statistics because it helps to distinguish it from other types of means, such as geometric mean and harmonic mean.","basic arithmetic; simple arithmetic; mental arithmetic","C2"
"Asthma","/ˈæzmə/","n. [U]","no changes","asthmatic (adj.)","A long-term respiratory condition, in which the airways may unexpectedly and suddenly narrow, often in response to an allergen, cold air, exercise, or emotional stress. Symptoms include wheezing, shortness of breath, chest tightness, and coughing.","E-cigarettes unnecessarily expose minors to health risks, these include respiratory health problems, such as exacerbations of asthma, bronchitis, and respiratory-tract irritation.","asthma attack; suffer from asthma; asthma symptoms","C2"
"Astray","/əsˈtɹeɪ/","adv.","no changes","None","Away from the proper path; in a wrong or unknown direction.","All he would describe would be a clever young intellectual who later was corrupted by Hollywood and went astray after spooks.","go astray; lead someone astray; wander astray","C2"
"Astronaut","/ˈæstɹəˌnɑt/","n.","astronaut, astronauts","astronautic (adj.), astronautical (adj.)","a person trained to travel in a spacecraft","It's true that if a big one of those happens in the direction where astronauts are unprotected from the Earth's magnetic field, they could die.","trained astronaut; astronaut mission; space astronaut","C2"
"Attainment","/əˈteɪnmənt/","n. [U]","no changes","attain (v.)","The act of attaining; the act of arriving at or reaching; the act of obtaining by effort or exertion.","Every great accomplishment, every great attainment, every great achievement in science, in the arts, in sports, in business, it was always years in the making.","educational attainment; academic attainment; attainment gap","C2"
"Attendant","/əˈtɛndənt/","n.","attendant, attendants","attend (v.), attendance (n.)","One who attends; one who works with or watches over someone or something.","But classic locomotion models fail when collective cooperation is called for, notably when an agent, say a first-aid attendant, needs to forge a path through a densely packed group.","flight attendant; gas station attendant; on-duty attendant","C2"
"Astronomer","/əsˈtɹɑnəmɚ/","n.","astronomer, astronomers","None","a physicist who studies astronomy","After years of study, she became an astronomer who mapped the distant galaxies.","professional astronomer; amateur astronomer; astronomer discovers","C2"
"Auditorium","/ˌɔdəˈtɔɹiəm/","n.","auditorium, auditoriums","None","A large room for public meetings or performances.","The graduation ceremony was held in the main auditorium of the university.","packed auditorium; school auditorium; auditorium seats","C2"
"Astronomy","/əsˈtɹɑnəmi/","n. [U]","no changes","astronomic (adj.), astronomical (adj.)","the branch of physics that studies celestial bodies and the universe as a whole","She decided to study astronomy after watching a documentary about black holes.","study astronomy; astronomy club; astronomy observation","C2"
"Attain","/əˈteɪn/","v.","attain, attains, attained, attained, attaining","attainable (adj.), attainment (n.)","To come to or reach (a place) by motion or progression.","Those outcomes, they're wonderful and we should want to attain them.","attain a goal; attain success; attain high status","C2"
"Aviation","/ˌeɪviˈeɪʃən/","n. [U]","no changes","aviate (v.)","The art or science of making and flying aircraft.","But he was obsessed with solving the problem of aviation safety.","civil aviation; aviation industry; aviation safety","C2"
"Avert","/əˈvɝt/","v.","avert, averts, averted, averted, averting","aversion (n.), avertable (adj.), avertible (adj.)","To turn aside or away.","While network reciprocity promotes collaborative efforts, chances of averting the impending social decline are slim if the temptation to defect is strong.","avert a crisis; avert disaster; avert one's eyes","C2"
"Awhile","/əˈwaɪl/","adv.","no changes","None","for a short period of time","Please sit down and rest awhile before we continue the journey.","wait awhile; stay awhile; rest awhile","C2"
"Bachelor","/ˈbætʃəlɚ/","n.","bachelor, bachelors","bachelorhood (n.)","a man who has never been married","My uncle is a happy bachelor who enjoys living on his own.","confirmed bachelor; eligible bachelor; lifelong bachelor","C2"
"Audit","/ˈɔdɪt/","n.","audit, audits","auditor (n.)","A judicial examination.","The provision of natural language explanations for the predictions of deep-learning-based vehicle controllers is critical as it enhances transparency and easy audit.","financial audit; conduct an audit; annual audit","C2"
"Badge","/ˈbædʒ/","n.","badge, badges","None","A distinctive mark, token, sign, emblem or cognizance, worn on one’s clothing, as an insignia of some rank, or of the membership of an organization.","The United States Air Force also presents an Astronaut Badge to its pilots who exceed in altitude.","new badge; digital badge; verified badge","C2"
"Batter","/ˈbætɚ/","v.","batter, batters, battered, battered, battering","bat (v.)","To hit or strike violently and repeatedly.","Fierce waves continued to batter the old wooden pier throughout the long stormy night.","batter down the door; storm battered; batter with rain","C2"
