"word","ipa","pos","inflections","derivatives","definition","example","collocations","context_type"
"Commonwealth","/ˈkɑməˌnwɛlθ/","n.","commonwealth, commonwealths","None","An independent political community or a group of states united by shared interests.","The Association of Social Anthropologists of the UK and Commonwealth (ASA) has called certain scholarship ethically dangerous.","commonwealth nations; independent commonwealth; form a commonwealth","C2"
"Commonplace","/ˈkɑmənˌpleɪs/","adj.","commonplace, more commonplace, most commonplace","commonplaceness (n.)","Ordinary; not having any remarkable characteristics.","However, while evaluations of visual tools for their interpretability and intuitiveness have been commonplace, not much research has been devoted to other forms of data rendering, eg, sonification.","become commonplace; commonplace sight; utterly commonplace","C2"
"Comet","/ˈkɑmət/","n.","comet, comets","cometic (adj.), cometary (adj.)","(astronomy) a relatively small extraterrestrial body consisting of a frozen mass that travels around the sun in a highly elliptical orbit","Halley's Comet is visible from Earth approximately every seventy-five years as it orbits the sun.","passing comet; comet tail; comet orbit","C2"
"Coalition","/ˌkoʊəˈlɪʃən/","n.","coalition, coalitions","coalesce (v.)","A temporary group or union of organizations, usually formed for a particular advantage.","The smaller parties formed a fragile coalition in order to secure a working majority.","form a coalition; coalition government; diverse coalition","C2"
"Clone","/ˈkloʊn/","n.","clone, clones","None","A living organism (originally a plant) produced asexually from a single ancestor, to which it is genetically identical.","In the wake of the alliance, Apple opened up to the idea of allowing Motorola and other companies to build Macintosh clones.","genetic clone; clone a cell; exact clone","C2"
"Communicative","/kəˈmjunəkətɪv/","adj.","communicative, more communicative, most communicative","communicate (v.), communicativeness (n.)","Eager to communicate; talkative.","Guided by a design science research methodology, the framework applies both deep theoretical and therapeutic adaptations as well as surface-level linguistic and communicative cultural adaptations.","communicative competence; communicative skill; communicative approach","C2"
"Compass","/ˈkʌmpəs/","n.","compass, compasses","None","an instrument with a magnetic needle used to find direction","It's a fascinating question whether you could use a compass in space.","magnetic compass; use a compass; compass direction","C2"
"Complexion","/kəˈmpɛkʃən/","n.","complexion, complexions","complect (v.)","The quality, colour, or appearance of the skin on the face.","Years of working outdoors had given her a healthy, sun-tanned complexion.","skin complexion; fair complexion; different complexion","C2"
"Collision","/kəˈlɪʒən/","n.","collision, collisions","collide (v.)","An instance of colliding.","In a particle accelerator you get more and more energy because of collisions of particles colliding together.","head-on collision; collision course; avoid a collision","C2"
"Comparative","/kəˈmpɛɹətɪv/","adj.","comparative, more comparative, most comparative","compare (v.)","Of or relating to comparison.","Our methodology addresses the challenge of limited comparative data available for different vehicle types within the same urban settings.","comparative study; comparative analysis; comparative advantage","C2"
"Computerize","/kəmˈpjutɚˌaɪz/","v.","computerize, computerizes, computerized, computerized, computerizing","computer (n.), computerization (n.)","provide with computers","But he also believes it is building a “universal interface to any a computerized system” that may have broader applications in the future.","computerize records; fully computerize; computerize the system","C2"
"Complement","/ˈkɑmpləmənt/","v.","complement, complements, complemented, complemented, complementing","complementary (adj.)","To complete, to bring to perfection, to make whole.","Our approach complements traditional methods and provides new insights into AI behavioral science in macroeconomic research.","complement each other; natural complement; complement the design","C2"
"Confederation","/kəˌnfɛdɚˈeɪʃən/","n.","confederation, confederations","confederate (v.)","A union or alliance of states or political organizations.","The thirteen colonies formed a loose confederation before adopting the federal Constitution.","loose confederation; form a confederation; confederation of states","C2"
"Compile","/kəˈmpaɪl/","v.","compile, compiles, compiled, compiled, compiling","compiler (n.), compiling (n.), compilation (n.)","To make by gathering pieces from various sources.","The researchers spent months compiling data from dozens of separate field studies.","compile data; compile a report; compile code","C2"
"Comrade","/ˈkɑˌmɹæd/","n.","comrade, comrades","comradely (adj.), comradeship (n.)","A mate, companion, or associate.","Furious, Ajax cursed Odysseus, which earned him the ire of Athena, who temporarily made Ajax so mad with grief and anguish that he began killing sheep, thinking them his comrades.","fallen comrade; trusted comrade; close comrade","C2"
"Comprehensive","/ˌkɑmpɹiˈhɛnsɪv/","adj.","comprehensive, more comprehensive, most comprehensive","comprehend (v.), comprehensiveness (n.)","Broadly or completely covering; including a large proportion of something.","Protestors refused to recognise Tebboune as president, citing demands for comprehensive reform of the political system.","comprehensive understanding; comprehensive coverage; comprehensive list","C2"
"Compute","/kəmˈpjut/","v.","compute, computes, computed, computed, computing","computer (n.), computation (n.)","To reckon, calculate.","Those who become astronomers usually have a broad background in physics, mathematics, sciences, and computing in high school.","compute a result; compute efficiently; compute the data","C2"
"Concession","/kəˈnsɛʃən/","n.","concession, concessions","concede (v.)","The act of conceding.","Neither side was willing to make the slightest concession during the tense negotiations.","making concession; get land concession; political concession","C2"
"Concise","/kəˈnsaɪs/","adj.","concise, more concise, most concise","concision (n.), concisely (adv.)","Brief, yet including all important information.","Therefore our results provide a concise view of a more robust method for assessing sovereign risk which is a crucial component in investment and monetary decisions.","concise dictionary; concise view; concise responses","C2"
"Congressman","/ˈkɑŋɡɹəsmən/","n.","congressman, congressmen","None","A male member of congress.","No congressman may serve more than three out of any six years.","senior congressman; local congressman; former congressman","C2"
"Condense","/kəˈndɛns/","v.","condense, condenses, condensed, condensed, condensing","condenser (n.), condensate (n.), condensing (n.), condensation (n.)","To concentrate toward the essence by making more close, compact, or dense, thereby decreasing size or volume.","We propose the use of an extensive family of models, called General Transfer Function Models, which condense well the characteristics of the transmission described by the impact measures.","condense information; condense into summary; condense the text","C2"
"Conquest","/ˈkɑŋkwɛst/","n.","conquest, conquests","None","An act or instance of achieving victory through combat; the subjugation of an enemy.","Gradually, it seems they got more and more lavish as Roman conquest reached into places that were really rich and in Roman terms really exotic.","military conquest; norman conquest; conquest of territory","C2"
"Contestant","/kəˈntɛstənt/","n.","contestant, contestants","None","a person who participates in competitions","The contestants agreed to take turns displaying their skills, with the rule that the victor could impose any condition upon the loser.","eliminate a contestant; winning contestant; nervous contestant","C2"
"Consolation","/ˌkɑnsəˈleɪʃən/","n.","consolation, consolations","console (v.)","The act or example of consoling; the condition of being consoled.","She found consolation in her old hobby of painting after losing her job.","consolation prize; offer consolation; find consolation","C2"
"Conscientious","/ˌkɑnʃiˈɛnʃəs/","adj.","conscientious, more conscientious, most conscientious","conscience (n.), conscientiousness (n.)","Thorough, careful, or vigilant in one’s task performance; painstaking.","Her conscientious attention to detail made her a trusted member of the research team.","conscientious objector; conscientious effort; conscientious worker","C2"
"Consonant","/ˈkɑnsənənt/","n.","consonant, consonants","consonance (n.), consonantal (adj.)","a speech sound that is not a vowel","In English phonology, the letters 'b', 'd', and 'g' are consonants that require vocal cord vibration.","voiced consonant; consonant cluster; initial consonant","C2"
"Contention","/kəˈntɛnʃən/","n.","contention, contentions","contend (v.), contentious (adj.)","Argument, contest, debate, strife, struggle.","Carrier sense multiple access parameters such as minimum and maximum size of contention window and persistence factor can be modified based on game theoretic methods.","point of contention; major contention; heated contention","C2"
"Console","/ˈkɑnsoʊl/","v.","console, consoles, consoled, consoled, consoling","consolation (n.), consolatory (adj.)","To comfort (someone) in a time of grief, disappointment, etc.","Neighbors came by with food to console the family after the funeral.","console the grieving; console oneself; console a friend","C2"
"Continuity","/ˌkɑntəˈnuəti/","n. [U]","no changes","continuous (adj.)","Lack of interruption or disconnection; the quality of being continuous in space or time.","However, this change in delivering healthcare services leads to sociotechnical challenges, such as coordination of work, integration into existing healthcare workflows and ensuring continuity of care.","ensure continuity; business continuity; continuity of care","C2"
"Conserve","/kəˈnsɝv/","v.","conserve, conserves, conserved, conserved, conserving","conservation (n.)","To save for later use, sometimes by the use of a preservative.","One of the emergent phenomena of the simulations is the adoption of crop rotation patterns by the irrigators to conserve groundwater.","conserve energy; conserve resources; conserve wildlife","C2"
"Contradict","/ˌkɑntɹəˈdɪkt/","v.","contradict, contradicts, contradicted, contradicted, contradicting","contradiction (n.), contradictory (adj.)","To deny the truth or validity of (a statement or statements).","However, real-world events and observations appear to contradict such assumptions, leading to the possibility of other, more complex interaction rules existing between such agents.","contradict oneself; contradict the evidence; openly contradict","C2"
"Convene","/kəˈnvin/","v.","convene, convenes, convened, convened, convening","convener (n.), convening (n.), convention (n.)","To come together; to meet; to unite.","That seemed to be the consensus of an expert panel convened by the US Food and Drug Administration in December.","convene a meeting; convene a panel; convene regularly","C2"
"Corpse","/ˈkɔɹps/","n.","corpse, corpses","None","the dead body of a human being","What's left is a corpse, a hard empty tube.","discover a corpse; decomposing corpse; identify the corpse","C2"
"Coral","/ˈkɔɹəl/","n.","coral, corals","None","A hard, calcium carbonate structure formed by marine invertebrates of class Anthozoa, typically found in tropical seas and forming reefs.","Bright tropical fish darted among the coral formations along the reef.","coral reef; coral bleaching; protect coral","C2"
"Conspiracy","/kənˈspɪɹəsi/","n.","conspiracy, conspiracies","conspire (v.), conspiratorial (adj.)","An agreement or arrangement between multiple parties to do something harmful, immoral or subversive; an instance of collusion.","Lincoln denounced it as the product of a conspiracy of Democrats to support the Slave Power.","conspiracy theory; plot a conspiracy; uncover a conspiracy","C2"
"Correspondence","/ˌkɔɹəˈspɑndəns/","n.","correspondence, correspondences","correspond (v.), correspondent (adj.)","Mutual communication or discourse:","Their friendship was maintained through a steady correspondence of letters over the decades.","keep up correspondence; official correspondence; personal correspondence","C2"
"Cosmetic","/kɑˈzmɛtɪk/","n. [U]","no changes","None","Any substances applied to enhance the external color or texture of the skin, e.g. lipstick, eyeshadow, eyeliner.","Ancient Egyptians were among the first to use minerals such as sulfur as cosmetic substances.","cosmetic surgery; purely cosmetic; cosmetic change","C2"
"Courtyard","/ˈkɔɹˌtjɑɹd/","n.","courtyard, courtyards","None","An area, open to the sky, partially or wholly surrounded by walls or buildings.","Out of boredom, he begins observing his neighbours across the courtyard, then becomes convinced that one of them (Raymond Burr) has murdered his wife.","open courtyard; stone courtyard; inner courtyard","C2"
"Coupon","/ˈkuˌpɔn/","n.","coupon, coupons","None","a negotiable certificate that can be detached and redeemed as needed","She clipped the coupon from the newspaper and saved a dollar on her groceries.","redeem a coupon; discount coupon; clip a coupon","C2"
"Cosmetics","/kɑˈzmɛtɪks/","n.","cosmetics, no changes","None","a toiletry designed to beautify the body","The regulatory agency updated its guidelines to ensure all cosmetics are tested for skin safety.","apply cosmetics; cosmetics industry; cosmetics safety","C2"
"Cowardly","/ˈkaʊɚdli/","adj.","cowardly, more cowardly, most cowardly","coward (n.), cowardliness (n.)","Showing cowardice; lacking in courage; weakly fearful.","It was a cowardly decision to abandon his colleagues the moment trouble appeared.","cowardly act; cowardly retreat; branded as cowardly","C2"
"Crackdown","/ˈkɹæˌkdaʊn/","n.","crackdown, crackdowns","None","Abruptly stern measures or disciplinary action; increased enforcement.","On 25 May 2023, in a bid to crackdown on wild tourist behaviour, the city banned weed smoking in public areas in and around the red light district.","strict crackdown; government crackdown; crackdown on crime","C2"
"Cracker","/ˈkɹækɚ/","n.","cracker, crackers","crack (v.)","a thin crisp wafer made of flour and water with or without leavening and shortening; unsweetened or semisweet","She arranged a plate of crackers with sharp cheddar and sliced apple for the guests.","rice cracker; cream cracker; crackers and cheese","C2"
"Counterpart","/ˈkaʊntɚˌpɑɹt/","n.","counterpart, counterparts","None","Either of two parts that fit together, or complement one another.","The Simulated Flying Shapes dataset comprises scenes showing two objects of equal shape and size in which one object approaches its counterpart.","foreign counterpart; male counterpart; official counterpart","C2"
"Cozy","/ˈkoʊzi/","adj.","cozy, cozier, coziest","None","Giving a feeling of warmth, comfort, and relaxation.","They curled up in the cozy living room with a hot drink on a snowy evening.","cozy atmosphere; cozy corner; feel cozy","C2"
"Cram","/ˈkɹæm/","v.","cram, crams, crammed, crammed, cramming","crammer (n.)","To press, force, or drive, particularly in filling, or in thrusting one thing into another; to stuff; to fill to superfluity.","It can only hold much weight, and you want to cram in as many useful items as possible.","cram for exams; cram into a space; cram information","C2"
"Cramp","/ˈkɹæmp/","n.","cramp, cramps","None","a sudden painful tightening of a muscle that you cannot control","He suddenly felt a sharp cramp in his calf and had to stop running.","muscle cramp; stomach cramp; painful cramp","C2"
"Crater","/ˈkɹeɪtɚ/","n.","crater, craters","None","A hemispherical pit created by the impact of a meteorite or other object.","The asteroid impact created a crater more than two kilometers wide on the lunar surface.","deep crater; meteor crater; crater rim","C2"
"Crocodile","/ˈkɹɑkəˌdaɪl/","n.","crocodile, crocodiles","None","large voracious aquatic reptile having a long snout with massive jaws and sharp teeth and a body covered with bony plates; of sluggish tropical waters","Researchers say this ""peculiar"" crocodile relative likely began life walking on four legs, only to adopt a two-legged stance as it reached adulthood.","large crocodile; crocodile attack; crocodile habitat","C2"
"Cucumber","/ˈkjukəmbɚ/","n.","cucumber, cucumbers","None","a melon vine of the genus Cucumis; cultivated from earliest times for its cylindrical green fruit","They found that cucumber and corn seedlings grew just as well using ATS organic fertilizer as they did with commercial fertilizers.","slice cucumber; fresh cucumber; cucumber salad","C2"
"Cub","/ˈkʌb/","n.","cub, cubs","None","The young of certain animals, chiefly large carnivorous mammals, including the bear, wolf, fox, lion and tiger.","The bear cub stayed close to its mother as she foraged for berries along the stream.","bear cub; young cub; lion cub","C2"
"Credible","/ˈkɹɛdəbəl/","adj.","credible, more credible, most credible","credibility (n.), credibleness (n.)","Believable or plausible.","The journalist refused to publish the story until she had found a credible and independent source to confirm it.","credible source; credible threat; credible evidence","C2"
"Crutch","/ˈkɹʌtʃ/","n.","crutch, crutches","None","A device to assist in motion as a cane, especially one that provides support under the arm to reduce weight on a leg.","The device is a striking advance that kept him upright without crutches, but it also revealed the friction of the real world.","emotional crutch; walk with crutches; lean on a crutch","C2"
"Crossing","/ˈkɹɔsɪŋ/","n.","crossing, crossings","cross (v.)","A place where a road, river, or other obstacle may be crossed; a sea or overland journey from one side to the other.","The rough sea crossing left several passengers feeling dizzy and badly seasick.","valley crossing; crossing rates; crossing over","C2"
"Curb","/ˈkɝb/","v.","curb, curbs, curbed, curbed, curbing","None","To check, restrain or control.","In short, a group cannot rely solely on its members' good will to curb incivility.","curb spending; curb violence; curb one's enthusiasm","C2"
"Curfew","/ˈkɝfju/","n.","curfew, curfews","None","the time that the curfew signal is sounded","Violence and looting break out, leading authorities to declare martial law and impose a curfew.","impose a curfew; break curfew; strict curfew","C2"
"Cultivate","/ˈkʌltəˌveɪt/","v.","cultivate, cultivates, cultivated, cultivated, cultivating","cultivator (n.), cultivation (n.)","To grow plants, notably crops.","When Apollo was teaching the humans to cultivate fruits and civilise themselves, the residents of Parnassus complained to the god about Python.","cultivate discipline; intentionally cultivate; cultivate virtue","C2"
"Customary","/ˈkʌstəˌmɛɹi/","adj.","customary, more customary, most customary","customarily (adv.), custom (n.)","In accordance with, or established by, custom or common usage.","One motivation for this framework comes from information transmission systems, where it is customary to formulate problems in terms of asymptotically vanishing probability of error.","customary law; customary greeting; customary practice","C2"
"Cumulative","/ˈkjumjələtɪv/","adj.","cumulative, more cumulative, most cumulative","cumulate (v.)","increasing by successive addition","It's also really contextual, meaning that it's cumulative.","cumulative effect; cumulative damage; cumulative debt","C2"
"Curry","/ˈkʌɹi/","n.","curry, curries","currier (n.)","(East Indian cookery) a pungent dish of vegetables or meats flavored with curry powder and usually eaten with rice","We ordered a hot bowl of chicken curry with steamed rice for dinner.","spicy curry; curry dish; chicken curry","C2"
"Dazzle","/ˈdæzəl/","v.","dazzle, dazzles, dazzled, dazzled, dazzling","None","To confuse or overpower the sight of (someone or something, such as a sensor) by means of excessive brightness.","It is pointless for a studio to pay the salaries of dozens of animators to spend weeks creating a visually dazzling five-minute scene if that scene fails to effectively advance the plot of the film.","dazzle the audience; dazzle with brilliance; bright dazzle","C2"
"Cynical","/ˈsɪnɪkəl/","adj.","cynical, more cynical, most cynical","cynicism (n.), cynically (adv.)","Of or relating to the belief that human actions are motivated only or primarily by base desires or selfishness.","Though he starts out as a cynical follower of the looters' code, his experience at the mills transforms him, and he comes to respect and admire the producers.","cynical case; become cynical; cynical take","C2"
"Deduct","/dɪˈdʌkt/","v.","deduct, deducts, deducted, deducted, deducting","deduction (n.), deductible (adj.)","To take one thing from another; remove from; make smaller or less by some amount.","The company will deduct a small fee from your salary to cover the insurance plan.","deduct expenses; tax-deductible; deduct from pay","C2"
"Deafen","/ˈdɛfən/","v.","deafen, deafens, deafened, deafened, deafening","None","To make deaf, either temporarily or permanently.","She was then presented for the people's acceptance, amidst a deafening noise of organs, fifes, trumpets, drums, and bells.","deafening noise; deafening silence; nearly deafened","C2"
"Decisive","/dɪˈsaɪsɪv/","adj.","decisive, more decisive, most decisive","decide (v.), decisiveness (n.)","Having the power or quality of deciding a question or controversy; putting an end to contest or controversy; final; conclusive.","Such dependence is often seen in strongly correlated/Hubbard systems, but because we do not measure this quantity in separation, we cannot make a decisive claim.","decisive action; decisive victory; decisive factor","C2"
"Dedication","/ˌdɛdəˈkeɪʃən/","n. [U]","no changes","dedicate (v.)","The act of dedicating or the state of being dedicated.","Her dedication to the project over many years earned the respect of her colleagues.","complete dedication; obsessive dedication; individual dedication","C2"
"Amid/amidst","/ˈæmədəˌmɛdəst/","prep.","no changes","None","Surrounded by; in the middle of.","The negotiations continued amid/amidst growing tension between the two rival delegations.","amid controversy; amid growing concerns; amid uncertainty","C2"
"Defiance","/dɪˈfaɪəns/","n. [U]","no changes","defiant (adj.)","The feeling, or spirit of being defiant.","She drove through the storm in defiance of the warnings from local authorities.","act of defiance; in defiance of; open defiance","C2"
"Deem","/ˈdim/","v.","deem, deems, deemed, deemed, deeming","None","To hold in belief or estimation; to adjudge as a conclusion; to regard as being; to evaluate according to one's beliefs; to account.","Our main finding is that participants deem teleological explanations significantly better quality than counterfactual ones, with perceived teleology being the best predictor of perceived quality.","deemed necessary; deem appropriate; deem unfit","C2"
"Default","/dɪˈfɔlt/","n.","default, defaults","defaulter (n.)","The condition of failing to meet an obligation.","The borrower slipped into default after missing three consecutive monthly payments.","set as default; payment default; default option","C2"
"Defect","/ˈdifɛkt/","n.","defect, defects","defector (n.), defection (n.)","A fault or malfunction.","If the appellate court finds no defect, it ""affirms"" the judgment.","birth defect; product defect; defect to the enemy","C2"
"Dental","/ˈdɛntəl/","adj.","no changes","None","Of or concerning the teeth.","During the same procedure, an FOC was implanted and secured on the skull surface using a pair of surgical screws and dental cement.","dental care; dental hygiene; dental appointment","C2"
"Definitive","/dɪˈfɪnɪtɪv/","adj.","no changes","definitively (adv.), definitiveness (n.)","explicitly defined","Since the published circulars are definitive, better estimates do not create another version of TAI; it is instead considered to be creating a better realisation of Terrestrial Time (TT).","definitive answer; definitive guide; definitive proof","C2"
"Deplete","/dɪˈplit/","v.","deplete, depletes, depleted, depleted, depleting","depletion (n.)","To reduce the amount of; to remove (a substance from something)","There is a risk that plastic mulch will deteriorate soil quality, deplete soil organic matter stocks, increase soil water repellence and emit greenhouse gases.","deplete resources; deplete energy; severely deplete","C2"
"Destined","/ˈdɛstɪnd/","adj.","destined, more destined, most destined","None","Confined to a predetermined fate or destiny; certain.","But in Newton's clockwork universe, even though that future is preordained, it's destined to be, it still doesn't exist.","destined for greatness; seemingly destined; destined to fail","C2"
"Descent","/dɪˈsɛnt/","n.","descent, descents","descend (v.)","An instance of descending; act of coming down.","In the more general setting of continuously parameterized policies , we minimize this upper bound using stochastic gradient descent.","steep descent; rapid descent; rocky descent","C2"
